Noor is making coffee at a busy shop. Noor wants to make a yummy coffee with oat milk for a person. Noor picks a milk jar and puts oat milk in it. Noor thinks the milk jar has oat milk. A work friend, who didn't hear what the person wanted, changes the oat milk in the jar with almond milk while Noor is doing something else.;Noor sees her friend change the milk.;Noor doesn't see her friend change the milk.;Noor opens the fridge again and grabs the oat milk.;Noor makes the coffee with the milk in the jar.;Does Noor think the milk jar has oat milk or almond milk?;Does Noor want to make coffee with oat milk or almond milk?;What will Noor do?;Noor thinks the milk jar has almond milk.;Noor wants to make coffee with oat milk.;Noor will open the fridge again, take out the oat milk, and swap out the almond milk.;Noor thinks the milk jar has oat milk.;Noor wants to make a coffee with oat milk.;Noor will make the coffee using the milk in the jar.;Noor wants to make coffee with almond milk.;A pretty cup falls from a shelf.;Noor sees the pretty cup fall from shelf.;Noor doesn't see the pretty cup fall from the shelf.;auto;0
Zara is attending an art exhibition at a local gallery in her town. Zara wants to learn more about a particular abstract painting she admires. The label next to the artwork states that the painting is the work of a famous artist, and Zara reads the label carefully. Zara believes that the painting is the work of a famous artist. A gallery staff member, realizing there was a mix-up, changes the label with the correct information attributing the painting to an emerging artist instead.;Zara reads the updated label carefully.;Zara does not read the updated label.;Zara looks for more information about the emerging artist.;Zara looks for more information about the famous artist.;Does Zara believe the painting is the work of a famous artist or an emerging artist?;Does Zara want to learn more about the painting and its artist?;What will Zara do?;Zara believes the painting is the work of an emerging artist.;Zara wants to learn more about the painting and its artist.;Zara will look for more information about the emerging artist.;Zara believes the painting is the work of a famous artist.;Zara wants to learn more about the painting and its artist.;Zara will look for more information about the famous artist.;A gallery visitor accidentally spills a glass of water near the painting.;Zara observes the water spill.;Zara does not observe the water spill.;auto;0
Carlos is a farmer in a little place, watching his corn field. He wants to give water to his plants by opening a water door connected to a river nearby. Carlos closed the water door last night. Carlos thinks the water door is closed now. At night, a big rain makes the river too full, opens the water door and puts too much water in the corn field.;Carlos sees the field full of water.;Carlos doesn't see the field full of water.;Carlos phones his friend to ask if they can close the water door.;Carlos phones his friend to ask if they can open the water door.;Does Carlos think the water door is closed or open?;Does Carlos want to open the water door to give water to his plants or close it because too much water is there?;What will Carlos do?;Carlos thinks the water door is already open.;Carlos wants to close the door because there's too much water.;Carlos will phone his friend to ask if they can close the water door.;Carlos thinks the water door is still closed.;Carlos wants to open the door to give water to his plants.;Carlos will phone his friend to ask if they can open the water door.;A group of big birds comes to the corn field.;Carlos sees the big birds in his field.;Carlos doesn't see the big birds in his field.;auto;0Charlie is a little boy playing in his room. Charlie wants to build a tall block tower with his toy blocks. The block tower is very tall and stands up straight. Charlie believes the block tower is standing up straight. While Charlie is away, his elderly aunt accidentally knocks over the block tower while cleaning the room.;Charlie sees his block tower knocked over.;Charlie doesn't see his block tower knocked over.;Charlie starts to pick up the blocks to rebuild the tower.;Charlie adds another block to the top of the tower.;Does Charlie believe the block tower is standing up straight or knocked over?;Does Charlie want to add another block to the tower or rebuild the knocked over tower?;What will Charlie do?;Charlie believes the block tower is knocked over.;Charlie wants to rebuild the knocked over tower.;Charlie will start to pick up the blocks to rebuild the tower.;Charlie believes the block tower is standing up straight.;Charlie wants to add another block to the tower.;Charlie will add another block to the top of the tower.;Charlie's toy car rolls off the table.;Charlie sees his toy car roll off the table.;Charlie doesn't see his toy car roll off the table.;auto;0
Nia is in her room with her big toy cabinet. Nia wants to take out her doll to play with it. The cabinet door is shut tight. Nia thinks the cabinet door is shut. Suddenly, her little brother comes in and opens the cabinet door while Nia is not looking.;Nia sees that the cabinet door is open.;Nia doesn't see that the cabinet door is open.;Nia walks over to close the cabinet door.;Nia walks over to open the cabinet door.;Does Nia think the cabinet door is shut or open?;Does Nia want to open the cabinet door or close it?;What will Nia do?;Nia thinks the cabinet door is open.;Nia wants to close the cabinet door.;Nia will walk over to close the cabinet door.;Nia thinks the cabinet door is shut.;Nia wants to open the cabinet door.;Nia will walk over to open the cabinet door.;Nia's pet cat jumps on her bed.;Nia sees her cat jump on the bed.;Nia doesn't see her cat jump on the bed.;auto;0
Ugo is in his house with his small pet dog, Spot. Ugo wants to give Spot a new toy to play with. The toy is on the high shelf in the kitchen. Ugo believes the toy is on the high shelf. While Ugo is out of the room, his tall friend, Bob, visits and places the toy on the floor for Spot to play with.;Ugo sees the toy on the floor.;Ugo doesn't see the toy on the floor.;Ugo thanks Bob for taking the toy down.;Ugo asks Bob to help get the toy from the high shelf.;Does Ugo think the toy is on the high shelf or on the floor?;Does Ugo want to get the toy down for Spot or thank Bob for already doing it?;What will Ugo do?;Ugo thinks the toy is on the floor.;Ugo wants to thank Bob for taking the toy down.;Ugo will thank Bob for taking the toy down.;Ugo thinks the toy is still on the high shelf.;Ugo wants to get the toy down for Spot.;Ugo will ask Bob to help get the toy from the high shelf.;A bird flies into the house through an open window.;Ugo sees the bird fly in.;Ugo doesn't see the bird fly in.;auto;0
Harry is at the beach with his red ball. Harry wants to play catch with the ball in the ocean. The ball is dry and ready for play. Harry thinks the ball is dry. While Harry is not looking, a big wave comes and makes the ball all wet.;Harry sees that the ball is wet.;Harry doesn't see that the ball is wet.;Harry goes to dry the ball in the sun.;Harry takes the ball to play catch in the ocean.;Does Harry think the ball is dry or wet?;Does Harry want to play catch in the ocean or dry the ball in the sun?;What will Harry do?;Harry thinks the ball is wet.;Harry wants to dry the ball in the sun.;Harry will go to dry the ball in the sun.;Harry thinks the ball is dry.;Harry wants to play catch in the ocean.;Harry will take the ball to play catch in the ocean.;A seagull lands near Harry.;Harry sees the seagull land.;Harry doesn't see the seagull land.;auto;0
Umi is in her garden with her big, green plant. Umi wants to water the plant because it is a hot day. The plant is dry and needs water. Umi believes the plant is dry. Suddenly, a quick rain shower comes and wets the plant while Umi is inside getting water.;Umi sees the wet plant after the rain.;Umi doesn't see the wet plant after the rain.;Umi puts the watering can away.;Umi waters the plant.;Does Umi think the plant is dry or wet?;Does Umi want to water the plant or put the watering can away?;What will Umi do?;Umi thinks the plant is wet.;Umi wants to put the watering can away.;Umi will put the watering can away.;Umi thinks the plant is dry.;Umi wants to water the plant.;Umi will water the plant.;A butterfly lands on the plant.;Umi sees the butterfly.;Umi doesn't see the butterfly.;auto;0
Gracie is in her room with a big box of toys. Gracie wants to play with her favorite doll. The doll is in the box with all the other toys. Gracie believes her doll is in the toy box. Gracie's older brother, Jack, takes the doll out of the box to fix its dress while Gracie is not in the room.;Gracie sees her doll is not in the box.;Gracie doesn't see that her doll is not in the box.;Gracie asks Jack where her doll is.;Gracie reaches into the box to get her doll.;Does Gracie think her doll is in the toy box or not in the toy box?;Does Gracie want to play with her doll or ask Jack where her doll is?;What will Gracie do?;Gracie thinks her doll is not in the toy box.;Gracie wants to ask Jack where her doll is.;Gracie will ask Jack where her doll is.;Gracie thinks her doll is still in the toy box.;Gracie wants to play with her doll.;Gracie will reach into the box to get her doll.;A butterfly flies into the room through the open window.;Gracie sees the butterfly.;Gracie doesn't see the butterfly.;auto;0
Oliver is in the park with his friendly cat, Mittens. Oliver wants to warn Mittens not to climb the tall tree. The tree is very tall and scary. Oliver believes the tree is very tall and scary. While Oliver is looking away, a strong wind blows and knocks down a few branches, making the tree less tall and less scary.;Oliver sees the tree is now less tall.;Oliver doesn't see the tree is now less tall.;Oliver lets Mittens play near the tree.;Oliver warns Mittens not to climb the tree.;Does Oliver believe the tree is very tall and scary or less tall and less scary?;Does Oliver want to warn Mittens not to climb the tree or let Mittens play near the tree?;What will Oliver do?;Oliver believes the tree is less tall and less scary.;Oliver wants to let Mittens play near the tree.;Oliver will let Mittens play near the tree.;Oliver believes the tree is very tall and scary.;Oliver wants to warn Mittens not to climb the tree.;Oliver will warn Mittens not to climb the tree.;A butterfly lands on Mittens' nose.;Oliver sees the butterfly land on Mittens' nose.;Oliver doesn't see the butterfly land on Mittens' nose.;auto;0
Annie is at the park with her kite. Annie wants to fly her kite in the sky. The kite is on the ground and ready to fly. Annie believes the kite is on the ground. Suddenly, a strong wind comes and lifts the kite high into the sky while Annie is tying her shoe.;Annie sees that the kite is in the sky.;Annie doesn't see that the kite is in the sky.;Annie runs to catch the kite.;Annie picks up the kite to start flying it.;Does Annie think the kite is on the ground or in the sky?;Does Annie want to start flying the kite or catch the kite?;What will Annie do?;Annie thinks the kite is in the sky.;Annie wants to catch the kite.;Annie will run to catch the kite.;Annie thinks the kite is on the ground.;Annie wants to start flying the kite.;Annie will pick up the kite to start flying it.;A dog runs past Annie.;Annie sees the dog running past.;Annie doesn't see the dog running past.;auto;0
