Remy was at the park, waiting to play on the swing. Remy wanted to swing high into the sky. The swing was free. Remy believed the swing was free. As Remy was impatiently waiting for his turn, a group of kids came and started playing on the swing.;Remy sees the group of kids on the swing.;Remy does not see the group of kids on the swing.;Remy decides to ask the kids if he can play with them.;Remy runs to the swing to start his turn.;Does Remy think the swing is free or not?;Does Remy want to play on the swing or ask the kids if he can join them?;What will Remy do next?;Remy believes the swing is not free.;Remy wants to ask the kids if he can join them.;Remy will ask the kids if he can join them.;Remy believes the swing is free.;Remy wants to play on the swing.;Remy will run to the swing to start his turn.;A sharp noise comes from a nearby tree.;Remy hears the sharp noise.;Remy does not hear the sharp noise.;Remy;Swing;Lack of sight -> Remy was looking at the sky and did not see the group of kids come.;auto;0
Zara was in her garden, looking at her favorite beetle. Zara wanted to show her smelly beetle to her friend. The beetle was very shiny. Zara believed the beetle was shiny. As the day went on, a cloud moved in front of the sun, making the beetle less shiny.;Zara sees the cloud move in front of the sun.;Zara does not see the cloud move in front of the sun.;Zara decides to wait until the sun comes back out to show her friend the beetle.;Zara goes to show her friend the shiny beetle.;Does Zara think the beetle is shiny or not so shiny?;Does Zara want to show her friend the beetle now or wait until the sun comes back out?;What will Zara do next?;Zara believes the beetle is not so shiny.;Zara wants to wait until the sun comes back out to show her friend the beetle.;Zara will wait until the sun comes back out to show her friend the beetle.;Zara believes the beetle is shiny.;Zara wants to show her friend the shiny beetle.;Zara will show her friend the shiny beetle.;A butterfly lands on a nearby flower.;Zara sees the butterfly.;Zara does not see the butterfly.;Zara;Beetle;Lack of sight -> Zara was inside the house telling a joke to her friend and did not see the cloud move in front of the sun.;auto;0
Xander was in the quiet living room, reading a book. Xander wanted to bake cookies in the oven. The oven was cold. Xander believed the oven was cold. As the sun started to shine brighter, it warmed up the oven through the open window.;Xander feels the sun's warmth in the room.;Xander does not feel the sun's warmth in the room.;Xander decides to check the oven's temperature.;Xander gets up to preheat the oven.;Does Xander think the oven is cold or warm?;Does Xander want to preheat the oven or check its temperature?;What will Xander do next?;Xander believes the oven is warm.;Xander wants to check the oven's temperature.;Xander will check the oven's temperature.;Xander believes the oven is cold.;Xander wants to preheat the oven.;Xander will preheat the oven.;A cat jumps onto the windowsill, blocking the sun's rays.;Xander sees the cat.;Xander does not see the cat.;Xander;Oven;Lack of touch -> Xander was sitting in the living room and did not touch the oven.;auto;0
Yara was at the beach, watching the sea. Yara wanted to see a dolphin. The sea was calm and mild. Yara believed the sea was calm and mild. As the day went on, the sea became rough and wavy due to the changing tide.;Yara sees the sea becoming rough and wavy.;Yara does not see the sea becoming rough and wavy.;Yara decides to stop looking for dolphins and leave the beach.;Yara continues to watch the sea, hoping to see a dolphin.;Does Yara think the sea is calm and mild or rough and wavy?;Does Yara want to continue watching for dolphins or leave the beach?;What will Yara do next?;Yara believes the sea is rough and wavy.;Yara wants to leave the beach.;Yara will leave the beach.;Yara believes the sea is calm and mild.;Yara wants to continue watching for dolphins.;Yara will continue to watch the sea, hoping to see a dolphin.;A seagull lands on Yara's sandcastle.;Yara sees the seagull landing on her sandcastle.;Yara does not see the seagull landing on her sandcastle.;Yara;Sea;Lack of sight -> Yara was busy building a sandcastle and did not see the sea becoming rough.;auto;0
Nia was at the park, watching the busy ants. Nia wanted to draw a picture of an ant for her art class. The ant she was looking at was very small. Nia believed the ant was very small. As the day went on, the ant ate a lot of food and grew bigger.;Nia sees that the ant has grown bigger.;Nia does not see that the ant has grown bigger.;Nia decides to erase her drawing and start over.;Nia continues to draw the small ant.;Does Nia think the ant is small or big?;Does Nia want to continue drawing the small ant or start over with a big ant?;What will Nia do next?;Nia believes the ant is big.;Nia wants to start over with a big ant.;Nia will erase her drawing and start over.;Nia believes the ant is small.;Nia wants to continue drawing the small ant.;Nia will continue to draw the small ant.;A soldier walks by and recommends Nia to draw a soldier ant.;Nia hears the soldier's recommendation.;Nia does not hear the soldier's recommendation.;Nia;Ant;Lack of sight -> Nia was busy drawing and did not see the ant eat and grow bigger.;auto;0
Quincy was at the park, playing with his red ball. Quincy wanted to kick the ball into the goal. The ball was very red. Quincy believed the ball was very red. While Quincy was confused about which way to kick, a dog ran over, picked up the ball in its mouth, and ran off. The dog's slobber made the ball look less red.;Quincy sees the dog running off with his ball.;Quincy does not see the dog running off with his ball.;Quincy decides to chase the dog to get his ball back.;Quincy decides to quit thinking and just kick the ball.;Does Quincy think the ball is very red or less red?;Does Quincy want to chase the dog or kick the ball?;What will Quincy do next?;Quincy believes the ball is less red.;Quincy wants to chase the dog.;Quincy will chase the dog.;Quincy believes the ball is very red.;Quincy wants to kick the ball.;Quincy will quit thinking and just kick the ball.;An ambulance drives by with its sirens on.;Quincy hears the ambulance.;Quincy does not hear the ambulance.;Quincy;Ball;Lack of sight -> Quincy was confused and didn't notice the dog running off with his ball.;auto;0
Eva was in her room, feeling hot. Eva wanted to turn on her fan to cool down. The fan was off. Eva believed the fan was off. While Eva was busy reading a book, her mom came into the room and turned on the fan to air out the room.;Eva sees her mom leaving the room.;Eva does not see her mom leaving the room.;Eva decides to keep reading her book as the room is now cooler.;Eva gets up to turn on the fan.;Does Eva think the fan is off or on?;Does Eva want to keep reading her book or turn on the fan?;What will Eva do next?;Eva believes the fan is on.;Eva wants to keep reading her book.;Eva will keep reading her book.;Eva believes the fan is off.;Eva wants to turn on the fan.;Eva will get up to turn on the fan.;A cat walks into the room.;Eva sees the cat.;Eva does not see the cat.;Eva;Fan;Lack of sight -> Eva was busy reading her book and did not see her mom come into the room.;auto;0
Polly was at a big party with lots of noise. Polly wanted to sing a song for her friends. The music was very loud. Polly believed the music was very loud. While Polly was upset about not being able to sing, the DJ's speaker system broke down and the music stopped.;Polly hears the quiet.;Polly does not hear the quiet.;Polly decides to start singing her song.;Polly considers asking the DJ to turn down the music.;Does Polly think the music is very loud or quiet?;Does Polly want to sing her song or ask the DJ to turn down the music?;What will Polly do next?;Polly believes the music is quiet.;Polly wants to sing her song.;Polly will start singing her song.;Polly believes the music is very loud.;Polly wants to ask the DJ to turn down the music.;Polly will ask the DJ to turn down the music.;A cat roars outside the party.;Polly hears the cat roar.;Polly does not hear the cat roar.;Polly;Music;Lack of hearing -> Polly was upset and did not hear the music stop.;auto;0
Ollie was at home, tidying his room. Ollie wanted to put his pink toy car in his wardrobe. The toy car was solid. Ollie believed the toy car was solid. While Ollie was busy picking up other toys, the sun shone brightly through the window, melting the toy car.;Ollie sees the sun shining brightly through the window.;Ollie does not see the sun shining brightly through the window.;Ollie decides to move the toy car away from the sun.;Ollie plans to put the toy car in his wardrobe.;Does Ollie think the toy car is solid or melted?;Does Ollie want to put the toy car in his wardrobe or move it away from the sun?;What will Ollie do next?;Ollie believes the toy car is melted.;Ollie wants to move the toy car away from the sun.;Ollie will move the toy car away from the sun.;Ollie believes the toy car is solid.;Ollie wants to put the toy car in his wardrobe.;Ollie will put the toy car in his wardrobe.;Ollie's mom calls him for lunch.;Ollie hears his mom calling him.;Ollie does not hear his mom calling him.;Ollie;toy car;Lack of sight -> Ollie was busy picking up other toys and did not see the sun melting his toy car.;auto;0
Alfie was at the park, ready to fly his big red balloon. Alfie wanted to let his balloon float high in the sky. The balloon was full of gas. Alfie believed the balloon was full of gas. While Alfie was busy tying the string to the balloon, a playful dog ran by and accidentally popped the balloon with its sharp teeth.;Alfie sees the dog running away with a piece of balloon in its mouth.;Alfie does not see the dog running away with a piece of balloon in its mouth.;Alfie decides to get a new balloon.;Alfie starts to let the balloon float in the sky.;Does Alfie think the balloon is full of gas or popped?;Does Alfie want to let the balloon float in the sky or get a new balloon?;What will Alfie do next?;Alfie believes the balloon is popped.;Alfie wants to get a new balloon.;Alfie will get a new balloon.;Alfie believes the balloon is full of gas.;Alfie wants to let the balloon float in the sky.;Alfie will let the balloon float in the sky.;A squirrel runs up a nearby tree.;Alfie sees the squirrel.;Alfie does not see the squirrel.;Alfie;Balloon;Lack of sight -> Alfie was busy tying the string to the balloon and did not see the dog run by.;auto;0
Yara was at a fancy party, holding a glass of juice. Yara wanted to enjoy her juice without spilling it. The juice was in the glass. Yara believed the juice was in the glass. While Yara was busy chatting, a waiter bumped into her, causing the juice to spill out of the glass.;Yara feels her hand wet from the spilled juice.;Yara does not feel her hand wet from the spilled juice.;Yara decides to get a new glass of juice.;Yara continues sipping her juice while chatting.;Does Yara think the juice is in the glass or spilled?;Does Yara want to continue sipping her juice or get a new glass of juice?;What will Yara do next?;Yara believes the juice is spilled.;Yara wants to get a new glass of juice.;Yara will get a new glass of juice.;Yara believes the juice is in the glass.;Yara wants to continue sipping her juice.;Yara will continue sipping her juice while chatting.;The lights in the party room suddenly go off.;Yara sees the lights go off.;Yara does not see the lights go off.;Yara;Juice glass;Lack of sight -> Yara was busy chatting and did not see the waiter bump into her.;auto;0
Faye was at a fancy party, looking at all the beautiful things. Faye wanted to find the most attractive diamond in the room. The diamond on the table was big and shiny. Faye believed the diamond on the table was big and shiny. While Faye was busy trying to organize the diamonds according to their size, a waiter accidentally spilled some hot tea on the diamond, causing it to crack and lose its shine.;Faye sees the waiter spill the tea on the diamond.;Faye does not see the waiter spill the tea on the diamond.;Faye decides to tell the party host about the damaged diamond.;Faye continues to organize the diamonds.;Does Faye think the diamond on the table is big and shiny or cracked and dull?;Does Faye want to tell the party host about the damaged diamond or continue organizing the diamonds?;What will Faye do next?;Faye believes the diamond on the table is cracked and dull.;Faye wants to tell the party host about the damaged diamond.;Faye will tell the party host about the damaged diamond.;Faye believes the diamond on the table is big and shiny.;Faye wants to continue organizing the diamonds.;Faye will continue to organize the diamonds.;A clown enters the party and starts making balloon animals.;Faye sees the clown.;Faye does not see the clown.;Faye;diamond on the table;Lack of sight -> Faye was busy organizing the diamonds and did not see the waiter spill the tea.;auto;0
Quinn was at the park, playing on the grass. Quinn wanted to fly his big zoom kite. The wind was strong. Quinn believed the wind was strong. While Quinn was lying down to rest, a group of kids played soccer nearby, and their ball hit the kite, making it smaller.;Quinn sees the kids playing soccer near his kite.;Quinn does not see the kids playing soccer near his kite.;Quinn decides to fix his kite.;Quinn gets ready to fly his kite again.;Does Quinn think the wind is strong or not?;Does Quinn want to fly his kite or fix his kite?;What will Quinn do next?;Quinn believes the wind is strong.;Quinn wants to fix his kite.;Quinn will fix his kite.;Quinn believes the wind is strong.;Quinn wants to fly his kite.;Quinn will get ready to fly his kite again.;A dog runs across the park.;Quinn sees the dog running.;Quinn does not see the dog running.;Quinn;zoom kite;Lack of sight -> Quinn was lying down and did not see the kids playing soccer.;auto;0
Kiki was at a park, near a unique water fountain. Kiki wanted to take a picture of the water fountain. The water was flowing smoothly from the faucet. Kiki thought that the water was flowing smoothly from the faucet. As the day got hotter, the water started to flow less smoothly and became choppy.;Kiki sees that the water is not flowing smoothly anymore.;Kiki does not see that the water is not flowing smoothly anymore.;Kiki decides to wait for the water to flow smoothly again before taking the picture.;Kiki prepares to take a picture of the water fountain.;Does Kiki think the water is flowing smoothly or has become choppy?;Does Kiki want to take a picture now or wait for the water to flow smoothly again?;What will Kiki do next?;Kiki believes the water has become choppy.;Kiki wants to wait for the water to flow smoothly again before taking the picture.;Kiki will wait for the water to flow smoothly again.;Kiki believes the water is flowing smoothly.;Kiki wants to take a picture now.;Kiki will take a picture of the water fountain.;A squirrel runs across the park.;Kiki sees the squirrel.;Kiki does not see the squirrel.;Kiki;Water in the fountain;Kiki was busy counting the number of birds in the park and did not see the change in the water flow.;auto;0
Early in the morning, Eli was in his room, still in bed. Eli wanted to wake up and start his day. His alarm clock was loud. Eli believed his alarm clock was loud. As the day got warmer, the gentle sun rays hit the alarm clock, causing the plastic to soften and the alarm sound to become muffled.;Eli hears the muffled alarm sound.;Eli does not hear the muffled alarm sound.;Eli decides to get a new alarm clock.;Eli gets out of bed to turn off the alarm.;Does Eli think his alarm clock is loud or muffled?;Does Eli want to get a new alarm clock or get out of bed to turn off the alarm?;What will Eli do next?;Eli believes his alarm clock is muffled.;Eli wants to get a new alarm clock.;Eli will get a new alarm clock.;Eli believes his alarm clock is loud.;Eli wants to get out of bed to turn off the alarm.;Eli will get out of bed to turn off the alarm.;A gentle breeze wafts through the open window, carrying the scent of fresh flowers.;Eli smells the fresh flowers.;Eli does not smell the fresh flowers.;Eli;Alarm clock.;Lack of sight and sound -> Eli was still in bed and his eyes were closed, he did not hear the change in the alarm sound due to the muffled alarm.;auto;0
Xan was in his room, playing with his toy car. Xan wanted to make his toy car do a flip. The toy car was not flipped. Xan believed the toy car was not flipped. While Xan was busy trying to make the toy car flip, his polite neighbor came in and flipped the toy car to show him how it's done.;Xan sees his neighbor flipping the toy car.;Xan does not see his neighbor flipping the toy car.;Xan decides to thank his neighbor and try flipping the toy car himself.;Xan continues trying to flip the toy car.;Does Xan think the toy car is flipped or not flipped?;Does Xan want to thank his neighbor and try flipping the toy car himself or continue trying to flip the toy car?;What will Xan do next?;Xan believes the toy car is flipped.;Xan wants to thank his neighbor and try flipping the toy car himself.;Xan will thank his neighbor and try flipping the toy car himself.;Xan believes the toy car is not flipped.;Xan wants to keep trying to flip the toy car.;Xan will continue trying to flip the toy car.;A cat enters the room.;Xan sees the cat.;Xan does not see the cat.;Xan;Toy car;Lack of sight -> Xan was focused on his own attempts and did not see his neighbor flip the toy car.;auto;0
Carl was in the park, fixing his old radio. Carl wanted to listen to some music. The radio was very loud. Carl believed the radio was very loud. As Carl was busy removing a disgusting bug from his shirt, a squirrel came and took away a wire from the radio, making it quiet.;Carl sees the squirrel running away with a wire in its mouth.;Carl does not see the squirrel running away with a wire in its mouth.;Carl decides to chase the squirrel to get the wire back.;Carl starts tuning the radio to find his favorite music station.;Does Carl think the radio is loud or quiet?;Does Carl want to tune the radio or chase the squirrel?;What will Carl do next?;Carl believes the radio is quiet.;Carl wants to chase the squirrel to get the wire back.;Carl will chase the squirrel to get the wire back.;Carl believes the radio is loud.;Carl wants to tune the radio.;Carl will start tuning the radio to find his favorite music station.;A dog starts barking loudly in the park.;Carl hears the dog barking.;Carl does not hear the dog barking.;Carl;Radio;Lack of sight -> Carl was busy removing a bug from his shirt and did not see the squirrel take the wire.;auto;0
Greta was in the park, playing with her new bow. Greta wanted to hit the bullseye with her bow. The bow was stable in her hands. Greta believed the bow was stable. While Greta was carefully lifting the bow to aim, a playful dog ran by and bumped into the bow, making it shaky.;Greta notices the dog running away.;Greta does not notice the dog running away.;Greta decides to wait until the bow is stable again.;Greta releases the arrow towards the bullseye.;Does Greta think the bow is stable or shaky?;Does Greta want to release the arrow or wait until the bow is stable again?;What will Greta do next?;Greta believes the bow is shaky.;Greta wants to wait until the bow is stable again.;Greta will wait until the bow is stable again.;Greta believes the bow is stable.;Greta wants to release the arrow.;Greta will release the arrow towards the bullseye.;A butterfly lands on a nearby flower.;Greta sees the butterfly.;Greta does not see the butterfly.;Greta;bow;Lack of sight -> Greta was focused on the bullseye and did not see the dog running towards her.;auto;0
Lily was at the park, playing near a big sand structure. Lily wanted to show her friends the big sand structure. The sand structure was tall and strong. Lily believed the sand structure was tall and strong. While Lily was busy blinking dust out of her eyes, a group of dogs ran through the park and knocked over the sand structure.;Lily sees the dogs running away from the fallen sand structure.;Lily does not see the dogs running away from the fallen sand structure.;Lily decides to start building the sand structure again.;Lily plans to call her friends over to see the sand structure.;Does Lily think the sand structure is tall and strong or knocked over?;Does Lily want to show her friends the sand structure or start building it again?;What will Lily do next?;Lily believes the sand structure is knocked over.;Lily wants to start building the sand structure again.;Lily will start building the sand structure again.;Lily believes the sand structure is tall and strong.;Lily wants to show her friends the sand structure.;Lily will call her friends over to see the sand structure.;A kite flies over the park.;Lily sees the kite.;Lily does not see the kite.;Lily;sand structure;Lack of sight -> Lily was blinking dust out of her eyes and did not see the dogs run through the park.;auto;0
Umar was at a party, holding a fragile balloon. Umar wanted to give the balloon to his friend. The balloon was big and inflated. Umar believed the balloon was big and inflated. While Umar was waiting for his friend to accept the balloon, a sharp pin on the wall popped the balloon.;Umar hears the loud pop of the balloon.;Umar does not hear the loud pop of the balloon.;Umar decides to find another balloon to give to his friend.;Umar tries to hand the balloon to his friend.;Does Umar think the balloon is inflated or deflated?;Does Umar want to give his friend the balloon or find another balloon?;What will Umar do next?;Umar believes the balloon is deflated.;Umar wants to find another balloon.;Umar will find another balloon.;Umar believes the balloon is inflated.;Umar wants to give the balloon to his friend.;Umar will try to hand the balloon to his friend.;The fire alarm goes off.;Umar hears the fire alarm.;Umar does not hear the fire alarm.;Umar;Balloon;Lack of sight -> Umar was looking at his friend and did not see the pin on the wall.;auto;0
Jack was in the garden, ready to plant some flowers. Jack wanted to use his white gardening tool to dig a hole. The tool was sharp. Jack believed the tool was sharp. While Jack was walking to fetch some water, the sun heated the tool, making it dull.;Jack sees the sun shining directly on the tool.;Jack does not see the sun shining directly on the tool.;Jack decides to sharpen the tool again.;Jack starts digging a hole to plant the flowers.;Does Jack think the tool is sharp or dull?;Does Jack want to dig a hole or sharpen the tool?;What will Jack do next?;Jack believes the tool is dull.;Jack wants to sharpen the tool again.;Jack will sharpen the tool again.;Jack believes the tool is sharp.;Jack wants to dig a hole.;Jack will start digging a hole to plant the flowers.;A squirrel runs across the garden.;Jack sees the squirrel.;Jack does not see the squirrel.;Jack;gardening tool;Lack of sight -> Jack was walking to fetch water and did not see the sun heating the tool.;auto;0
Pete was at a huge club, waiting for his friends. Pete wanted to dance to the music. The music was very loud. Pete believed the music was very loud. While Pete was busy recognizing some of his old friends, the DJ turned the music down to make an announcement.;Pete hears the DJ making the announcement.;Pete does not hear the DJ making the announcement.;Pete decides to go to the bar to get a drink.;Pete starts dancing to the loud music.;Does Pete think the music is very loud or not?;Does Pete want to dance or go to the bar to get a drink?;What will Pete do next?;Pete believes the music is not loud.;Pete wants to go to the bar to get a drink.;Pete will go to the bar to get a drink.;Pete believes the music is very loud.;Pete wants to dance to the music.;Pete will start dancing to the music.;A balloon pops in the club.;Pete hears the balloon pop.;Pete does not hear the balloon pop.;Pete;Music;Lack of hearing -> Pete was busy talking to his old friends and did not hear the music volume change.;auto;0
Nia was in her room, ready to paint a picture. Nia wanted to paint a picture of the pretty curtain in her room. The paint cup was full. Nia believed the paint cup was full. While Nia was busy stirring the paint, her cat jumped onto the table and knocked over the paint cup.;Nia sees her cat knocking over the paint cup.;Nia does not see her cat knocking over the paint cup.;Nia decides to clean up the spilled paint.;Nia starts painting the picture of the curtain.;Does Nia think the paint cup is full or spilled?;Does Nia want to paint the curtain or clean up the spilled paint?;What will Nia do next?;Nia believes the paint cup is spilled.;Nia wants to clean up the spilled paint.;Nia will clean up the spilled paint.;Nia believes the paint cup is full.;Nia wants to paint the curtain.;Nia will start painting the curtain.;A butterfly flies into the room through the open window.;Nia sees the butterfly.;Nia does not see the butterfly.;Nia;paint cup;Lack of sight -> Nia was busy stirring the paint and did not see her cat jump onto the table.;auto;0
