Tim was in the kitchen, ready to make lunch. Tim wanted to make a big bowl of pasta. The pasta box was full. Tim believed the pasta box was full. While Tim was busy cutting vegetables, his little sister came into the kitchen and took some pasta to play with. Tim sees his sister leaving the kitchen with some pasta in her hand. Tim does not see his sister leaving the kitchen with some pasta in her hand. Tim decides to ask his sister to return the pasta. Tim starts boiling water to cook the pasta. Does Tim think the pasta box is full or not? Does Tim want to cook the pasta or ask his sister to return the pasta? What will Tim do next? Tim believes the pasta box is not full. Tim wants to ask his sister to return the pasta. Tim will ask his sister to return the pasta. Tim believes the pasta box is full. Tim wants to cook the pasta. Tim will start boiling water to cook the pasta. A bird flies into the kitchen through the open window. Tim sees the bird. Tim does not see the bird. Tim pasta box Lack of sight  > Tim was busy cutting vegetables and did not see his sister come into the kitchen. 
Fiona was at the park with her friends. They wanted to play a game of soccer. The ball they had was clean and shiny. Fiona believed the ball was clean and shiny. While they were playing, the ball rolled into a muddy puddle and got dirty. Fiona sees the ball in the muddy puddle. Fiona does not see the ball in the muddy puddle. Fiona decides to clean the ball before continuing the game. Fiona plans to kick the ball to score a goal. Does Fiona think the ball is clean or dirty? Does Fiona want to kick the ball or clean it? What will Fiona do next? Fiona believes the ball is dirty. Fiona wants to clean the ball. Fiona will clean the ball. Fiona believes the ball is clean. Fiona wants to kick the ball. Fiona will kick the ball. A squirrel runs across the field. Fiona sees the squirrel. Fiona does not see the squirrel. Fiona Ball Lack of sight  > Fiona was running in the opposite direction and did not see the ball roll into the muddy puddle. 
Olivia was at the park, sitting on a bench. Olivia wanted to feed the ducks with her bag of bread. The bread was fresh and smelled good. Olivia believed the bread was fresh and smelled good. While Olivia was watching the ducks, a naughty squirrel snuck over to the bench and took a piece of bread, dropping it into a muddy puddle. Olivia sees the squirrel run away with a piece of bread. Olivia does not see the squirrel run away with a piece of bread. Olivia decides to throw away the dirty bread. Olivia plans to start feeding the ducks with the bread. Does Olivia think the bread is fresh and smells good or is dirty and smells bad? Does Olivia want to feed the ducks or throw away the dirty bread? What will Olivia do next? Olivia believes the bread is dirty and smells bad. Olivia wants to throw away the dirty bread. Olivia will throw away the dirty bread. Olivia believes the bread is fresh and smells good. Olivia wants to feed the ducks. Olivia will start feeding the ducks with the bread. A colorful butterfly lands on the bench next to Olivia. Olivia sees the colorful butterfly. Olivia does not see the colorful butterfly. Olivia Bread Lack of sight  > Olivia was watching the ducks and did not see the squirrel take a piece of bread. 
Jill was at the park, watching the kids play. She wanted to take a video of her son first time on the swing. The camera was off. Jill believed the camera was off. As Jill was impatiently waiting for her son to gather courage and start swinging, a curious dog walked by and accidentally hit the camera with its tail, turning it on. Jill sees the dog walk away from the camera. Jill does not see the dog walk away from the camera. Jill decides to start recording right away. Jill plans to turn on the camera and start recording. Does Jill think the camera is off or on? Does Jill want to start recording right away or turn on the camera first? What will Jill do next? Jill believes the camera is on. Jill wants to start recording right away. Jill will start recording right away. Jill believes the camera is off. Jill wants to turn on the camera first. Jill will turn on the camera and start recording. A butterfly lands on the swing next to Jill son. Jill sees the butterfly. Jill does not see the butterfly. Jill Camera Lack of sight  > Jill was focused on her son and did not see the dog turn on the camera. 
Ben was at the ranch, looking after the animals. Ben wanted to ride his favorite horse. The saddle was not heavy. Ben believed the saddle was not heavy. As the day passed, the saddle got wet in the rain, making it heavy. Ben touches the saddle and feels it is heavy. Ben does not touch the saddle. Ben decides to dry the saddle before riding the horse. Ben plans to saddle up his horse for a ride. Does Ben think the saddle is heavy or not? Does Ben want to ride the horse or dry the saddle? What will Ben do next? Ben believes the saddle is heavy. Ben wants to dry the saddle before riding the horse. Ben will dry the saddle before riding the horse. Ben believes the saddle is not heavy. Ben wants to ride the horse. Ben will saddle up his horse for a ride. An unusual bird lands on the ranch fence. Ben sees the unusual bird. Ben does not see the unusual bird. Ben Saddle Lack of touch  > Ben was busy feeding the animals and did not touch the saddle. 
Fred was at a fun fair, excited to play games. Fred wanted to win a big teddy bear as a prize. The game machine was on. Fred believed the game machine was on. While Fred went to rest on a bench, a fair worker turned off the game machine for a routine check. Fred sees the worker turning off the game machine. Fred does not see the worker turning off the game machine. Fred decides to wait until the machine is turned back on. Fred walks up to the machine to play the game. Does Fred think the game machine is on or off? Does Fred want to play the game or wait until the machine is turned back on? What will Fred do next? Fred believes the game machine is off. Fred wants to wait until the machine is turned back on. Fred will wait until the machine is turned back on. Fred believes the game machine is on. Fred wants to play the game. Fred will walk up to the machine to play the game. A clown starts performing nearby. Fred sees the clown. Fred does not see the clown. Fred game machine Lack of sight  > Fred was resting on a bench and did not see the worker turn off the machine. 
Sam was at the beach, having a picnic. Sam wanted to visit his friend after eating his sandwich. The sandwich was tasty. Sam believed the sandwich was tasty. While Sam was busy looking at the sea, a seagull swooped down and dropped some salt on his sandwich. Sam sees the seagull flying away from his picnic spot. Sam does not see the seagull flying away from his picnic spot. Sam decides to dust off the extra salt from his sandwich. Sam starts eating his sandwich. Does Sam think his sandwich is tasty or too salty? Does Sam want to eat his sandwich or dust off the salt? What will Sam do next? Sam believes his sandwich is too salty. Sam wants to dust off the salt. Sam will dust off the salt from his sandwich. Sam believes his sandwich is tasty. Sam wants to eat his sandwich. Sam will start eating his sandwich. A dog runs across the beach, chasing a ball. Sam sees the dog. Sam does not see the dog. Sam Sandwich Lack of sight  > Sam was busy looking at the sea and did not see the seagull drop salt on his sandwich. 
Dave was in a lively party at his friend house. Dave wanted to go upstairs to get his coat. The door upstairs was unlocked. Dave believed the door upstairs was unlocked. While Dave was enjoying the party, his friend dad came and locked the upstairs door for safety. Dave sees his friend dad with a key in his hand. Dave does not see his friend dad with a key in his hand. Dave decides to ask his friend dad for the key. Dave starts walking towards the stairs to go upstairs. Does Dave think the upstairs door is locked or unlocked? Does Dave want to go upstairs or ask his friend dad for the key? What will Dave do next? Dave believes the upstairs door is locked. Dave wants to ask his friend dad for the key. Dave will ask his friend dad for the key. Dave believes the upstairs door is unlocked. Dave wants to go upstairs. Dave will start walking towards the stairs to go upstairs. A dog starts barking loudly at the party. Dave hears the dog barking. Dave does not hear the dog barking. Dave upstairs door Dave was in a different location  > Dave was downstairs enjoying the party and did not see his friend dad lock the door. 
Zara was in her garden, ready to plant some flowers. Zara wanted to dig holes with her spade. The spade was strong. Zara believed the spade was strong. While Zara was inside the house inviting her friend to come over, a naughty dog from the neighborhood came into her garden and started chewing on the spade handle, making it weak. Zara sees the dog leaving her garden. Zara does not see the dog leaving her garden. Zara decides to buy a new spade. Zara starts to dig holes with her spade. Does Zara think the spade is strong or weak? Does Zara want to dig holes with her spade or buy a new one? What will Zara do next? Zara believes the spade is weak. Zara wants to buy a new spade. Zara will buy a new spade. Zara believes the spade is strong. Zara wants to dig holes with her spade. Zara will start to dig holes with her spade. A butterfly lands on a flower in Zara garden. Zara sees the butterfly. Zara does not see the butterfly. Zara spade Lack of sight  > Zara was inside the house and did not see the dog come into her garden. 
Amy was at the park, sitting on the bench. Amy wanted to play with her red balloon. The balloon was big and full of air. Amy thought the balloon was big and full of air. While Amy was busy peeking at the birds in the trees, a sharp thorn on a bush nearby slowly deflated the balloon. Amy sees the balloon getting smaller. Amy does not see the balloon getting smaller. Amy decides to find a way to blow the balloon again. Amy starts running around the park with the balloon. Does Amy think the balloon is big and full of air or small and deflated? Does Amy want to run around the park with the balloon or find a way to blow the balloon again? What will Amy do next? Amy believes the balloon is small and deflated. Amy wants to find a way to blow the balloon again. Amy will find a way to blow the balloon again. Amy believes the balloon is big and full of air. Amy wants to run around the park with the balloon. Amy will start running around the park with the balloon. A dog starts barking loudly near Amy. Amy hears the dog barking. Amy does not hear the dog barking. Amy Red balloon Lack of sight  > Amy was busy looking at the birds and did not see the thorn on the bush. 
Jill was at a party with her friends. Jill wanted to tell a funny joke to make everyone laugh. Her friend, Tom, was awake and listening. Jill believed Tom was awake and listening. While Jill was thinking of a joke, Tom felt tired and fell asleep on the couch. Jill sees Tom asleep on the couch. Jill does not see Tom asleep on the couch. Jill decides to wait until Tom wakes up to tell her joke. Jill starts telling her joke to Tom. Does Jill think Tom is awake or asleep? Does Jill want to tell her joke now or wait until Tom wakes up? What will Jill do next? Jill believes Tom is asleep. Jill wants to wait until Tom wakes up to tell her joke. Jill will wait until Tom wakes up. Jill believes Tom is awake. Jill wants to tell her joke now. Jill will start telling her joke to Tom. A balloon pops loudly in the party. Jill hears the balloon pop. Jill does not hear the balloon pop. Jill Tom Lack of sight  > Jill was busy thinking of a joke and did not see Tom fall asleep. 
Bob was in a busy city, looking for a place to eat. Bob wanted to try a new food place. The food place was open. Bob believed the food place was open. While Bob was busy requesting directions from a local, the owner of the food place decided to close early for a family event. Bob sees the owner closing the food place. Bob does not see the owner closing the food place. Bob decides to look for another food place. Bob starts walking towards the food place. Does Bob think the food place is open or closed? Does Bob want to eat at the food place or look for another food place? What will Bob do next? Bob believes the food place is closed. Bob wants to look for another food place. Bob will start looking for another food place. Bob believes the food place is open. Bob wants to eat at the food place. Bob will start walking towards the food place. A street performer starts playing music nearby. Bob hears the street performer. Bob does not hear the street performer. Bob Food place Lack of sight  > Bob was busy requesting directions and did not see the owner closing the food place. 
Zara was in her room, cleaning up her toys. Zara wanted to put her teddy in its tidy toy trap. The toy trap was empty. Zara believed the toy trap was empty. While Zara was picking up other toys, her cat jumped into the toy trap and made it bend. Zara sees her cat in the toy trap. Zara does not see her cat in the toy trap. Zara decides to take her cat out of the toy trap. Zara plans to put her teddy in the toy trap. Does Zara think the toy trap is empty or has her cat in it? Does Zara want to put her teddy in the toy trap or take her cat out of it? What will Zara do next? Zara believes her cat is in the toy trap. Zara wants to take her cat out of the toy trap. Zara will take her cat out of the toy trap. Zara believes the toy trap is empty. Zara wants to put her teddy in the toy trap. Zara will put her teddy in the toy trap. A butterfly flies into the room through the open window. Zara sees the butterfly. Zara does not see the butterfly. Zara toy trap Lack of sight  > Zara was busy picking up other toys and did not see her cat jump into the toy trap. 
Ben was in the garden, sitting on a rock. Ben wanted to build a birdhouse. The bag of nails smelled like fresh metal. Ben believed the bag of nails smelled like fresh metal. As Ben was busy drawing his intelligent birdhouse design, a skunk came into the garden and sprayed near the bag of nails. Ben sees the skunk spray near the bag of nails. Ben does not see the skunk spray near the bag of nails. Ben decides to move the bag of nails away from the skunk spray area. Ben starts to gather his tools to build the birdhouse. Does Ben think the bag of nails smells like fresh metal or like skunk spray? Does Ben want to build the birdhouse or move the bag of nails away from the skunk spray area? What will Ben do next? Ben believes the bag of nails smells like skunk spray. Ben wants to move the bag of nails away from the skunk spray area. Ben will move the bag of nails away from the skunk spray area. Ben believes the bag of nails smells like fresh metal. Ben wants to build the birdhouse. Ben will start to gather his tools to build the birdhouse. A butterfly lands on Ben drawing. Ben sees the butterfly. Ben does not see the butterfly. Ben bag of nails Lack of smell  > Ben was too far from the bag of nails to smell the change. 
Max was at an ice cream shop on a hot day. Max wanted to buy an expensive, sweet ice cream cone. The ice cream cone was cold. Max believed the ice cream cone was cold. While Max was counting his money, the sun heat slowly melted the ice cream. Max sees the ice cream melting. Max does not see the ice cream melting. Max decides to ask for a new ice cream cone. Max pays for the ice cream cone. Does Max think the ice cream cone is cold or melted? Does Max want to pay for the ice cream cone or ask for a new one? What will Max do next? Max believes the ice cream cone is melted. Max wants to ask for a new ice cream cone. Max will ask for a new ice cream cone. Max believes the ice cream cone is cold. Max wants to pay for the ice cream cone. Max will pay for the ice cream cone. A mist starts to fall outside the ice cream shop. Max sees the mist. Max does not see the mist. Max Ice cream cone Lack of sight  > Max was busy counting his money and didn't notice the ice cream melting. 
Zara was at the zoo, close to the monkey cage. Zara wanted to feed the monkeys. The bag of peanuts was full. Zara believed the bag of peanuts was full. While Zara was busy rubbing dirt off her shoulder, a zookeeper came and took some peanuts to feed to the birds, leaving the bag half empty. Zara sees the zookeeper walking away with some peanuts. Zara does not see the zookeeper walking away with some peanuts. Zara decides to ask the zookeeper to return the peanuts. Zara starts walking towards the monkey cage to feed the monkeys. Does Zara think the bag of peanuts is full or half empty? Does Zara want to feed the monkeys or ask the zookeeper to return the peanuts? What will Zara do next? Zara believes the bag of peanuts is half empty. Zara wants to ask the zookeeper to return the peanuts. Zara will ask the zookeeper to return the peanuts. Zara believes the bag of peanuts is full. Zara wants to feed the monkeys. Zara will start walking towards the monkey cage to feed the monkeys. A parrot squawks loudly from a nearby tree. Zara hears the parrot squawk. Zara does not hear the parrot squawk. Zara Bag of peanuts Lack of sight  > Zara was busy rubbing dirt off her shoulder and did not see the zookeeper come and take some peanuts. 
Daisy was at the park with her friendly dog, Max. Daisy wanted to play fetch with Max. The dog toy was on the ground. Daisy believed the toy was on the ground. While Daisy was busy talking to a friend, a squirrel came and took the toy to its tree. Daisy sees the squirrel running up the tree with the toy. Daisy does not see the squirrel running up the tree with the toy. Daisy decides to climb the tree to retrieve the toy. Daisy plans to throw the toy and have Max fetch it. Does Daisy think the toy is on the ground or in the tree? Does Daisy want to play fetch with Max or retrieve the toy from the tree? What will Daisy do next? Daisy believes the toy is in the tree. Daisy wants to retrieve the toy from the tree. Daisy will climb the tree to retrieve the toy. Daisy believes the toy is on the ground. Daisy wants to play fetch with Max. Daisy will throw the toy and have Max fetch it. A little girl comes over to pet Max. Daisy sees the little girl. Daisy does not see the little girl. Daisy Dog toy Lack of sight  > Daisy was busy talking to her friend and did not see the squirrel take the toy. 
Ben was at the park, playing with his friends. Ben wanted to share his new toy belt with his friends. The belt was in his bag. Ben believed the belt was in his bag. While Ben was playing hide and seek, an ignorant dog came and tipped over his bag, causing the belt to fall out. Ben sees the dog near his bag. Ben does not see the dog near his bag. Ben decides to put the belt back in his bag. Ben plans to show his friends the belt. Does Ben think the belt is in his bag or on the ground? Does Ben want to show his friends the belt or put it back in his bag? What will Ben do next? Ben believes the belt is on the ground. Ben wants to put the belt back in his bag. Ben will put the belt back in his bag. Ben believes the belt is in his bag. Ben wants to show his friends the belt. Ben will show his friends the belt. A butterfly lands on a nearby flower. Ben sees the butterfly. Ben does not see the butterfly. Ben Belt Lack of sight  > Ben was playing hide and seek and did not see the dog tip over his bag. 
