Fred was at the park, flying his unique kite. Fred wanted to explain to his friends how to fly a kite. The kite string was stretched tight. Fred believed the kite string was stretched tight. While Fred was busy talking, a dog ran by, tugging at the kite string and loosening it.;Fred sees the dog running away with the loose kite string.;Fred does not see the dog running away with the loose kite string.;Fred decides to chase after the dog to retrieve his kite string.;Fred continues to explain to his friends how to fly a kite.;Does Fred think the kite string is stretched tight or loose?;Does Fred want to explain how to fly a kite or chase after the dog?;What will Fred do next?;Fred believes the kite string is loose.;Fred wants to chase after the dog.;Fred will chase after the dog.;Fred believes the kite string is stretched tight.;Fred wants to explain how to fly a kite.;Fred will continue to explain to his friends how to fly a kite.;A hot air balloon passes by overhead.;Fred sees the hot air balloon.;Fred does not see the hot air balloon.;Fred;kite string;Lack of sight -> Fred was busy explaining to his friends and did not see the dog tugging at the kite string.;auto;0
Jane was in her room, getting ready for her friend's party. Jane wanted to look healthy and bright. The mirror on her wall was securely fastened. Jane believed the mirror was securely fastened. While Jane was busy picking out her clothes, her cat jumped onto the shelf below the mirror, causing it to become loose.;Jane sees her cat jumping off the shelf.;Jane does not see her cat jumping off the shelf.;Jane decides to check the mirror to make sure it is still secure.;Jane starts applying her makeup in front of the mirror.;Does Jane think the mirror is securely fastened or loose?;Does Jane want to apply her makeup or check the mirror?;What will Jane do next?;Jane believes the mirror is loose.;Jane wants to check the mirror.;Jane will check the mirror.;Jane believes the mirror is securely fastened.;Jane wants to apply her makeup.;Jane will start applying her makeup.;The phone in Jane's room starts ringing.;Jane hears the phone ringing.;Jane does not hear the phone ringing.;Jane;mirror;Lack of sight -> Jane was looking at her clothes and did not see her cat jump onto the shelf.;auto;0
Daisy was at a big park. Daisy wanted to fly her new kite. The weather was windy. Daisy believed the weather was windy. As the day went on, the wind slowly died down and it was not windy anymore.;Daisy feels the wind has died down.;Daisy does not feel the wind has died down.;Daisy decides to pack up her kite and go home.;Daisy keeps trying to get her kite to fly.;Does Daisy think the weather is still windy or not?;Does Daisy want to keep flying her kite or pack up and go home?;What will Daisy do next?;Daisy believes the weather is not windy anymore.;Daisy wants to pack up her kite and go home.;Daisy will pack up her kite and go home.;Daisy believes the weather is still windy.;Daisy wants to keep flying her kite.;Daisy will keep trying to get her kite to fly.;A crazy dog runs across the park.;Daisy sees the crazy dog.;Daisy does not see the crazy dog.;Daisy;Weather;Lack of attention -> Daisy was busy trying to get her kite to fly and did not notice the change in the weather.;auto;0
Ina was at her dance class, practicing for the big show. Ina wanted to perform a perfect bow at the end of her dance. The bow was tied neatly on her dress. Ina believed the bow was tied neatly on her dress. While Ina was busy practicing her dance steps, her partner accidentally stepped on her dress and the bow came undone.;Ina sees her partner stepping on her dress.;Ina does not see her partner stepping on her dress.;Ina decides to punish her partner for being careless.;Ina continues practicing her dance steps.;Does Ina think the bow is neatly tied or undone?;Does Ina want to continue practicing or punish her partner?;What will Ina do next?;Ina believes the bow on her dress is undone.;Ina wants to punish her partner for being careless.;Ina will punish her partner.;Ina believes the bow on her dress is neatly tied.;Ina wants to continue practicing her dance steps.;Ina will continue practicing her dance steps.;The dance teacher announces a short break.;Ina hears the dance teacher's announcement.;Ina does not hear the dance teacher's announcement.;Ina;Bow;Lack of sight -> Ina was busy practicing her dance steps and did not see her partner step on her dress.;auto;0
Uma was in her room, sitting on her bed. Uma wanted to read her new doctor book. The book cover was blue. Uma believed the book cover was blue. While Uma was away to get a glass of water, her little brother came into the room with his red paint and painted the book cover red.;Uma sees her brother leaving the room with red paint on his hands.;Uma does not see her brother leaving the room with red paint on his hands.;Uma decides to clean the book cover.;Uma starts reading the doctor book.;Does Uma think the book cover is blue or red?;Does Uma want to read the doctor book or clean the book cover?;What will Uma do next?;Uma believes the book cover is red.;Uma wants to clean the book cover.;Uma will clean the book cover.;Uma believes the book cover is blue.;Uma wants to read the doctor book.;Uma will start reading the doctor book.;A cat jumps onto Uma's bed.;Uma sees the cat.;Uma does not see the cat.;Uma;doctor book;Lack of sight -> Uma was in the kitchen getting water and did not see her brother come into the room.;auto;0
Yara was in her room, listening to her favorite music. Yara wanted to repeat her favorite song again and again. The music player was fully charged. Yara believed the music player was fully charged. While Yara was lost in the mysterious rhythm of the music, the music player's battery slowly drained.;Yara sees the battery indicator showing low battery.;Yara does not see the battery indicator showing low battery.;Yara decides to charge the music player.;Yara repeats her favorite song.;Does Yara believe the music player is fully charged or not?;Does Yara want to repeat her favorite song or charge the music player?;What will Yara do next?;Yara believes the music player is not fully charged.;Yara wants to charge the music player.;Yara will charge the music player.;Yara believes the music player is fully charged.;Yara wants to repeat her favorite song.;Yara will repeat her favorite song.;A cat jumps onto Yara's bed.;Yara sees the cat.;Yara does not see the cat.;Yara;Music player;Lack of sight -> Yara was so engrossed in the music that she did not notice the battery indicator on the music player.;auto;0
Jane was in the park, sitting under a tree. Jane wanted to eat her avocado. The avocado was ripe. Jane believed the avocado was ripe. While Jane was busy watching a cute dog play, a harsh wind blew and flipped the avocado from her bag onto the ground.;Jane sees the avocado on the ground.;Jane does not see the avocado on the ground.;Jane decides to pick up the avocado from the ground.;Jane plans to eat the avocado.;Does Jane think the avocado is in her bag or on the ground?;Does Jane want to eat the avocado or pick it up from the ground?;What will Jane do next?;Jane believes the avocado is on the ground.;Jane wants to pick up the avocado from the ground.;Jane will pick up the avocado from the ground.;Jane believes the avocado is in her bag.;Jane wants to eat the avocado.;Jane will try to eat the avocado.;A butterfly lands on Jane's shoulder.;Jane sees the butterfly.;Jane does not see the butterfly.;Jane;Avocado;Lack of sight -> Jane was busy watching the dog and did not see the avocado flip onto the ground.;auto;0
Emma was in the school, waiting for her art class to start. Emma wanted to draw a big picture of her pet cat. The pencil she had was sharp. Emma believed the pencil was sharp. While Emma was busy talking to her friend, a naughty pupil changed her sharp pencil with a blunt one.;Emma sees the naughty pupil leaving her desk with a sharp pencil in his hand.;Emma does not see the naughty pupil leaving her desk with a sharp pencil in his hand.;Emma decides to ask the pupil to return her sharp pencil.;Emma starts drawing the picture of her cat.;Does Emma think her pencil is sharp or blunt?;Does Emma want to draw the picture or ask the pupil to return her sharp pencil?;What will Emma do next?;Emma believes her pencil is blunt.;Emma wants to ask the pupil to return her sharp pencil.;Emma will ask the pupil to return her sharp pencil.;Emma believes her pencil is sharp.;Emma wants to draw the picture of her cat.;Emma will start drawing the picture of her cat.;A bird flies into the classroom through the open window.;Emma sees the bird.;Emma does not see the bird.;Emma;Pencil;Lack of sight -> Emma was busy talking to her friend and did not see the naughty pupil change her pencil.;auto;0
Ella was in her room, playing with her toy car. Ella wanted to make her toy car move fast. The toy car was still and not moving. Ella believed the toy car was still and not moving. While Ella was busy minding her other toys, her cat came into the room and pushed the toy car, making it move fast.;Ella sees her cat pushing the toy car.;Ella does not see her cat pushing the toy car.;Ella decides to chase after the moving toy car.;Ella plans to push the toy car to make it move.;Does Ella think the toy car is still or moving fast?;Does Ella want to chase after the moving toy car or push the still toy car?;What will Ella do next?;Ella believes the toy car is moving fast.;Ella wants to chase after the moving toy car.;Ella will chase after the moving toy car.;Ella believes the toy car is still.;Ella wants to push the toy car to make it move.;Ella will push the toy car to make it move.;A happy song starts playing on the radio in Ella's room.;Ella hears the happy song.;Ella does not hear the happy song.;Ella;toy car;Lack of sight -> Ella was busy minding her other toys and did not see her cat push the toy car.;auto;0
Rose was at a campsite, sitting by the fire. Rose wanted to tell a scary story to her friends. The fire was bright and strong. Rose believed the fire was bright and strong. As the night went on, the fire slowly burned out and turned to ash.;Rose sees that the fire has turned to ash.;Rose does not see that the fire has turned to ash.;Rose decides to gather more wood to restart the fire.;Rose continues telling her scary story, happy that the fire is providing a spooky atmosphere.;Does Rose think the fire is bright and strong or has it turned to ash?;Does Rose want to continue telling her story or gather more wood to restart the fire?;What will Rose do next?;Rose believes the fire has turned to ash.;Rose wants to gather more wood to restart the fire.;Rose will gather more wood to restart the fire.;Rose believes the fire is bright and strong.;Rose wants to continue telling her scary story.;Rose will continue telling her scary story.;A shooting star appears in the sky.;Rose sees the shooting star.;Rose does not see the shooting star.;Rose;fire;Lack of light -> Rose was focused on telling her story and did not notice the fire slowly dying out.;auto;0
Ben was in the park, ready to fly his kite. Ben wanted to show his new kite to his friends. The kite's string was untangled. Ben believed the kite's string was untangled. While Ben was busy explaining how the kite works, a playful dog ran by and got the kite's string tangled with its tail.;Ben sees the dog running away with the kite's string tangled around its tail.;Ben does not see the dog running away with the kite's string tangled around its tail.;Ben decides to chase the dog to untangle the kite's string.;Ben prepares to launch the kite into the air.;Does Ben think the kite's string is untangled or tangled?;Does Ben want to launch the kite or chase the dog to untangle the kite's string?;What will Ben do next?;Ben believes the kite's string is tangled.;Ben wants to chase the dog to untangle the kite's string.;Ben will chase the dog.;Ben believes the kite's string is untangled.;Ben wants to launch the kite.;Ben will prepare to launch the kite.;A wild bird lands on a nearby tree.;Ben sees the bird.;Ben does not see the bird.;Ben;Kite's string;Lack of sight -> Ben was busy explaining to his friends and did not see the dog run by.;auto;0
Lucy was in the library, getting ready to study for her big test. Lucy wanted to read her book under the bright bubble lamp. The bubble lamp was bright. Lucy believed the bubble lamp was bright. As Lucy was busy studying, the library started to close and the librarian slowly dimmed the lights.;Lucy notices the librarian dimming the lights.;Lucy does not notice the librarian dimming the lights.;Lucy decides to move to a different spot with more light.;Lucy continues to study under the bright bubble lamp.;Does Lucy believe the bubble lamp is bright or dim?;Does Lucy want to continue studying under the bubble lamp or move to a different spot with more light?;What will Lucy do next?;Lucy believes the bubble lamp is dim.;Lucy wants to move to a different spot with more light.;Lucy will move to a different spot with more light.;Lucy believes the bubble lamp is bright.;Lucy wants to continue studying under the bubble lamp.;Lucy will continue to study under the bubble lamp.;A cat walks into the library.;Lucy sees the cat.;Lucy does not see the cat.;Lucy;bubble lamp;Lack of sight -> Lucy was busy studying and did not see the librarian dimming the lights.;auto;0
Harry was at the park playing with his new black toy car. Harry wanted to race his car down the big slide. The slide was clean. Harry believed the slide was clean. While Harry was nervously waiting for his turn, a group of dogs ran over the slide, leaving it dirty with paw prints.;Harry sees the dogs running over the slide.;Harry does not see the dogs running over the slide.;Harry decides to clean the slide before racing his car.;Harry gets ready to race his car down the slide.;Does Harry think the slide is clean or dirty?;Does Harry want to race his car down the slide or clean the slide?;What will Harry do next?;Harry believes the slide is dirty.;Harry wants to clean the slide.;Harry will clean the slide.;Harry believes the slide is clean.;Harry wants to race his car down the slide.;Harry will get ready to race his car down the slide.;A butterfly lands on Harry's toy car.;Harry sees the butterfly.;Harry does not see the butterfly.;Harry;Slide;Lack of sight -> Harry was too nervous and focused on his turn to notice the dogs.;auto;0
Xiao was at his desk, studying for his big test. Xiao wanted to order a book online to help him study. The book was available on the website. Xiao believed the book was available. While Xiao was busy looking at other books, the last copy of the book was ordered by another customer.;"Xiao sees the ""out of stock"" sign on the website.";"Xiao does not see the ""out of stock"" sign on the website.";Xiao decides to look for the book in a nearby store.;Xiao plans to order the book and have it delivered to his house.;Does Xiao think the book is available or sold out?;Does Xiao want to order the book online or look for it in a nearby store?;What will Xiao do next?;Xiao believes the book is sold out.;Xiao wants to look for the book in a nearby store.;Xiao will look for the book in a nearby store.;Xiao believes the book is available.;Xiao wants to order the book online.;Xiao will order the book online.;A cat jumps onto Xiao's desk.;Xiao sees the cat.;Xiao does not see the cat.;Xiao;The book;Lack of sight -> Xiao was busy looking at other books and did not see the book's status change on the website.;auto;0
Gina was at a party, feeling a little lonely. Gina wanted to find a quiet place to rest. The mattress in the guest room was light. Gina believed the mattress was light. As the party got louder, guests started to pile their coats on the mattress, making it heavy.;Gina sees the guests putting their coats on the mattress.;Gina does not see the guests putting their coats on the mattress.;Gina decides to move the coats before lying down.;Gina plans to go into the guest room and lie down on the mattress.;Does Gina think the mattress is light or heavy?;Does Gina want to move the coats or lie down on the mattress?;What will Gina do next?;Gina believes the mattress is heavy.;Gina wants to move the coats.;Gina will move the coats before lying down.;Gina believes the mattress is light.;Gina wants to lie down on the mattress.;Gina will go into the guest room and lie down on the mattress.;The music at the party stops playing.;Gina hears the music stop.;Gina does not hear the music stop.;Gina;mattress;Lack of sight -> Gina was in the living room and did not see the guests piling their coats on the mattress.;auto;0
Quinn was in the woods, ready to set up his camping spot. Quinn wanted to put up his tent. The ground was flat and clean. Quinn believed the ground was flat and clean. While Quinn was busy supporting the tent poles, a group of squirrels ran across the spot, kicking up dirt and leaves.;Quinn sees the squirrels running across the spot.;Quinn does not see the squirrels running across the spot.;Quinn decides to clean the ground again before setting up the tent.;Quinn continues to set up the tent.;Does Quinn think the ground is clean or dirty?;Does Quinn want to continue setting up the tent or clean the ground again?;What will Quinn do next?;Quinn believes the ground is dirty.;Quinn wants to clean the ground again.;Quinn will clean the ground again before setting up the tent.;Quinn believes the ground is clean.;Quinn wants to continue setting up the tent.;Quinn will continue to set up the tent.;A mysterious sound comes from the woods.;Quinn hears the mysterious sound.;Quinn does not hear the mysterious sound.;Quinn;Ground;Lack of sight -> Quinn was busy supporting the tent poles and did not see the squirrels run across.;auto;0
Ugo was at the church, ready to release the doves for the wedding. Ugo wanted to make sure the cage was clean for the doves. The cage was very clean. Ugo believed the cage was very clean. While Ugo was politely talking to the bride and groom, a group of kids, playing near the cage, accidentally spilled their juice, making the cage dirty.;Ugo sees the kids playing near the cage.;Ugo does not see the kids playing near the cage.;Ugo decides to clean the cage again before releasing the doves.;Ugo opens the cage to release the doves.;Does Ugo think the cage is clean or dirty?;Does Ugo want to release the doves or clean the cage?;What will Ugo do next?;Ugo believes the cage is dirty.;Ugo wants to clean the cage.;Ugo will clean the cage again before releasing the doves.;Ugo believes the cage is clean.;Ugo wants to release the doves.;Ugo will open the cage to release the doves.;The church bells start ringing.;Ugo hears the church bells.;Ugo does not hear the church bells.;Ugo;The cage;Lack of sight -> Ugo was talking to the bride and groom and did not see the kids playing near the cage.;auto;0
Ken was in a zoo, ready to show the kangaroos to the visitors. Ken wanted to lead the visitors to the kangaroo pen. The gate to the kangaroo pen was stable. Ken believed the gate was stable. While Ken was busy explaining about kangaroos to the visitors, a zoo worker accidentally bumped into the gate, making it shaky.;Ken sees the zoo worker bump into the gate.;Ken does not see the zoo worker bump into the gate.;Ken decides to call for maintenance to fix the gate.;Ken continues to lead the visitors to the kangaroo pen.;Does Ken think the gate is stable or shaky?;Does Ken want to lead the visitors to the kangaroo pen or call for maintenance to fix the gate?;What will Ken do next?;Ken believes the gate is shaky.;Ken wants to call for maintenance to fix the gate.;Ken will call for maintenance to fix the gate.;Ken believes the gate is stable.;Ken wants to lead the visitors to the kangaroo pen.;Ken will continue to lead the visitors to the kangaroo pen.;A parrot lands on Ken's shoulder.;Ken feels the parrot landing on his shoulder.;Ken does not feel the parrot landing on his shoulder.;Ken;Gate to the kangaroo pen;Lack of sight -> Ken was busy explaining about kangaroos and did not see the zoo worker bump into the gate.;auto;0
Quin was at the park, watching a little race. Quin wanted to win the race. The apple in his bag was sweet. Quin believed the apple was sweet. While Quin was racing, a bee landed on the apple and left some honey on it.;Quin sees the bee flying away from his bag.;Quin does not see the bee flying away from his bag.;Quin decides to taste the apple to see if it is still good.;Quin plans to eat the apple after the race for a quick energy boost.;Does Quin think the apple is sweet or sweet and honeyed?;Does Quin want to eat the apple after the race or taste it to see if it is still good?;What will Quin do next?;Quin believes the apple is sweet and honeyed.;Quin wants to taste the apple to see if it is still good.;Quin will taste the apple.;Quin believes the apple is sweet.;Quin wants to eat the apple after the race.;Quin will eat the apple after the race.;A dog appears and starts barking at the racers.;Quin sees the dog.;Quin does not see the dog.;Quin;Apple;Lack of sight -> Quin was busy in the race and did not see the bee land on his apple.;auto;0
Pete was at a concert, waiting for the show to start. Pete wanted to see his favorite musician play. The stage was empty. Pete believed the stage was empty. While Pete was busy pointing out his favorite musician's poster to his friend, the musician quietly climbed onto the stage to tune his guitar.;Pete sees the musician on the stage.;Pete does not see the musician on the stage.;Pete decides to stop talking and watch the musician.;Pete continues to talk about the poster with his friend.;Does Pete think the stage is empty or that the musician is on the stage?;Does Pete want to continue talking about the poster or watch the musician?;What will Pete do next?;Pete believes the musician is on the stage.;Pete wants to watch the musician.;Pete will stop talking and watch the musician.;Pete believes the stage is empty.;Pete wants to continue talking about the poster.;Pete will continue to talk about the poster with his friend.;A mysterious light illuminates the stage.;Pete sees the mysterious light.;Pete does not see the mysterious light.;Pete;Stage;Lack of sight -> Pete was busy pointing out the poster and did not see the musician climb onto the stage.;auto;0
Mary was in her room, playing with her favorite toy monster. She wanted to take the monster to show her friends at school. The toy monster was clean. Mary believed the toy monster was clean. While she was busy packing her school bag, her dog came into the room and started playing with the toy, making it dirty.;Mary sees her dog playing with the toy monster.;Mary does not see her dog playing with the toy monster.;Mary decides to clean the toy monster.;Mary puts the toy monster in her school bag.;Does Mary think the toy monster is clean or dirty?;Does Mary want to clean the toy monster or put it in her school bag?;What will Mary do next?;Mary believes the toy monster is dirty.;Mary wants to clean the toy monster.;Mary will clean the toy monster.;Mary believes the toy monster is clean.;Mary wants to put the toy monster in her school bag.;Mary will put the toy monster in her school bag.;A butterfly flies into the room.;Mary sees the butterfly.;Mary does not see the butterfly.;Mary;toy monster;Lack of sight -> Mary was busy packing her school bag and did not see her dog playing with the toy.;auto;0
Kira was at church, ready for the Sunday mass. Kira wanted to welcome the new pastor with a handmade cross. The paint can was full. Kira believed the paint can was full. While Kira was feeling guilty for arriving late, a church cat knocked over the paint can.;Kira sees the spilled paint on the floor.;Kira does not see the spilled paint on the floor.;Kira decides to clean up the spilled paint.;Kira starts painting the cross.;Does Kira think the paint can is full or spilled?;Does Kira want to paint the cross or clean up the spilled paint?;What will Kira do next?;Kira believes the paint can is spilled.;Kira wants to clean up the spilled paint.;Kira will clean up the spilled paint.;Kira believes the paint can is full.;Kira wants to paint the cross.;Kira will start painting the cross.;The church bell starts ringing.;Kira hears the church bell.;Kira does not hear the church bell.;Kira;paint can;Lack of sight -> Kira was feeling guilty and looking down, she did not see the cat knock over the paint can.;auto;0
Tanya was at the zoo, looking at the wild animals. Tanya wanted to take a picture of the lion. Her camera lens was clean. Tanya believed her camera lens was clean. While Tanya was busy trying to get the perfect shot, a monkey entered the enclosure and threw dirt at her camera lens.;Tanya sees the monkey throwing dirt at her camera lens.;Tanya does not see the monkey throwing dirt at her camera lens.;Tanya decides to clean her camera lens.;Tanya tries to take a picture of the lion.;Does Tanya think her camera lens is clean or dirty?;Does Tanya want to take a picture of the lion or clean her camera lens?;What will Tanya do next?;Tanya believes her camera lens is dirty.;Tanya wants to clean her camera lens.;Tanya will clean her camera lens.;Tanya believes her camera lens is clean.;Tanya wants to take a picture of the lion.;Tanya will try to take a picture of the lion.;A zookeeper starts feeding the animals.;Tanya sees the zookeeper feeding the animals.;Tanya does not see the zookeeper feeding the animals.;Tanya;Camera lens;Lack of sight -> Tanya was focused on the lion and did not see the monkey enter the enclosure.;auto;0
