Oliver was at home, watching his favorite cartoon. He wanted to draw the main character of the cartoon. The drawing paper was blank. Oliver believed the drawing paper was blank. As Oliver was busy managing his color pencils, his compassionate cat walked over the paper, leaving paw prints on it.;Oliver sees the paw prints on the paper.;Oliver does not see the paw prints on the paper.;Oliver decides to incorporate the paw prints into his drawing.;Oliver starts sketching the main character of the cartoon.;Does Oliver think the drawing paper is blank or has paw prints?;Does Oliver want to draw the main character of the cartoon or incorporate the paw prints into his drawing?;What will Oliver do next?;Oliver believes the drawing paper has paw prints.;Oliver wants to incorporate the paw prints into his drawing.;Oliver will incorporate the paw prints into his drawing.;Oliver believes the drawing paper is blank.;Oliver wants to draw the main character of the cartoon.;Oliver will start sketching the main character of the cartoon.;The phone rings.;Oliver hears the phone ring.;Oliver does not hear the phone ring.;Oliver;Drawing paper.;Lack of sight -> Oliver was busy managing his color pencils and did not see his cat walk over the paper.;auto;0
Dan was at a birthday party with his friends. Dan wanted to celebrate by blowing up a lot of big balloons with gas. The gas tank was big. Dan believed the gas tank was big. While Dan was busy eating cake, some of his friends used the gas to blow up their balloons, making the tank small.;Dan sees his friends blowing up balloons with the gas.;Dan does not see his friends blowing up balloons with the gas.;Dan decides to ask his friends to stop using the gas.;Dan plans to blow up more balloons with the gas.;Does Dan think the gas tank is big or small?;Does Dan want to blow up more balloons or ask his friends to stop using the gas?;What will Dan do next?;Dan believes the gas tank is small.;Dan wants to ask his friends to stop using the gas.;Dan will ask his friends to stop using the gas.;Dan believes the gas tank is big.;Dan wants to blow up more balloons.;Dan will blow up more balloons with the gas.;A clown arrives at the party.;Dan sees the clown.;Dan does not see the clown.;Dan;gas tank;Lack of sight -> Dan was busy eating cake and did not see his friends using the gas.;auto;0
Ollie was at the park, playing with his new red ball. Ollie wanted to kick the ball into the goal. The ball was very smooth. Ollie believed the ball was very smooth. While Ollie was running to the exit to get a drink, a dog found the ball and started chewing on it.;Ollie sees the dog chewing his ball.;Ollie does not see the dog chewing his ball.;Ollie decides to ask the dog's owner to buy him a new ball.;Ollie plans to kick the ball into the goal again.;Does Ollie think the ball is smooth or not?;Does Ollie want to kick the ball into the goal or ask the dog's owner to buy him a new ball?;What will Ollie do next?;Ollie believes the ball is not smooth anymore.;Ollie wants the dog's owner to buy him a new ball.;Ollie will ask the dog's owner to buy him a new ball.;Ollie believes the ball is still smooth.;Ollie wants to kick the ball into the goal again.;Ollie will go back to the field to kick the ball into the goal.;A butterfly lands on Ollie's shoulder.;Ollie sees the butterfly.;Ollie does not see the butterfly.;Ollie;Red ball;Lack of sight -> Ollie was running towards the exit and did not see the dog find his ball.;auto;0
Anna was at the store to buy food. Anna wanted to choose a ripe orange. The oranges were in a high box. Anna believed that the oranges were in a high box. While Anna was busy looking at the apples, a persistent store worker moved the oranges to a lower box.;Anna sees the store worker moving the oranges to a lower box.;Anna does not see the store worker moving the oranges to a lower box.;Anna decides to take an orange from the lower box.;Anna asks the store worker to help her reach the oranges.;Does Anna think the oranges are in a high box or a lower box?;Does Anna want to ask for help to reach the oranges or take an orange from the lower box?;What will Anna do next?;Anna believes the oranges are in a lower box.;Anna wants to take an orange from the lower box.;Anna will take an orange from the lower box.;Anna believes the oranges are in a high box.;Anna wants to ask the store worker to help her reach the oranges.;Anna will ask the store worker to help her reach the oranges.;A cat runs through the store.;Anna sees the cat.;Anna does not see the cat.;Anna;Box of oranges;Lack of sight -> Anna was busy looking at the apples and did not see the store worker move the oranges.;auto;0
Andy was in the park, sitting on a bench. Andy wanted to build a tall tower with his bricks. The pile of bricks was big. Andy believed the pile of bricks was big. While Andy was yawning, a dog ran past and knocked over some bricks with his tail.;Andy sees the dog running away with some bricks scattered on the ground.;Andy does not see the dog running away with some bricks scattered on the ground.;Andy decides to pick up the scattered bricks.;Andy starts building his tower with the bricks.;Does Andy think the pile of bricks is big or small?;Does Andy want to build his tower or pick up the scattered bricks?;What will Andy do next?;Andy believes the pile of bricks is small.;Andy wants to pick up the scattered bricks.;Andy will pick up the scattered bricks.;Andy believes the pile of bricks is big.;Andy wants to build his tower.;Andy will start building his tower.;A butterfly lands on Andy's shoulder.;Andy sees the butterfly.;Andy does not see the butterfly.;Andy;pile of bricks;Lack of sight -> Andy was yawning and did not see the dog run past.;auto;0
Kelly was in her classroom, ready to paint a picture. Kelly wanted to use a new paintbrush. The paintbrush was dry. Kelly believed the paintbrush was dry. While Kelly was tired and took a quick nap, her friend came and dipped the paintbrush in water.;Kelly sees her friend leaving the classroom with the wet paintbrush.;Kelly does not see her friend leaving the classroom with the wet paintbrush.;Kelly decides to pinch her friend's arm for wetting her paintbrush.;Kelly starts to open the paint pots to use the dry paintbrush.;Does Kelly think the paintbrush is dry or wet?;Does Kelly want to pinch her friend or open the paint pots?;What will Kelly do next?;Kelly believes the paintbrush is wet.;Kelly wants to pinch her friend.;Kelly will pinch her friend.;Kelly believes the paintbrush is dry.;Kelly wants to paint a picture.;Kelly will start to open the paint pots.;A butterfly flies into the classroom through the open window.;Kelly sees the butterfly.;Kelly does not see the butterfly.;Kelly;paintbrush;Lack of sight -> Kelly was taking a nap and did not see her friend come and dip the paintbrush in water.;auto;0
Ina was in the park, sitting on a bench. Ina wanted to read a book she had brought with her. The book had a normal, smooth cover. Ina believed the book had a normal, smooth cover. While Ina was wandering around to find a quiet spot, a dog ran by and, in its excitement, chewed on the book cover, making it rough.;Ina sees the dog running away with something in its mouth.;Ina does not see the dog running away with something in its mouth.;Ina decides to find the dog and retrieve her book.;Ina sits down on a bench to start reading her book.;Does Ina think the book cover is smooth or rough?;Does Ina want to read her book or find the dog and retrieve her book?;What will Ina do next?;Ina believes the book cover is rough.;Ina wants to find the dog and retrieve her book.;Ina will find the dog and retrieve her book.;Ina believes the book cover is smooth.;Ina wants to read her book.;Ina will sit down on a bench to start reading her book.;A squirrel runs up a nearby tree.;Ina sees the squirrel.;Ina does not see the squirrel.;Ina;Book;Lack of sight -> Ina was wandering around the park and did not see the dog chew on her book.;auto;0
Remy was in his room, playing with his toy car. Remy wanted to set his toy car on the race track he had built. The toy car's wheels were smooth. Remy believed the toy car's wheels were smooth. While Remy was busy setting up his race track, his pet cat, Misty, played with the toy car and scratched its wheels making them rough.;Remy sees Misty playing with his toy car.;Remy does not see Misty playing with his toy car.;Remy decides to smooth the wheels of his toy car.;Remy starts setting his toy car on the race track.;Does Remy think the toy car's wheels are smooth or rough?;Does Remy want to set his car on the race track or smooth the wheels of his toy car?;What will Remy do next?;Remy believes the toy car's wheels are rough.;Remy wants to smooth the wheels of his toy car.;Remy will smooth the wheels of his toy car.;Remy believes the toy car's wheels are smooth.;Remy wants to set his car on the race track.;Remy will set his toy car on the race track.;A harmless spider crawls into the room.;Remy sees the spider.;Remy does not see the spider.;Remy;toy car;Lack of sight -> Remy was busy setting up his race track and did not see Misty scratch the wheels of his toy car.;auto;0
Rita was in her room, getting ready for school. Rita wanted to wear her favorite blue pants. The pants were hanging in her closet. Rita believed the pants were hanging in her closet. While Rita was brushing her teeth, her mom came in and put the pants in the laundry basket because they were dirty.;Rita sees her mom leaving her room with the blue pants.;Rita does not see her mom leaving her room with the blue pants.;Rita decides to wear a skirt instead.;Rita goes to her closet to get the pants.;Does Rita believe her pants are in the closet or in the laundry basket?;Does Rita want to wear a skirt or get her pants from the closet?;What will Rita do next?;Rita believes her pants are in the laundry basket.;Rita wants to wear a skirt.;Rita will choose a skirt to wear.;Rita believes her pants are in the closet.;Rita wants to get her pants from the closet.;Rita will go to her closet to get her pants.;Rita's cat jumps onto her bed.;Rita sees her cat jump onto the bed.;Rita does not see her cat jump onto the bed.;Rita;Blue pants;Lack of sight -> Rita was in the bathroom brushing her teeth and did not see her mom come into her room.;auto;0
Val was at the park for a big baseball game. Val wanted to hit a home run. The baseball was on the ground near the bat. Val believed the baseball was on the ground near the bat. While Val was getting ready to bat, a dog ran onto the field and took the baseball.;Val sees the dog running away with the baseball.;Val does not see the dog running away with the baseball.;Val decides to replace the baseball.;Val starts swinging the bat to hit the baseball.;Does Val think the baseball is on the ground near the bat or with the dog?;Does Val want to hit the baseball or replace the baseball?;What will Val do next?;Val believes the baseball is with the dog.;Val wants to replace the baseball.;Val will replace the baseball.;Val believes the baseball is on the ground near the bat.;Val wants to hit the baseball.;Val will start swinging the bat to hit the baseball.;A kite flies over the baseball field.;Val sees the kite.;Val does not see the kite.;Val;baseball;Lack of sight -> Val was focused on getting ready to bat and did not see the dog take the baseball.;auto;0
Quinn was at the park, hoping to play a game. Quinn wanted to join the secret club of his friends. The secret handshake was smooth. Quinn believed the handshake was smooth. While Quinn was worried about remembering the handshake, a dog ran over and played with the sand, making it rough.;Quinn sees the dog playing with the sand.;Quinn does not see the dog playing with the sand.;Quinn decides to wash his hand before doing the handshake.;Quinn goes to his friends to do the handshake.;Does Quinn think the sand is smooth or rough?;Does Quinn want to join the secret club or wash his hand?;What will Quinn do next?;Quinn believes the sand is rough.;Quinn wants to wash his hand.;Quinn will wash his hand.;Quinn believes the sand is smooth.;Quinn wants to join the secret club.;Quinn will go to his friends to do the handshake.;A butterfly lands on a nearby flower.;Quinn sees the butterfly.;Quinn does not see the butterfly.;Quinn;Sand;Lack of sight -> Quinn was worried and focused on remembering the handshake, he did not see the dog playing with the sand.;auto;0
Carl was in his room, getting ready for bed. Carl wanted to sleep with his favorite glove, the one his dad gave him. The glove was on his bed. Carl believed the glove was on his bed. While Carl was brushing his teeth, his mom tidied his room and put the glove in the drawer.;Carl sees his mom leaving his room.;Carl does not see his mom leaving his room.;Carl decides to look for his glove in the drawer.;Carl goes to bed, ready to cuddle his glove.;Does Carl think the glove is on his bed or in the drawer?;Does Carl want to sleep or look for his glove?;What will Carl do next?;Carl believes the glove is in the drawer.;Carl wants to look for his glove.;Carl will look for his glove in the drawer.;Carl believes the glove is on his bed.;Carl wants to sleep.;Carl will go to bed, ready to cuddle his glove.;A car horn sounds outside.;Carl hears the car horn.;Carl does not hear the car horn.;Carl;glove;Lack of sight -> Carl was in the bathroom and did not see his mom tidy his room.;auto;0
Xander was at the park, playing in the sand box. Xander wanted to build a big sand castle. His bucket was full of sand. Xander believed his bucket was full of sand. While Xander was busy looking for his lost glove, a dog ran by and knocked over his bucket, spilling the sand.;Xander sees the dog running away from his bucket.;Xander does not see the dog running away from his bucket.;Xander decides to fill his bucket with sand again.;Xander starts building his sand castle.;Does Xander think his bucket is full of sand or empty?;Does Xander want to build his sand castle or refill his bucket with sand?;What will Xander do next?;Xander believes his bucket is empty.;Xander wants to refill his bucket with sand.;Xander will refill his bucket with sand.;Xander believes his bucket is full of sand.;Xander wants to build his sand castle.;Xander will start building his sand castle.;A butterfly lands on Xander's shoulder.;Xander sees the butterfly.;Xander does not see the butterfly.;Xander;bucket;Lack of sight -> Xander was looking for his lost glove and did not see the dog knock over his bucket.;auto;0
Nora was at the beach, building a sand castle. She wanted to use a white towel to sit on, after playing in the sand. The towel was dry. Nora believed the towel was dry. While Nora was busy burying a toy in the sand, a wave from the sea wet the towel.;Nora sees the wave wetting the towel.;Nora does not see the wave wetting the towel.;Nora decides to find a sunny spot to dry the towel.;Nora plans to sit on the dry towel after finishing her sand castle.;Does Nora think the towel is dry or wet?;Does Nora want to sit on the dry towel or find a sunny spot to dry the towel?;What will Nora do next?;Nora believes the towel is wet.;Nora wants to find a sunny spot to dry the towel.;Nora will find a sunny spot to dry the towel.;Nora believes the towel is dry.;Nora wants to sit on the dry towel.;Nora will sit on the dry towel after finishing her sand castle.;A seagull lands near Nora, looking for food.;Nora sees the seagull.;Nora does not see the seagull.;Nora;White towel;Lack of sight -> Nora was focused on burying the toy and did not see the wave wet the towel.;auto;0
Nia was in her classroom, feeling sleepy after lunch. Nia wanted to finish her drawing before the bell rang. The eraser was big and clean. Nia believed the eraser was big and clean. While Nia was daydreaming, her friend borrowed the eraser and used it a lot, making it smaller and dirty.;Nia sees her friend return the eraser to her desk.;Nia does not see her friend return the eraser to her desk.;Nia decides to ask her friend why the eraser is smaller and dirty.;Nia continues her drawing, planning to use the eraser when needed.;Does Nia think the eraser is big and clean or small and dirty?;Does Nia want to continue her drawing or ask her friend about the eraser?;What will Nia do next?;Nia believes the eraser is small and dirty.;Nia wants to ask her friend why the eraser is smaller and dirty.;Nia will ask her friend about the eraser.;Nia believes the eraser is big and clean.;Nia wants to continue her drawing.;Nia will continue her drawing, planning to use the eraser when needed.;The classroom door opens and a gust of wind blows some papers off the desk.;Nia sees the papers flying.;Nia does not see the papers flying.;Nia;eraser;Lack of sight -> Nia was daydreaming and did not see her friend borrow the eraser.;auto;0
Ben was at the park, ready to have a picnic. Ben wanted to open his lunch box and eat his broccoli. The lunch box was shut tight. Ben believed the lunch box was shut tight. While Ben was playing a silly game with his friends, a squirrel came and tried to open the lunch box, leaving it loose.;Ben sees the squirrel near his lunch box.;Ben does not see the squirrel near his lunch box.;Ben decides to chase the squirrel away.;Ben plans to sit down and eat his broccoli.;Does Ben think the lunch box is shut tight or loose?;Does Ben want to eat his broccoli or chase the squirrel away?;What will Ben do next?;Ben believes the lunch box is loose.;Ben wants to chase the squirrel away.;Ben will chase the squirrel away.;Ben believes the lunch box is shut tight.;Ben wants to eat his broccoli.;Ben will sit down and eat his broccoli.;A butterfly lands on a flower nearby.;Ben sees the butterfly.;Ben does not see the butterfly.;Ben;lunch box;Lack of sight -> Ben was busy playing a game and did not see the squirrel.;auto;0
Zara was in the school library, studying for her math test. Zara wanted to ask her tutor, a gifted math teacher, some questions. The tutor's schedule was free. Zara believed the tutor's schedule was free. While Zara was busy reading her math book, a group of students came and asked the tutor for help with a project.;Zara sees the group of students talking to the tutor.;Zara does not see the group of students talking to the tutor.;Zara decides to wait for the tutor to finish with the group of students.;Zara goes to ask the tutor her questions.;Does Zara think the tutor's schedule is free or busy?;Does Zara want to ask the tutor her questions or wait for the tutor to finish with the group of students?;What will Zara do next?;Zara believes the tutor's schedule is busy.;Zara wants to wait for the tutor to finish with the group of students.;Zara will wait for the tutor to finish with the group of students.;Zara believes the tutor's schedule is free.;Zara wants to ask the tutor her questions.;Zara will go to ask the tutor her questions.;A cat walks into the library.;Zara sees the cat.;Zara does not see the cat.;Zara;Tutor's schedule;Lack of sight -> Zara was busy reading her math book and did not see the group of students come to the tutor.;auto;0
Poppy was in her garden, looking at her flowers. Poppy wanted to find a bug to show her friends. The flower bed had a fresh smell. Poppy believed the flower bed had a fresh smell. As the day went on, a skunk passed by the garden and sprayed, changing the smell of the flower bed.;Poppy smells the new foul smell coming from the garden.;Poppy does not smell the new foul smell coming from the garden.;Poppy decides to wait for the smell to go away before returning to the garden.;Poppy plans to go back to the garden with her jar to catch a bug.;Does Poppy think the flower bed smells fresh or foul?;Does Poppy want to go back to the garden to catch a bug or wait for the smell to go away?;What will Poppy do next?;Poppy believes the flower bed smells foul.;Poppy wants to wait for the smell to go away before returning to the garden.;Poppy will wait for the smell to go away before returning to the garden.;Poppy believes the flower bed smells fresh.;Poppy wants to go back to the garden to catch a bug.;Poppy will go back to the garden with her jar to catch a bug.;A cat runs across the garden.;Poppy sees the cat.;Poppy does not see the cat.;Poppy;flower bed;Lack of smell -> Poppy was inside the house getting a jar to catch a bug.;auto;0
Olive was in the park, watching kids play. Olive wished to share her secret toy with her friend. The toy was in good shape. Olive believed the toy was in good shape. As Olive was observing a butterfly, a dog came by and chewed the toy, making it terrible.;Olive sees the dog chewing her toy.;Olive does not see the dog chewing her toy.;Olive decides to fix her toy.;Olive plans to give the toy to her friend.;Does Olive think the toy is in good shape or terrible shape?;Does Olive want to give the toy to her friend or fix the toy?;What will Olive do next?;Olive believes the toy is in terrible shape.;Olive wants to fix the toy.;Olive will fix the toy.;Olive believes the toy is in good shape.;Olive wants to give the toy to her friend.;Olive will give the toy to her friend.;A squirrel runs up a tree.;Olive sees the squirrel.;Olive does not see the squirrel.;Olive;toy;Lack of sight -> Olive was observing a butterfly and did not see the dog come by.;auto;0
Queenie was at the dock, waiting for her ship to be ready. Queenie wanted to sail on the big red ship. The ship was big and ready to sail. Queenie believed the ship was big and ready to sail. While Queenie was busy dressing up for the journey, a crew from the dock started removing some parts from the ship to make it lighter for the journey.;Queenie sees the crew removing parts from the ship.;Queenie does not see the crew removing parts from the ship.;Queenie decides to ask the crew why they are making the ship smaller.;Queenie walks towards the ship ready to start her journey.;Does Queenie think the ship is big and ready to sail or has it become smaller?;Does Queenie want to start her journey or ask the crew why they are making the ship smaller?;What will Queenie do next?;Queenie believes the ship has become smaller.;Queenie wants to ask the crew why they are making the ship smaller.;Queenie will ask the crew why they are making the ship smaller.;Queenie believes the ship is big and ready to sail.;Queenie wants to start her journey.;Queenie will walk towards the ship ready to start her journey.;A seagull lands on the dock near Queenie.;Queenie sees the seagull.;Queenie does not see the seagull.;Queenie;The ship;Lack of sight -> Queenie was busy dressing up and did not see the crew altering the ship.;auto;0
Dino was at the pool, ready for his swimming lesson. Dino wanted to dive into the water fast. The pile of clothes next to the pool was still. Dino believed his pile of clothes was still. While Dino was practicing his dive, a gust of wind blew his clothes into the pool.;Dino sees his clothes floating in the pool when he surfaces.;Dino does not see his clothes floating in the pool when he surfaces.;Dino decides to fetch his clothes out of the pool.;Dino plans to dry off and put on his clothes after the lesson.;Does Dino think his clothes are still next to the pool or in the pool?;Does Dino want to fetch his clothes out of the pool or dry off and put on his clothes?;What will Dino do next?;Dino believes his clothes are in the pool.;Dino wants to fetch his clothes out of the pool.;Dino will fetch his clothes out of the pool.;Dino believes his clothes are still next to the pool.;Dino wants to dry off and put on his clothes after the lesson.;Dino will dry off and put on his clothes after the lesson.;A dog runs around the pool.;Dino sees the dog.;Dino does not see the dog.;Dino;Pile of clothes;Lack of sight -> Dino was underwater and did not see his clothes being blown into the pool.;auto;0
Carl was in his room, playing with his favorite princess doll. Carl wanted to make a successful princess castle using his blocks. The block box was very organized. Carl believed the block box was very organized. While Carl was busy bouncing his princess doll on his bed, his pet cat, Whiskers, jumped into the block box and scattered the blocks all around the room.;Carl sees Whiskers jumping out of the block box.;Carl does not see Whiskers jumping out of the block box.;Carl decides to clean up the blocks before he starts building the castle.;Carl starts to build the princess castle with the blocks.;Does Carl think the block box is organized or messy?;Does Carl want to build the princess castle or clean up the blocks?;What will Carl do next?;Carl believes the block box is messy.;Carl wants to clean up the blocks.;Carl will clean up the blocks before he starts building the castle.;Carl believes the block box is organized.;Carl wants to build the princess castle.;Carl will start to build the princess castle with the blocks.;A butterfly flies into the room through the open window.;Carl sees the butterfly.;Carl does not see the butterfly.;Carl;block box;Lack of sight -> Carl was busy playing with his princess doll and did not see Whiskers jump into the block box.;auto;0
