Cindy was at the park, ready to play a game of hide and seek. Cindy wanted to hide in a big tree. The old boot was under the tree. Cindy believed the old boot was under the tree. While Cindy was gathering her friends to start the game, a naughty dog came and took the boot away to play with.;Cindy sees the dog running away with the boot in its mouth.;Cindy does not see the dog running away with the boot in its mouth.;Cindy decides to chase the dog to get the boot back.;Cindy starts counting to start the game of hide and seek.;Does Cindy think the boot is under the tree or not?;Does Cindy want to start the game or chase the dog to get the boot back?;What will Cindy do next?;Cindy believes the boot is not under the tree.;Cindy wants to chase the dog to get the boot back.;Cindy will chase the dog to get the boot back.;Cindy believes the boot is under the tree.;Cindy wants to start the game of hide and seek.;Cindy will start counting to start the game of hide and seek.;A squirrel runs up the big tree.;Cindy sees the squirrel.;Cindy does not see the squirrel.;Cindy;old boot;Lack of sight -> Cindy was busy gathering her friends and did not see the dog take the boot.;auto;0
Sally was at a birthday party, dressed as a pirate. Sally wanted to win the best costume prize. The cake on the table looked yummy. Sally believed the cake was yummy. As the party went on, the cake sat in the sun and became spoiled.;Sally sees the cake sitting in the sun.;Sally does not see the cake sitting in the sun.;Sally decides to tell the host about the spoiled cake.;Sally plans to have a piece of the cake.;Does Sally think the cake is yummy or spoiled?;Does Sally want to eat the cake or tell the host about the spoiled cake?;What will Sally do next?;Sally believes the cake is spoiled.;Sally wants to tell the host about the spoiled cake.;Sally will tell the host about the spoiled cake.;Sally believes the cake is yummy.;Sally wants to eat the cake.;Sally will have a piece of the cake.;A balloon pops loudly.;Sally hears the balloon pop.;Sally does not hear the balloon pop.;Sally;Cake;Lack of sight -> Sally was busy playing games and did not see the cake sitting in the sun.;auto;0
Toby was in the park, playing with his toy lion. Toby wanted to make the toy lion roar for his friends. The toy lion's battery was securely fastened. Toby believed the toy lion's battery was securely fastened. While Toby was busy showing his friends how to make the toy lion roar, a rude dog ran over and knocked the toy lion, causing the battery to become loose.;Toby sees the dog knock the toy lion.;Toby does not see the dog knock the toy lion.;Toby decides to fasten the battery securely again.;Toby continues to show his friends how to make the toy lion roar.;Does Toby think the toy lion's battery is securely fastened or loose?;Does Toby want to continue showing his friends how to make the toy lion roar or fasten the battery securely again?;What will Toby do next?;Toby believes the toy lion's battery is loose.;Toby wants to fasten the battery securely again.;Toby will fasten the battery securely again.;Toby believes the toy lion's battery is securely fastened.;Toby wants to continue showing his friends how to make the toy lion roar.;Toby will continue to show his friends how to make the toy lion roar.;A squirrel runs up a nearby tree.;Toby sees the squirrel.;Toby does not see the squirrel.;Toby;Toy lion's battery;Lack of sight -> Toby was busy showing his friends how to make the toy lion roar and did not see the dog knock the toy lion.;auto;0
Lily was in her room, getting ready for school. Lily wanted to pack her white school bag. The bag was well organized. Lily believed her bag was well organized. While Lily was squeezing her water bottle into the bag, her younger brother, Leo, entered the room and dumped all his toys into her bag.;Lily sees Leo leaving the room with a big grin on his face.;Lily does not see Leo leaving the room with a big grin on his face.;Lily decides to remove all the toys from her bag.;Lily zips up her bag and heads to the school bus.;Does Lily think her bag is well organized or messy?;Does Lily want to zip up her bag and head to the school bus or remove all the toys from her bag?;What will Lily do next?;Lily believes her bag is messy.;Lily wants to remove all the toys from her bag.;Lily will remove all the toys from her bag.;Lily believes her bag is well organized.;Lily wants to zip up her bag and head to the school bus.;Lily will zip up her bag and head to the school bus.;The school bus driver honks the horn outside.;Lily hears the bus driver honk the horn.;Lily does not hear the bus driver honk the horn.;Lily;School bag;Lack of sight -> Lily was busy squeezing her water bottle into her bag and did not see Leo dump his toys into her bag.;auto;0
Hilda was at the park, ready to play catch. Hilda wanted to catch the ball with her clean glove. The glove was on the bench, clean and ready. Hilda believed her glove was clean. While Hilda was grumpily arguing with her friend about the game rules, a dog ran up to the glove, picked it up in its mouth and ran away, making the glove dirty.;Hilda sees the dog running away with her glove in its mouth.;Hilda does not see the dog running away with her glove in its mouth.;Hilda decides to chase the dog to get her glove back.;Hilda goes back to the bench to put on her glove.;Does Hilda think her glove is clean or dirty?;Does Hilda want to put on her glove or chase the dog?;What will Hilda do next?;Hilda believes her glove is dirty.;Hilda wants to chase the dog.;Hilda will chase the dog.;Hilda believes her glove is clean.;Hilda wants to put on her glove.;Hilda will go back to the bench to put on her glove.;A squirrel runs up a tree nearby.;Hilda sees the squirrel.;Hilda does not see the squirrel.;Hilda;glove;Lack of sight -> Hilda was arguing with her friend and did not see the dog come up to the bench.;auto;0
Jack was in the lab, working on his science project. Jack wanted to make his laser light up. The laser was off. Jack believed the laser was off. While Jack was hard at work, a power surge in the building caused the laser to turn on.;Jack sees the light from the laser.;Jack does not see the light from the laser.;Jack decides to turn off the laser.;Jack tries to find a way to turn on the laser.;Does Jack think the laser is off or on?;Does Jack want to turn off the laser or find a way to turn it on?;What will Jack do next?;Jack believes the laser is on.;Jack wants to turn off the laser.;Jack will turn off the laser.;Jack believes the laser is off.;Jack wants to turn on the laser.;Jack will try to find a way to turn on the laser.;A classmate drops a beaker in the lab.;Jack hears the beaker break.;Jack does not hear the beaker break.;Jack;Laser;Lack of sight -> Jack was looking at his notes and did not see the laser turn on.;auto;0
Hana was at the park, ready to play. Hana wanted to dare her friend to climb the big yellow slide. The slide was very hot from the sun. Hana believed the slide was hot. While Hana was playing with her furry dog, a big cloud covered the sun and the slide started to cool down.;Hana sees the big cloud covering the sun.;Hana does not see the big cloud covering the sun.;Hana decides to climb the slide herself to test if it's cool.;Hana starts to dare her friend to climb the slide.;Does Hana think the slide is hot or cool?;Does Hana want to dare her friend to climb the slide or test the slide herself?;What will Hana do next?;Hana believes the slide is cool.;Hana wants to test the slide herself.;Hana will climb the slide herself to test it.;Hana believes the slide is hot.;Hana wants to dare her friend to climb the slide.;Hana will dare her friend to climb the slide.;A squirrel runs across the park.;Hana sees the squirrel.;Hana does not see the squirrel.;Hana;slide;Lack of sight -> Hana was busy playing with her dog and did not see the cloud covering the sun.;auto;0
Quinn was at the park, sitting on a bench. Quinn wanted to drink water from the tap. The tap was smooth. Quinn believed the tap was smooth. As Quinn was thoughtfully watching the birds, a dog ran by and scratched the tap with its paw.;Quinn sees the dog scratching the tap.;Quinn does not see the dog scratching the tap.;Quinn decides to clean the tap before drinking water.;Quinn gets up to drink water from the tap.;Does Quinn think the tap is smooth or rough?;Does Quinn want to drink water from the tap or clean the tap?;What will Quinn do next?;Quinn believes the tap is rough.;Quinn wants to clean the tap before drinking water.;Quinn will clean the tap before drinking water.;Quinn believes the tap is smooth.;Quinn wants to drink water from the tap.;Quinn will get up to drink water from the tap.;A butterfly lands on the bench next to Quinn.;Quinn sees the butterfly.;Quinn does not see the butterfly.;Quinn;tap;Quinn was watching the birds and didn't see the dog scratch the tap.;auto;0
Sam was in a distant field, picking fruit. Sam wanted to fill his basket with pears. The pear tree was full of ripe pears. Sam believed the pear tree was full of ripe pears. While Sam was busy picking pears, a group of birds entered the tree and ate many pears.;Sam sees the birds in the pear tree.;Sam does not see the birds in the pear tree.;Sam decides to shoo the birds away.;Sam continues to pick pears.;Does Sam think the pear tree is full of ripe pears or not?;Does Sam want to continue picking pears or shoo the birds away?;What will Sam do next?;Sam believes the pear tree is not full of ripe pears.;Sam wants to shoo the birds away.;Sam will shoo the birds away.;Sam believes the pear tree is full of ripe pears.;Sam wants to continue picking pears.;Sam will continue to pick pears.;A distant cow moos loudly.;Sam hears the cow.;Sam does not hear the cow.;Sam;pear tree;Lack of sight -> Sam was busy picking pears and did not see the birds enter the tree.;auto;0
Tina was in the park, ready to play. Tina wanted to play on the blue swing. The swing was free. Tina believed the swing was free. While Tina was busy tying her shoes, a group of kids came and started playing on the swing, which now looked green because of the sunlight hitting it at a certain angle.;Tina sees the kids playing on the swing.;Tina does not see the kids playing on the swing.;Tina decides to ask the kids if she can play with them.;Tina runs to the swing to start playing.;Does Tina think the swing is free or occupied?;Does Tina want to play on the swing alone or ask the kids if she can join them?;What will Tina do next?;Tina believes the swing is occupied.;Tina wants to ask the kids if she can play with them.;Tina will ask the kids if she can play with them.;Tina believes the swing is free.;Tina wants to play on the swing alone.;Tina will run to the swing to start playing.;A butterfly lands on a nearby flower.;Tina sees the butterfly.;Tina does not see the butterfly.;Tina;Swing;Lack of sight -> Tina was busy tying her shoes and did not see the kids come and start playing on the swing.;auto;0
Quincy was at a fun party with lots of kids. Quincy wanted to win the cake in the cake walk game. The cake was big and yummy. Quincy believed the cake was big and yummy. While Quincy took a short nap, the other kids ate the cake.;Quincy wakes up and sees the empty cake plate.;Quincy does not wake up and does not see the empty cake plate.;Quincy decides to play another game.;Quincy wakes up and goes to win the cake in the cake walk game.;Does Quincy think the big and yummy cake is still there or not?;Does Quincy want to win the cake or play another game?;What will Quincy do next?;Quincy believes the cake is not there.;Quincy wants to play another game.;Quincy will play another game.;Quincy believes the cake is still there.;Quincy wants to win the cake.;Quincy will go to win the cake in the cake walk game.;A clown starts making balloon animals.;Quincy sees the clown making balloon animals.;Quincy does not see the clown making balloon animals.;Quincy;Cake;Lack of sight -> Quincy was napping and did not see the other kids eat the cake.;auto;0
Max was in the garden, looking at a big maze. Max wanted to go through the maze without getting lost. The maze was full of blooming flowers. Max believed the maze was full of blooming flowers. While Max was busy drawing the maze on his paper, the gardener came and trimmed the flowers, changing the shape of the maze.;Max sees the gardener leaving the garden with his tools.;Max does not see the gardener leaving the garden with his tools.;Max decides to redraw the maze.;Max decides to start his journey through the maze.;Does Max think the maze is full of blooming flowers or trimmed flowers?;Does Max want to redraw the maze or start his journey through the maze?;What will Max do next?;Max believes the maze is full of trimmed flowers.;Max wants to redraw the maze.;Max will redraw the maze.;Max believes the maze is full of blooming flowers.;Max wants to start his journey through the maze.;Max will start his journey through the maze.;A squirrel runs across the garden.;Max sees the squirrel.;Max does not see the squirrel.;Max;maze;Lack of sight -> Max was busy drawing the maze and did not see the gardener trimming the flowers.;auto;0
Dan was at the zoo, looking at the animals. Dan wanted to take a picture of the gray leopard. The leopard was sleeping on a tree. Dan believed the leopard was sleeping. While Dan was busy adjusting his camera, the zookeeper came and woke up the leopard to feed it.;Dan sees the zookeeper waking up the leopard.;Dan does not see the zookeeper waking up the leopard.;Dan decides to wait for the leopard to go back to sleep.;Dan starts taking pictures of the sleeping leopard.;Does Dan think the leopard is sleeping or awake?;Does Dan want to take pictures of the sleeping leopard or wait for it to go back to sleep?;What will Dan do next?;Dan believes the leopard is awake.;Dan wants to wait for the leopard to go back to sleep.;Dan will wait for the leopard to go back to sleep.;Dan believes the leopard is sleeping.;Dan wants to take pictures of the sleeping leopard.;Dan will start taking pictures of the sleeping leopard.;A group of school children enter the zoo.;Dan sees the group of school children.;Dan does not see the group of school children.;Dan;Leopard;Lack of sight -> Dan was busy adjusting his camera and did not see the zookeeper come and wake up the leopard.;auto;0
Vera was at the playground with her friends. Vera wanted to go on the slide, but it was too hot from the sun. The slide was very smooth. Vera believed the slide was smooth. As the day went on, sand from the sandbox was blown onto the slide by the wind, making it rough.;Vera sees the sand on the slide.;Vera does not see the sand on the slide.;Vera decides to brush the sand off the slide before using it.;Vera waits for the slide to cool down before using it.;Does Vera believe the slide is smooth or rough?;Does Vera want to brush the sand off the slide or wait for it to cool down?;What will Vera do next?;Vera believes the slide is rough.;Vera wants to brush the sand off the slide.;Vera will brush the sand off the slide.;Vera believes the slide is smooth.;Vera wants to wait for the slide to cool down.;Vera will wait for the slide to cool down.;A dog runs through the playground.;Vera sees the dog.;Vera does not see the dog.;Vera;Slide;Lack of sight -> Vera was playing a game of tag and was not looking at the slide.;auto;0
Lucy was at the beach, looking at the sea. Lucy wanted to see a big whale. The sea was calm. Lucy believed the sea was calm. While Lucy was answering a call from her loyal friend, a school of fish jumped out of the water, causing the sea to become rough.;Lucy sees the fish jumping out of the water.;Lucy does not see the fish jumping out of the water.;Lucy decides to move away from the water's edge.;Lucy keeps looking at the sea, hoping to see a whale.;Does Lucy think the sea is calm or rough?;Does Lucy want to keep looking for the whale or move away from the water's edge?;What will Lucy do next?;Lucy believes the sea is rough.;Lucy wants to move away from the water's edge.;Lucy will move away from the water's edge.;Lucy believes the sea is calm.;Lucy wants to keep looking for the whale.;Lucy will keep looking at the sea, hoping to see a whale.;A seagull lands on Lucy's beach towel.;Lucy sees the seagull.;Lucy does not see the seagull.;Lucy;sea;Lack of sight -> Lucy was busy answering the call and did not see the fish jumping out of the water.;auto;0
Wally was at the park, ready to play. Wally wanted to climb the big tree. The tree was tall and strong. Wally believed the tree was tall and strong. While Wally was busy tying his shoe, a delicate branch from the tree fell off due to a squirrel jumping on it.;Wally sees the fallen branch on the ground.;Wally does not see the fallen branch on the ground.;Wally decides to climb a different tree.;Wally starts climbing the big tree.;Does Wally think the tree is strong or weak?;Does Wally want to climb the big tree or a different tree?;What will Wally do next?;Wally believes the tree is weak.;Wally wants to climb a different tree.;Wally will climb a different tree.;Wally believes the tree is strong.;Wally wants to climb the big tree.;Wally will start climbing the big tree.;A car honks loudly in the distance.;Wally hears the car honk.;Wally does not hear the car honk.;Wally;tree;Lack of sight -> Wally was busy tying his shoe and did not see the branch fall.;auto;0
Ira was at a fun fair with his aunt. He wanted to win a big teddy bear at a game. The game was loud with many kids playing. Ira believed the game was loud. While Ira was trying to throw the rings over the bottles, the fair staff turned down the volume of the game's music.;Ira hears the music getting quieter.;Ira does not hear the music getting quieter.;Ira decides to ask the fair staff to turn the volume back up.;Ira continues to throw the rings, trying to win the teddy bear.;Does Ira think the game is loud or quiet?;Does Ira want to continue playing the game or ask the fair staff to turn the volume back up?;What will Ira do next?;Ira believes the game is quiet.;Ira wants to ask the fair staff to turn the volume back up.;Ira will ask the fair staff to turn the volume back up.;Ira believes the game is loud.;Ira wants to continue playing the game.;Ira will continue to throw the rings, trying to win the teddy bear.;A clown starts making balloon animals near the game.;Ira sees the clown.;Ira does not see the clown.;Ira;game;Loud noise -> Ira was focused on throwing the rings and did not hear the change in the game's volume.;auto;0
Ron was at the fair, in front of a doughnut machine. Ron wanted to eat a hot, fresh doughnut. The doughnut machine was making round doughnuts. Ron believed the doughnut machine was making round doughnuts. While Ron was politely waiting in line, the machine operator adjusted the machine to make square doughnuts.;Ron sees the operator adjusting the machine.;Ron does not see the operator adjusting the machine.;Ron decides to try a square doughnut.;Ron gets ready to buy a round doughnut.;Does Ron think the doughnut machine is making round doughnuts or square doughnuts?;Does Ron want to buy a round doughnut or try a square doughnut?;What will Ron do next?;Ron believes the doughnut machine is making square doughnuts.;Ron wants to try a square doughnut.;Ron will buy a square doughnut.;Ron believes the doughnut machine is making round doughnuts.;Ron wants to buy a round doughnut.;Ron will buy a round doughnut.;A clown starts performing tricks nearby.;Ron sees the clown.;Ron does not see the clown.;Ron;doughnut machine;Lack of sight -> Ron was facing the other way, looking at the other fair attractions.;auto;0
Hank was at a busy fair, near the balloon stand. Hank wanted to win a big, brown balloon for his friend. The balloon was big and inflated. Hank believed the balloon was big and inflated. While Hank was buying a bottle of perfume for his mom, a kid with a sharp pin passed by the balloon stand and popped the balloon.;Hank sees the kid with the pin walking away from the balloon stand.;Hank does not see the kid with the pin walking away from the balloon stand.;Hank decides to win another balloon.;Hank plans to give the balloon to his friend.;Does Hank think the balloon is inflated or deflated?;Does Hank want to give the deflated balloon or a new inflated balloon to his friend?;What will Hank do next?;Hank believes the balloon is deflated.;Hank wants to win another balloon.;Hank will try to win another balloon.;Hank believes the balloon is inflated.;Hank wants to give the inflated balloon to his friend.;Hank will go to give the balloon to his friend.;A clown starts performing tricks nearby.;Hank sees the clown.;Hank does not see the clown.;Hank;Balloon;Lack of sight -> Hank was at the perfume stand and did not see the kid with the pin.;auto;0
Nia was in the park, looking at the trees. Nia wanted to find a fairy hiding in the trees. The trees were full of green leaves. Nia believed the trees were full of green leaves. While Nia was busy thinking about fairies, a gardener came and trimmed the trees, making many leaves fall down.;Nia sees the gardener trimming the trees.;Nia does not see the gardener trimming the trees.;Nia decides to look for the fairy among the fallen leaves.;Nia continues to look for the fairy in the trees.;Does Nia think the trees are full of leaves or not?;Does Nia want to look for the fairy in the trees or among the fallen leaves?;What will Nia do next?;Nia believes the trees are not full of leaves.;Nia wants to look for the fairy among the fallen leaves.;Nia will look for the fairy among the fallen leaves.;Nia believes the trees are full of leaves.;Nia wants to look for the fairy in the trees.;Nia will continue to look for the fairy in the trees.;A cold wind blows through the park.;Nia feels the cold wind.;Nia does not feel the cold wind.;Nia;trees;Lack of sight -> Nia was busy thinking about fairies and did not see the gardener trimming the trees.;auto;0
Bob was in the park, sitting under a banana tree. Bob wanted to eat a ripe banana. The banana was hanging delicately on the tree. Bob believed the banana was hanging delicately on the tree. While Bob was busy watching kids spring on the trampoline, a squirrel climbed the tree and nibbled on the banana, making it mushy.;Bob sees the squirrel nibbling on the banana.;Bob does not see the squirrel nibbling on the banana.;Bob decides to find another banana.;Bob plans to reach up and pick the banana.;Does Bob think the banana is still hanging delicately or is it now mushy?;Does Bob want to pick the banana or find another one?;What will Bob do next?;Bob believes the banana is now mushy.;Bob wants to find another banana.;Bob will look for another banana.;Bob believes the banana is hanging delicately.;Bob wants to pick the banana.;Bob will reach up and pick the banana.;A dog runs by, chasing a frisbee.;Bob sees the dog.;Bob does not see the dog.;Bob;banana;Lack of sight -> Bob was busy watching kids and did not see the squirrel climb the tree.;auto;0
Xander was at the circus, ready to perform his juggling act. Xander wanted to juggle three bright handles. The handles were very bright. Xander believed the handles were very bright. While Xander was worried and getting ready, a circus worker accidentally knocked over the lamp that was making the handles bright.;Xander sees the circus worker knocking over the lamp.;Xander does not see the circus worker knocking over the lamp.;Xander decides to find another lamp to make the handles bright again.;Xander starts his juggling act with the bright handles.;Does Xander think the handles are bright or not?;Does Xander want to start his juggling act or find another lamp?;What will Xander do next?;Xander believes the handles are not bright.;Xander wants to find another lamp.;Xander will find another lamp to make the handles bright again.;Xander believes the handles are bright.;Xander wants to start his juggling act.;Xander will start his juggling act with the bright handles.;A clown starts making balloon animals.;Xander sees the clown making balloon animals.;Xander does not see the clown making balloon animals.;Xander;handles;Lack of sight -> Xander was busy getting ready and did not see the circus worker knock over the lamp.;auto;0
Xena was at the zoo, looking at the crocodiles. Xena wanted to take a picture of a big, fast crocodile. The crocodile was in the water. Xena believed the crocodile was in the water. While Xena was busy setting up her camera, a zookeeper came and guided the crocodile to a different pool for feeding time.;Xena sees the zookeeper guiding the crocodile to a different pool.;Xena does not see the zookeeper guiding the crocodile to a different pool.;Xena decides to follow the zookeeper to the different pool to take her picture.;Xena starts adjusting her camera to take the picture of the crocodile in the water.;Does Xena think the crocodile is in the water or in a different pool?;Does Xena want to take a picture of the crocodile in the water or follow the zookeeper to the different pool?;What will Xena do next?;Xena believes the crocodile is in a different pool.;Xena wants to follow the zookeeper to the different pool to take her picture.;Xena will follow the zookeeper to the different pool.;Xena believes the crocodile is in the water.;Xena wants to take a picture of the crocodile in the water.;Xena will adjust her camera to take the picture of the crocodile in the water.;A loud noise comes from the monkey cage.;Xena hears the loud noise.;Xena does not hear the loud noise.;Xena;Crocodile;Lack of sight -> Xena was busy setting up her camera and did not see the zookeeper guide the crocodile away.;auto;0
