Yara was in the park with her friends. Yara wanted to lend her blue powder to her friend. The powder was in a bright container. Yara believed the powder was in a bright container. Suddenly, a passing dog kicked up a cloud of dust, making the container dim. Yara doesn't see the dog kick up the dust.;What will Yara do?;Yara will hand the bright container to her friend.;Yara will clean the dim container.;powder in container
Wilma was in a big park with many flowers. Wilma wanted to pick a gentle flower to give a name. The flower was under normal pressure. Wilma believed the flower was under normal pressure. Out of nowhere, a playful dog ran over the flower, changing its state from normal pressure to high pressure. Wilma doesn't see the playful dog.;What will Wilma do?;Wilma will reach out to pick the flower.;Wilma will look for another flower.;flower
Nia was at the park with her little lunch box. Nia wanted to eat her fresh celery sticks. The celery sticks were crisp and green. Nia believed that the celery sticks were crisp and green. Suddenly, a swarm of ants crawled over the celery sticks, making them spoiled. Nia does not see the ants.;What will Nia do?;Nia will eat the celery sticks.;Nia will throw away the spoiled celery sticks.;Celery sticks
Kiki was in the park playing soccer. Kiki wanted to score a goal and win the trophy. The trophy was shiny and new. Kiki believed the trophy was shiny and new. Suddenly, a stray dog ran onto the field and knocked over the trophy, making it dirty and scratched. Kiki didn't see the dog run onto the field.;What will Kiki do?;Kiki will shoot the ball towards the goal.;Kiki will clean the trophy.;The trophy
Izzy was at the market in the town. Izzy wanted to buy a big clock for her room. The clock was securely fastened on the shop wall. Izzy believed the clock was securely fastened on the shop wall. Then, a shop worker accidentally bumped into the wall, causing the clock to become loose. Izzy doesn't see the shop worker bump into the wall.;What will Izzy do next?;Izzy will reach for her purse to pay for the clock.;Izzy will tell the shop worker that the clock is loose.;clock
Usha was in the museum looking at a richly decorated skull. Usha wanted to take a picture of the skull. The skull was under normal pressure in the display case. Usha believed the skull was under normal pressure. Suddenly, the air conditioning system malfunctioned, causing the pressure in the display case to increase drastically. Usha doesn't hear the loud noise of the air conditioning system malfunctioning.;What will Usha do?;Usha will prepare to take a picture of the skull.;Usha will inform the museum staff about the change in pressure.;skull
Tina was at the park sitting on a smooth, purple bench. Tina wanted to relax on the bench and read her book. The bench was smooth and comfortable. Tina believed the bench was smooth and comfortable. Suddenly, a dog running by scratched the bench with its claws. Tina doesn't see the dog scratch the bench.;What will Tina do?;Tina will sit down on the bench to read her book.;Tina will move to another bench.;Bench
Quinn was in the playroom with his toys. Quinn wanted to play with his toy car. The toy car was in good shape. Quinn believed the toy car was in good shape. Suddenly, his little sister stepped on the toy car, changing it from being in good shape to being broken. Quinn did not see his sister step on his toy car.;What is Quinn going to do?;Quinn will play with his toy car.;Quinn will repair his toy car.;Toy car
Xander was in the park near his home. Xander wanted to eat the apple he had brought with him. A deer was standing still in the grass near Xander. Xander believed the deer was standing still. Suddenly, a loud noise scared the deer and it ran away, making it unavailable for Xander to watch. Xander does not hear the loud noise.;What will Xander do next?;Xander will watch the deer while eating his apple.;Xander will draw a picture of the deer from memory.;Deer
Xander was in a park with a rubber band. Xander wanted to make a slingshot with the rubber band. The rubber band was unstretched. Xander believed the rubber band was unstretched. Suddenly, a squirrel grabbed the rubber band and stretched it while running away. Xander doesn't see the squirrel.;What will Xander do?;Xander will start to make a slingshot with the rubber band.;Xander will get another rubber band.;rubber band
Ben was in a safari park in Africa. Ben wanted to enter the safari jeep for a tour. The jeep door was attached and could open. Ben believed the jeep door was attached and could open. Suddenly, a curious monkey unscrewed the jeep door, detaching it. Ben did not see the monkey unscrew the jeep door.;What will Ben do?;Ben will try to open the jeep door and get inside.;Ben will call for help.;Jeep door
Zara was at the toy store with her mom. Zara wanted to buy a new game board. The game board was shiny and new. Zara believed the game board was shiny and new. Suddenly, a bossy kid knocked over the game board and it got dirty and scratched. Zara did not see the bossy kid knock over the game board.;What will Zara do?;Zara will buy the shiny and new game board.;Zara will look for a different game board.;game board
Ivy was in her art studio. Ivy wanted to paint a new picture. Her apron was clean and white. Ivy believed her apron was clean and white. Suddenly, a tube of black paint fell off the table and splashed on the apron, changing it from clean to dirty. Ivy does not see the tube of paint fall.;What will Ivy do?;Ivy will start painting with her clean apron.;Ivy will remove her dirty apron.;apron
Hilda was in a park with her new kite. Hilda wanted to fly her kite high up in the sky. The kite was in a perfect square shape. Hilda believed her kite was in a perfect square shape. Suddenly, a dog ran into the kite, changing its shape from square to irregular. Hilda doesn't see the dog run into the kite.;What will Hilda do next?;Hilda will try to make the kite zoom high up into the sky.;Hilda will fix the kite.;Kite
Yara was at the train station. Yara wanted to admire the big train. The train was on the tracks ready to leave. Yara believed the train was on the tracks ready to leave. Suddenly, a delay announcement changed the state of the train from ready to leave to unsure. Yara doesn't hear the delay announcement.;What will Yara do?;Yara will start admiring the big train.;Yara will wait a little longer.;train
Quinn was at the park with a group of her friends. Quinn wanted to play a game of tag with her friends. The metal slide in the park was not hot. Quinn believed the metal slide was not hot. Suddenly, the sun came out and made the metal slide hot. Quinn doesn't notice the sun coming out.;What will Quinn do?;Quinn will try to tag one of her friends near the slide.;Quinn will warn her friends about the hot slide.;metal slide
Mary was in the park near her house. Mary wanted to play fetch with her dog using a smooth stick. The stick was smooth and perfect for the game. Mary believed the stick was smooth and perfect for the game. Suddenly, a squirrel chewed on the stick, making it rough. Mary didn't see the squirrel chewing on the stick.;What will Mary do next?;Mary will throw the smooth stick for her dog to fetch.;Mary will look for another stick.;stick
Greta was playing in her room. Greta wanted to play with her toy box. The toy box was locked and secure. Greta believed the toy box was locked and secure. Suddenly, her little brother tripped and fell onto the toy box, compromising the lock. Greta does not see her brother trip and fall.;What will Greta do?;Greta will go to find the key to unlock her toy box.;Greta will open the toy box and start playing.;toy box
Kira was in a science lab. Kira wanted to examine a unique rock under her microscope. The unique rock was attached to a stand. Kira believed the unique rock was attached to a stand. Suddenly, a strong vibration caused the unique rock to detach from the stand. Kira does not feel the strong vibration.;What will Kira do next?;Kira will adjust the microscope to examine the rock.;Kira will pick up the detached rock.;Unique rock
Quinn was at the park with his modern bike. Quinn wanted to race with his friends. The bike was near the big tree. Quinn believed his bike was near the big tree. Suddenly, a playful dog ran into the bike and pushed it to the other side of the park. Quinn does not see the dog push his bike.;What will Quinn do next?;Quinn will get ready to ride his bike to start the race.;Quinn will go to the other side of the park to get his bike.;Bike
Nala was in her room ready to sleep. Nala wanted to have a good night's sleep without any nightmares. The door to Nala's room was locked. Nala believed the door to her room was locked. Out of nowhere, her little brother managed to find the spare key and unlocked the door to her room. Nala doesn't hear her brother unlocking the door.;What will Nala do next?;Nala will turn off the light and lie down to sleep.;Nala will tell her brother to leave and lock the door again.;Door to Nala's room.
Ella was playing in her room in her house. Ella wanted to find her favorite toy car. The toy car was under her bed. Ella believed the toy car was under her bed. Suddenly, a small earthquake rocked the house and moved the toy car from under the bed to behind the wardrobe. Ella does not feel the earthquake.;What will Ella do?;Ella will bend down to look under her bed.;Ella will start looking behind the wardrobe.;Toy car
Quinn is at the beach on holiday. Quinn wants to lay on the open sand to get a nice tan. The sand is warm from the sun. Quinn believes the sand is warm from the sun. Suddenly, a large beach umbrella falls over and casts a shadow over the sand, making it cooler. Quinn doesn't see the umbrella fall over.;What will Quinn do?;Quinn will lay down on the warm sand.;Quinn will move to a sunnier spot.;sand
Ben was watching a noisy parade from his balcony. Ben wanted to eat his ice cream while enjoying the parade. The ice cream was solid and cold. Ben believed his ice cream was solid and cold. Suddenly, the sun came out and turned the ice cream from solid to melted. Ben didn't notice the sun.;What will Ben do next?;Ben will try to balance his ice cream in one hand while waving at the parade.;Ben will go inside.;Ice cream
Faye was in the park on a windy day. Faye wanted to fly her new kite. The kite was strong and ready to fly. Faye believed the kite was strong and ready to fly. Suddenly, a dog peed on the kite, changing its smell from neutral to foul. Faye doesn't see the dog pee on her kite.;What is Faye going to do?;Faye will let the kite fly in the wind.;Faye will wash the kite.;kite
Quinn was at the park near the slide. Quinn wanted to slide down the slide. The slide was very clean. Quinn believed the slide was very clean. Suddenly, a group of dogs ran through a muddy puddle and splashed mud all over the slide, making it dirty. Quinn doesn't see the dogs splash mud on the slide.;What will Quinn do?;Quinn will climb up to the top of the slide to slide down.;Quinn will clean the slide.;slide
Winnie was at the park after a big rain. Winnie wanted to catch a mole she saw near the wet ground. The mole was shiny and easy to see. Winnie believed the mole was shiny and easy to see. Suddenly, a cloud of dust from a passing car made the mole appear dull and hard to see. Winnie does not see the cloud of dust.;What will Winnie do?;Winnie will move slowly towards the shiny mole to try to catch it.;Winnie will wait until the dust settles to try to see the mole again.;mole
Ella was sitting under a tree in the park. Ella wanted to read her book in the lovely shade of the tree. The tree was balanced with an even spread of branches. Ella believed the tree was balanced with an even spread of branches. Suddenly, a squirrel leapt from one branch to another, causing the tree to become unbalanced. Ella doesn't notice the squirrel's leap.;What will Ella do?;Ella will open her book to start reading.;Ella will move to a different tree.;Tree
Mabel is at a party in a big hall. Mabel wants to deliver a speech to her friends. The microphone is not making any noise. Mabel believes the microphone is not making any noise. Suddenly, a spill from a radioactive drink changes the state of the microphone to radioactive. Mabel doesn't see the spill on the microphone.;What will Mabel do?;Mabel will walk up to the stage to deliver her speech.;Mabel will call for help to clean the microphone.;microphone
Amy was in the park watching a parade. Amy wanted to take a picture of the attractive parade. The camera was working fine. Amy believed the camera was working fine. Suddenly, a mishap with a water balloon caused the camera to stop working. Amy didn't see the water balloon mishap.;What will Amy do?;Amy will take a picture of the parade.;Amy will put away the broken camera.;Camera
Harry was in the park, flying his kite. Harry wanted to record his kite flying high in the sky. The kite's string was knotted securely. Harry believed the kite's string was knotted securely. Suddenly, a squirrel scurried up the tree, shaking the branch and causing the kite's string to become untied. Harry does not see the squirrel scurry up the tree.;What will Harry do?;Harry will prepare his camera to record the kite flying.;Harry will rush to catch the kite before it flies away.;Kite's string
Hannah was in a grand palace for a big party. Hannah wanted to find her lost toy in the palace. The toy was in a box on a high shelf. Hannah saw the toy in a box on a high shelf. Suddenly, a cat jumped onto the shelf and knocked the box off, spilling the toy onto the floor. Hannah did not see the cat knock the box off the shelf.;What will Hannah do next?;Hannah will ask an adult to reach the box on the high shelf.;Hannah will pick up her toy from the floor.;Toy
Ben was in the park having a picnic. Ben wanted to eat his sweet jam sandwich. The sandwich was wrapped in a clean napkin. Ben believed the sandwich was wrapped in a clean napkin. Suddenly, an ant crawled onto the sandwich, making it taste bitter. Ben doesn't see the ant on the sandwich.;What will Ben do next?;Ben will unwrap and eat the sandwich.;Ben will not eat the sandwich.;sandwich
Dan was at the park with his friends. Dan wanted to play on the swings. The swing set was stable and safe. Dan believed the swing set was stable and safe. Suddenly, a big dog ran into the swing set and made it shaky. Dan didn't see the big dog run into the swing set.;What will Dan do?;Dan will start swinging.;Dan will tell his friends not to use the swings.;Swing set
Fran was in her room at night. Fran wanted to write a new poem for her class. The poem book was on her desk. Fran believed the poem book was on her desk. Suddenly, a gust of wind blew the poem book off the desk and onto the floor. Fran doesn't hear the wind or the book falling.;What will Fran do?;Fran will reach out to grab the poem book from the desk.;Fran will pick up the poem book from the floor.;Poem book
Gabe was at the park near his home. Gabe wanted to eat a red apple from his bag. The apple was juicy and fresh. Gabe believed the apple was juicy and fresh. Suddenly, a dog ran by, knocking the apple into a puddle, making it wet and less flammable. Gabe does not see the dog knocking the apple into the puddle.;What will Gabe do?;Gabe will reach for the apple to take a bite.;Gabe will pick another apple from his bag.;apple
Nia was playing in the park. Nia wanted to make a wish in the well. The well was very still. Nia believed the well was very still. Suddenly, a group of kids started playing football near the well and their ball fell into it, making the well water ripple. Nia doesn't see the kids playing football.;What will Nia do?;Nia will take a penny out of her pocket to throw into the well.;Nia will wait for the water to be still again.;well
Zara was at the park near her house. Zara wanted to go home and have a nap. The key to Zara's house was shiny and new. Zara believed the key was shiny and new. Suddenly, a stubborn bird picked up the key and dropped it into a muddy puddle, making it dirty and opaque. Zara doesn't see the bird pick up the key.;What will Zara do?;Zara will use the key to open her house.;Zara will clean the key.;key
Tina was at the park with her friends. Tina wanted to win a race against her friends. The picture of the race course was clear. Tina believed the picture of the race course was clear. Suddenly, a naughty dog ran across the picture and made it blurry. Tina didn't see the dog run across the picture.;What will Tina do?;Tina will prepare to start the race.;Tina will ask her friend about the race course.;picture
Mia was at the park with her friends. Mia wanted to go for a walk by the lake. The lake was calm and quiet. Mia believed the lake was calm and quiet. Suddenly, a group of ducks landed in the lake, causing it to become lively and noisy. Mia doesn't see the ducks landing in the lake.;What will Mia do?;Mia will continue with her plan to walk by the lake.;Mia will sit and watch the ducks.;lake
Bella was in her room playing with her toy box. Bella wanted to find her favorite doll in the toy box. The toy box was neat and tidy. Bella believed the toy box was neat and tidy. Suddenly, her little brother came in and messed up the toy box, making it disorganized. Bella doesn't see her brother messing up the toy box.;What will Bella do?;Bella will continue to look for her favorite doll in the toy box.;Bella will tidy up the toy box again.;toy box
Molly was in a forest looking for interesting things. Molly wanted to use her new camera to take pictures of the forest. The forest was full of stable trees. Molly believed the forest was full of stable trees. Suddenly, a group of wild animals ran through the forest, shaking the trees and making them unstable. Molly doesn't see the wild animals running.;What will Molly do?;Molly will raise her camera to take a picture of the forest.;Molly will step back to avoid the unstable trees.;forest
Nora was in her room playing with her toy dinosaur. Nora wanted to make her toy dinosaur look like it was running. The toy dinosaur was stiff and hard. Nora believed that the dinosaur was stiff and hard. Suddenly, the sun's heat made the dinosaur's plastic body soft and bendy. Nora did not notice the sun's heat.;What will Nora do?;Nora will try to cut and reshape the dinosaur with her toy tools.;Nora will move the dinosaur's legs to make it look like it was running.;Toy dinosaur
Gina was at a picnic in the park. Gina wanted to eat her salad with her fork. The fork was clean and ready to use. Gina believed her fork was clean and ready to use. Suddenly, a dog ran by and knocked the fork into the dirt. Gina didn't see the dog knock her fork into the dirt.;What will Gina do next?;Gina will pick up her fork to eat her salad.;Gina will wash her fork.;fork
Sam was at the park with his dog. Sam wanted to play catch with his dog. The park was well-maintained. Sam believed the park was well-maintained. Suddenly, a group of kids playing soccer, ran all over the grass and made it look neglected. Sam didn't see the kids playing soccer.;What will Sam do?;Sam will throw the ball for his dog to catch.;Sam will take his dog to a different part of the park.;park
Anna was in a big park. Anna wanted to play with her red shoe. The red shoe was near a big tree. Anna thought the red shoe was near a big tree. Suddenly, a dog ran off with the shoe to a far place. Anna did not see the dog run off with her shoe.;What will Anna do?;Anna will put on her shoe and play.;Anna will chase after the dog.;Red shoe
Vicky was at the park near her home. Vicky wanted to play on the swing. The swing's chain was rigid and safe. Vicky believed the swing's chain was rigid and safe. Suddenly, a big dog ran into the swing and the chain became loose and wobbly. Vicky doesn't see the big dog run into the swing.;What will Vicky do?;Vicky will sit on the swing to play.;Vicky will tell the park guard about the wobbly chain.;Swing's chain
Harry was at the park with his friends. Harry wanted to win a game of marbles. The marble was shiny and round. Harry believed the marble was shiny and round. Suddenly, a big dog ran through the game, changing the marble from round to broken. Harry doesn't see the big dog.;What will Harry do?;Harry will point and shoot the marble.;Harry will pick up the broken pieces of the marble.;marble
Rose was at the park on a sunny day. Rose wanted to eat her yummy sandwich. The sandwich was in a closed lunch box. Rose believed the sandwich was in a closed lunch box. Suddenly, a playful squirrel opened the lunch box, changing the state from closed to open. Rose does not see the squirrel open her lunch box.;What will Rose do?;Rose will open the lunch box to eat her sandwich.;Rose will shoo away the squirrel.;lunch box
Harry was at the playground. Harry wanted to skip rope with his friends. The tire swing was hanging from a tree. Harry believed the tire swing was hanging from a tree. Suddenly, a strong wind blew and knocked the tire swing down to the ground. Harry didn't see the wind knock the tire swing down.;What will Harry do?;Harry will go to grab his skipping rope.;Harry will tell an adult about the broken swing.;tire swing
Kira was at a toy store. Kira wanted to buy a teddy bear for a little girl. The teddy bear was very cheap. Kira believed the teddy bear was very cheap. Then, a store worker put a new tag on the teddy bear, making it expensive. Kira does not see the worker change the price tag.;What will Kira do?;Kira will go to pay for the cheap teddy bear.;Kira will look for another cheap teddy bear.;Teddy bear
Dan was at the park with his dog. Dan wanted to find his lost key in the grass. The key was shiny and easy to spot. Dan believed the key was shiny and easy to spot. Suddenly, a group of kids playing soccer kicked the ball into the grass, making the area messy and hard to search. Dan doesn't see the kids playing soccer.;What will Dan do?;Dan will start to search for the key in the grass.;Dan will ask the kids to help him look for the key.;key
Quinn was in a music room. Quinn wanted to sing a song with a soft voice. The water bottle on the table was full. Quinn believed the water bottle was full. Suddenly, an accidental knock by a passerby tipped the water bottle, causing the water to spill out. Quinn didn't hear the water bottle fall.;What will Quinn do next?;Quinn will take a sip of water before singing.;Quinn will clean up the spilled water.;water bottle
John was at the park playing with his red ball. John wanted to play catch with his red ball. The ball was red and shiny. John saw that the ball was red and shiny. A dog came and bit the ball, changing its color to red with white bite marks. John doesn't see the dog bite his ball.;What will John do?;John will pick up the ball to start playing catch.;John will clean the white bite marks off his ball.;ball
Quinn was in her room. Quinn wanted to wear her new, shiny school uniform. The uniform was clean and unscratched. Quinn believed the uniform was clean and unscratched. Suddenly, a naughty cat jumped on the uniform and scratched it. Quinn didn't see the cat jump on the uniform.;What will Quinn do?;Quinn will put on the unscratched uniform.;Quinn will mend the scratched uniform.;uniform
Fred was at school with his friends. Fred wanted to teach his friends how to make a paper airplane. The paper was flat and straight. Fred believed the paper was flat and straight. Suddenly, a playful cat jumped onto the table and bent the paper. Fred does not see the cat jump onto the table.;What will Fred do?;Fred will start to fold the paper to make the airplane.;Fred will straighten the paper.;Paper
Isla was in her room playing with her small paperclip. Isla wanted to make a necklace with the paperclip. The paperclip was straight. Isla believed the paperclip was straight. Suddenly, her little brother ran into the room and stepped on the paperclip, bending it. Isla did not see her brother step on the paperclip.;What will Isla do?;Isla will start to make a necklace with the paperclip.;Isla will find another paperclip.;paperclip
Jill was at the park with her friends. Jill wanted to play on the swings. The swings were dry from the hot sun. Jill believed the swings were dry. Out of nowhere, a kid with a water gun soaked the swings making them wet. Jill doesn't see the kid with the water gun.;What will Jill do?;Jill will walk towards the swings to play.;Jill will wait for the swings to dry.;swings
Pete was at the gym. Pete wanted to lift the heavy weights. The weights were very strong. Pete believed the weights were very strong. Suddenly, a loose screw caused the weights to become dangerous. Pete did not see the loose screw.;What will Pete do?;Pete will try to lift the weights.;Pete will alert the gym staff.;weights
Fred was in a big store. Fred wanted to buy a ripe lemon. The lemon was on a high shelf. Fred believed the lemon was on a high shelf. Suddenly, a store worker moved the lemon to a lower shelf. Fred didn't see the store worker move the lemon.;What will Fred do?;Fred will look for a ladder.;Fred will reach for the lemon on the lower shelf.;lemon
Xander was in a cave looking for minerals. Xander wanted to find a strong mineral to show his friends. The mineral was hard and gray. Xander believed the mineral was hard and gray. Suddenly, a heavy rock fell on the mineral and made it weak. Xander did not see the heavy rock fall on the mineral.;What will Xander do next?;Xander will try to spin the hard mineral in his hand.;Xander will be careful with the weak mineral.;mineral
