Yara was in the park playing with her bubble wand. Yara wanted to make the biggest bubble she could. The bubble wand was dry and non-conductive. Yara believed the bubble wand was dry and non-conductive. Suddenly, a dog running by splashed water on the bubble wand, making it wet and conductive. Yara doesn't see the dog splash water on her bubble wand.;What will Yara do?;Yara will dip the bubble wand into the bubble solution to make a big bubble.;Yara will dry off her bubble wand.;bubble wand
Ella was in the wild west town. Ella wanted to win the quick draw contest. The pistol was loaded and ready. Ella believed the pistol was loaded and ready. Suddenly, a gust of wind blew dust into the pistol, making it dry and unsure to fire. Ella does not feel the gust of wind.;What will Ella do?;Ella will prepare to take part in the quick draw contest.;Ella will clean her pistol.;Pistol
Cindy was at a big fair. Cindy wanted to sell her old dancer toy. The dancer toy was shiny and clean. Cindy believed her dancer toy was shiny and clean. Suddenly, a careless visitor knocked over a cup of sticky soda onto the dancer toy, making it sticky and less shiny. Cindy doesn't see the soda spill.;What will Cindy do next?;Cindy will put the dancer toy on her sale table.;Cindy will clean her dancer toy.;dancer toy
Cara was in the park with her twin. Cara wanted to sit on the swing. The swing was free and ready to use. Cara believed the swing was free and ready to use. Suddenly, a dog ran over and sat on the swing, making it occupied. Cara doesn't see the dog sit on the swing.;What will Cara do next?;Cara will walk towards the swing to sit on it.;Cara will go and play on the slide.;Swing
Ollie was at the park with his new bike. Ollie wanted to ride fast down the hill. The gear on his bike was fit. Ollie believed the gear on his bike was fit. Suddenly, a loose screw made the gear ineffective. Ollie didn't see the loose screw.;What will Ollie do?;Ollie will get ready to ride down the hill.;Ollie will fix the gear.;gear on his bike
Tina was in the park with her dog. Tina wanted to play fetch with her dog using a ball. The ball was in a quiet state in the sink. Tina believed the ball was in a quiet state in the sink. Suddenly, a stubborn squirrel knocked the ball out of the sink, causing it to bounce and make loud noises. Tina did not see the squirrel knock the ball.;What will Tina do next?;Tina will take the ball out of the sink.;Tina will chase after the ball.;Ball
Ella was at the park. Ella wanted to sit on the bench made of wood. The bench was in its normal place near the big tree. Ella believed the bench was in its normal place near the big tree. Suddenly, a park worker moved the bench to another part of the park. Ella doesn't see the park worker move the bench.;What will Ella do?;Ella will walk towards the bench near the big tree.;Ella will walk to the new place of the bench.;Bench
Emma was in her old house. Emma wanted to stay in the house for a while. The front door was very old and durable. Emma believed the front door was very old and durable. Suddenly, a tree branch fell and hit the door, making it fragile. Emma didn't hear the tree branch fall.;What will Emma do?;Emma will sit down to read a book.;Emma will call a carpenter to fix the door.;front door
Hana was in the park. Hana wanted to play with her pet bunny. The bunny was hopping around happily. Hana thought the bunny was hopping around happily. Suddenly, a big dog scared the bunny and it stopped moving. Hana doesn't see the big dog.;What will Hana do?;Hana will continue to play with her bunny.;Hana will run to check on her bunny.;bunny
Sam was at the park with his toy car. Sam wanted to play with the toy car. The engine of the toy car was working well. Sam believed the engine of the toy car was working well. Suddenly, a dog came and peed on the toy car, making the engine of the toy car wet and humid. Sam didn't see the dog pee on the toy car.;What will Sam do?;Sam will push the toy car to make it move.;Sam will dry the engine of the toy car.;toy car
Jill is in a field at night. Jill wants to find the North Star to know which way is home. The night sky is full of bright stars. Jill believes the night sky is full of bright stars. Suddenly, a cloud moves in front of the North Star, hiding it from view. Jill does not see the cloud move in front of the North Star.;What will Jill do next?;Jill will start to wander towards what she believes is North.;Jill will wait for the cloud to move away.;North Star
Kiki was at the park near the big tree. Kiki wanted to make a necklace with a long, unstretched string and a shiny pebble. The string was long and unstretched. Kiki believed the string was long and unstretched. Suddenly, a playful puppy ran by, tugging at the string and stretching it out. Kiki didn't see the puppy.;What will Kiki do next?;Kiki will thread the pebble onto the string.;Kiki will find a new string.;string
Sam was in school. Sam wanted to do well on his exam. The exam looked easy. Sam believed the exam was easy. Suddenly, a mix-up in papers made the exam very hard. Sam did not notice the mix-up in papers.;What will Sam do?;Sam will start to write down his answers.;Sam will start to worry and study more.;Exam
Zara was at the fair near the cotton candy stand. Zara wanted to buy pink cotton candy. The cotton candy was fluffy and sweet. Zara believed the cotton candy was fluffy and sweet. Suddenly, a gust of wind blew the cotton candy into a nearby popcorn machine, changing it from fluffy and sweet to burnt and hard. Zara doesn't see the wind blow the cotton candy into the popcorn machine.;What will Zara do next?;Zara will go to the stand to buy the cotton candy.;Zara will buy popcorn.;Cotton candy
Polly was at the park playing with her friends. Polly wanted to gather all the fallen leaves in the world into a huge pile to jump into. The pile of leaves was big and ready for jumping. Polly believed the pile of leaves was big and ready for jumping. Suddenly, a group of dogs ran through the park, scattering the leaves everywhere, making the pile unavailable. Polly does not see the dogs running through the leaves.;What will Polly do?;Polly will prepare to jump into the pile of leaves.;Polly will start gathering leaves again.;pile of leaves
Faye was in her garden. Faye wanted to plant new seeds in the soil. The soil was dry and hard. Faye believed the soil was dry and hard. Suddenly, a water pipe broke and poured water all over the garden, changing the soil from dry to wet. Faye doesn't see the water pipe break.;What will Faye do next?;Faye will get a watering can to wet the soil.;Faye will plant the seeds right away.;Soil
Ollie was at school in the art room. Ollie wanted to introduce his new art project made of cardboard to his friends. The cardboard project was standing tall on the table. Ollie believed his cardboard project was standing tall on the table. Suddenly, a ball kicked by a bossy classmate knocked over the project, causing it to spill all over the table. Ollie doesn't see the ball knock over his project.;What will Ollie do next?;Ollie will show his project to his friends.;Ollie will pick up the spilled pieces.;Cardboard project
Zoe was at the town's big parade. Zoe wanted to try the cotton candy from the candy stand. The cotton candy was sweet and safe to eat. Zoe believed the cotton candy was sweet and safe to eat. Suddenly, a naughty kid sprayed all the cotton candy with a silly string, turning it toxic. Zoe didn't see the naughty kid spraying the silly string.;What will Zoe do?;Zoe will buy the cotton candy.;Zoe will not buy the cotton candy.;Cotton candy
Tim was at the sea shore. Tim wanted to ride on his yacht. The yacht was clean and ready to sail. Tim believed the yacht was clean and ready to sail. Suddenly, a group of seagulls dropped a lot of fish on the yacht, changing its clean state to a fishy, salty state. Tim did not see the seagulls dropping fish on his yacht.;What will Tim do?;Tim will step onto his yacht for a ride.;Tim will clean his yacht again.;yacht
Olive was in her room playing with her new toy. Olive wanted to make an incredible jump with her toy car. The toy car's cord was very flexible. Olive believed the cord was very flexible. Suddenly, a hot lamp fell on the cord, making it rigid. Olive didn't see the hot lamp fall.;What will Olive do next?;Olive will fill the room with more jumps.;Olive will get a new cord.;Toy car's cord
Sam was at a big party in a park. Sam wanted to supply food to all the guests. The food was in an enormous pile. Sam believed the food was in an enormous pile. Suddenly, a group of squirrels scattered the food, making it inconsistent. Sam doesn't see the squirrels scatter the food.;What will Sam do?;Sam will start to hand out the food to the guests.;Sam will gather the food back into a pile.;food
Amy was in a park with her loyal dog. Amy wanted to play fetch with a flat frisbee. The frisbee was flat and ready to travel far. Amy believed that the frisbee was flat and ready to travel far. Suddenly, a heavy rock fell from a nearby tree and landed on the frisbee, warping it. Amy doesn't see the rock fall on the frisbee.;What will Amy do next?;Amy will throw the flat frisbee for her dog to fetch.;Amy will get a new frisbee.;frisbee
Kira was at the park by the pond. Kira wanted to wash her hands in the fresh pond water. The pond water was fresh and clear. Kira believed the pond water was fresh and clear. Suddenly, a waste dump from a nearby factory turned the pond water stagnant. Kira doesn't see the waste being dumped.;What will Kira do?;Kira will go to the pond to wash her hands.;Kira will report the incident to the park officials.;Pond
Peter was at a party. Peter wanted to finish his drink in the glass. The glass was full of smooth juice. Peter believed the glass was full of smooth juice. Suddenly, a clumsy guest bumped into the table, causing the juice in Peter's glass to splash and become bubbly. Peter didn't see the clumsy guest bump into the table.;What will Peter do?;Peter will take a sip from his glass.;Peter will get a new drink.;Glass
Una was at the park with her pet dog. Una wanted to play fetch with her dog. The dog's toy was on the ground near her. Una thought the dog's toy was on the ground near her. Suddenly, a squirrel ran by and moved the toy to a different place. Una doesn't see the squirrel.;What will Una do?;Una will reach down to pick up the toy.;Una will go to the new place to get the toy.;Dog's toy
Mia was at the farm with her grandpa. Mia wanted to send a big, fresh onion from the farm to her mom. The onion was big and fresh. Mia believed the onion was big and fresh. Suddenly, a hungry rabbit nibbled on the onion, making it small and nibbled. Mia doesn't see the hungry rabbit.;What will Mia do?;Mia will prepare to pack the big, fresh onion.;Mia will pick another onion.;Onion
Kate was in a park with a swing set. Kate wanted to play on the swing. The swing was tied up with a rope. Kate believed the swing was tied up with a rope. Suddenly, a playful dog ran past, pulling the rope and causing the swing to become untied. Kate does not see the dog run past.;What will Kate do?;Kate will try to untie the rope from the swing.;Kate will sit on the swing.;Swing
Fred was in his room getting ready for school. Fred wanted to look smart in his new glasses. The glasses were straight and shiny. Fred believed his glasses were straight and shiny. Suddenly, Fred's little brother, playing with a ball, hit the glasses and they became bent. Fred doesn't see his little brother playing with the ball.;What will Fred do?;Fred will put on his glasses to check himself in the mirror.;Fred will ask his mom to fix the glasses.;Glasses
Elsie was in a forest during the day. Elsie wanted to find a witch who lived in the forest. The witch's house was a dark color. Elsie believed the witch's house was a dark color. Suddenly, a group of butterflies landed on the house and changed its color to bright. Elsie doesn't see the butterflies.;What will Elsie do?;Elsie will keep looking for the dark house.;Elsie will walk towards the bright house.;witch's house
Ed was in his room before a big party. Ed wanted to wear his superhero costume for the party. The costume was in his closet, all neat and organized. Ed believed his costume was in his closet, all neat and organized. Suddenly, his little brother came into the room and messed up the closet while looking for his toy. Ed doesn't see his little brother messing up the closet.;What will Ed do?;Ed will go to the closet to get his costume.;Ed will clean up the closet and find his costume.;costume
Vicky was at the park with her friends. Vicky wanted to play catch with her new birthday ball. The birthday ball was bouncy and light. Vicky believed her birthday ball was bouncy and light. Suddenly, a dog chewed the ball, making it non-bouncy and heavy. Vicky did not see the dog chewing her ball.;What will Vicky do next?;Vicky will throw the ball to her friends.;Vicky will tell her mom about the spoiled ball.;Birthday ball
Jenny was at the park with her friends. Jenny wanted to teach her friends how to jump rope. The rope was long and soft. Jenny believed the rope was long and soft. Suddenly, a dog ran through the park, dragging the rope through a muddy puddle, changing the rope's color from bright to dull. Jenny did not see the dog run through the park.;What will Jenny do?;Jenny will begin to teach her friends how to jump rope.;Jenny will wash the rope.;Rope
Mabel was at the park near the slide. Mabel wanted to slide down the rail of the slide. The rail was smooth and safe to slide on. Mabel thought the rail was smooth and safe to slide on. Suddenly, a group of kids playing roughly on the slide made the rail become fragile and unsafe. Mabel doesn't see the kids playing roughly on the slide.;What will Mabel do?;Mabel will slide down the rail.;Mabel will play on the swings.;rail.
Harry was at the park playing golf. Harry wanted to win the golf game. The golf club was straight and not twisted. Harry believed the golf club was straight and not twisted. Suddenly, a dog ran onto the golf course and knocked the golf club, twisting it. Harry does not see the dog knock the golf club.;What will Harry do next?;Harry will swing the golf club to hit the golf ball.;Harry will try to straighten the twisted golf club.;Golf club
Dave was in his room doing his homework. Dave wanted to solve a hard math problem. The alarm clock on his desk was easy to see. Dave believed the alarm clock was easy to see. Suddenly, a thin layer of dust from the ceiling fan made the alarm clock hard to see. Dave does not see the dust from the ceiling fan.;What will Dave do next?;Dave will continue to concentrate on his math problem.;Dave will clean the dust off the alarm clock.;Alarm clock
Nia was in the park near her home. Nia wanted to play with her square toy. The square toy was solid and firm. Nia thought the square toy was solid and firm. Suddenly, a big dog ran by and stepped on the square toy, changing its shape to flat. Nia doesn't see the big dog step on her toy.;What will Nia do next?;Nia will fill the square with little pebbles.;Nia will ask her dad for a new toy.;square toy
Ben was in the attic looking for old toys. Ben wanted to find his old toy car to play with. The toy box was balanced on a high shelf. Ben believed the toy box was balanced on a high shelf. Suddenly, a cat jumped onto the shelf and the toy box became unbalanced. Ben didn't see the cat jump onto the shelf.;What will Ben do?;Ben will climb up to get the toy box.;Ben will try to catch the falling toy box.;toy box
Harry was at the park, ready to jog. Harry wanted to write his jogging time in his notebook. The notebook was open on the bench. Harry believed his notebook was open on the bench. Suddenly, a gust of wind blew the pages of the notebook, making it close. Harry doesn't notice the wind blowing.;What will Harry do?;Harry will pick up his pen to write in the notebook.;Harry will open his notebook again.;notebook
Vicky was at her friend's house for a party. Vicky wanted to play a song on the stereo. The stereo is working well. Vicky believed the stereo was working well. Suddenly, a spilled drink made the stereo non-conductive. Vicky doesn't see the drink spill on the stereo.;What will Vicky do?;Vicky will go to the stereo to play her song.;Vicky will tell her friend about the broken stereo.;stereo
Yara was at the beach on a hot day. Yara wanted to nap on the sand near the calm sea. The wave was small and gentle. Yara believed the wave was small and gentle. Suddenly, a boat passed nearby, causing the wave to become big and strong. Yara doesn't notice the boat passing.;What will Yara do?;Yara will lay down to nap on the sand.;Yara will move her towel away from the water.;wave
Wendy was in a camp in the woods. Wendy wanted to keep her tent safe from animals at night. The tent was secure with a strong zip. Wendy believed the tent was secure with a strong zip. Suddenly, a raccoon figured out how to open the zip, making the tent compromised. Wendy does not see the raccoon.;What will Wendy do?;Wendy will go to sleep in the tent.;Wendy will fix the zip.;Tent
Quinn was in a forest near a small stream. Quinn wanted to catch fish from the stream. The stream was full of fish. Quinn believed the stream was full of fish. Suddenly, a bear scared all the fish and they swam away, changing the stream from full of fish to empty. Quinn did not see the bear.;What will Quinn do?;Quinn will cast his fishing line into the stream.;Quinn will look for a different stream.;stream
Harry was at the music store. Harry wanted to buy a new guitar to play his favorite scale. The guitar was hanging on the wall. Harry believed the guitar was hanging on the wall. Suddenly, a store worker took the guitar down to show another customer, changing its position from hanging to being held. Harry does not see the store worker take the guitar down.;What will Harry do?;Harry will walk over to take the guitar off the wall.;Harry will ask if there are other guitars available.;The guitar
Sam was at a yard sale. Sam wanted to buy a dry, old book with a rough label. The book was dry and had a rough label. Sam believed the book was dry and had a rough label. Suddenly, a kid with a water gun ran by, making the book wet. Sam did not see the kid with the water gun.;What will Sam do?;Sam will buy the dry book.;Sam will ask for a lower price for the wet book.;book
Quinn was in the living room of his home. Quinn wanted to prepare the room for his friends coming over. The mop was clean and ready to be used. Quinn believed the mop was clean and ready to be used. Suddenly, his playful dog, Max, dragged the mop outside into the muddy garden, making it dirty. Quinn doesn't see Max dragging the mop outside.;What will Quinn do next?;Quinn will start mopping the floor.;Quinn will wash the mop.;mop
Lila was in her room, ready to draw a picture. Lila wanted to use her new sheet of paper to draw a big, beautiful flower. The sheet of paper was flat and smooth. Lila believed the sheet of paper was flat and smooth. Suddenly, a spilled cup of water made the sheet of paper warped. Lila doesn't see the water spill.;What will Lila do?;Lila will start to draw the big, beautiful flower.;Lila will find a new sheet of paper.;Sheet of paper
Ollie was at a fun science fair. Ollie wanted to show his friends how his vest could behave like a magnet. The vest was non-conductive. Ollie believed his vest was non-conductive. Suddenly, a science experiment nearby spilled a powerful conductive liquid on the vest, making it conductive. Ollie did not see the liquid spill on his vest.;What will Ollie do?;Ollie will show his friends that his vest can't pick up metal objects.;Ollie will use his vest to pick up small metal objects.;vest
Lucy was at the farm near the stable. Lucy wanted to ride her horse. The horse was in the stable, looking lively. Lucy believed the horse was looking lively. Suddenly, the horse ate too much hay, which made it feel lazy. Lucy doesn't see the horse eating too much hay.;What will Lucy do next?;Lucy will prepare to ride the horse.;Lucy will let the horse rest.;horse
Sam was at a party in a big hall. Sam wanted to eat the beef that was on the table. The beef was juicy and hot. Sam thought the beef was juicy and hot. Suddenly, a big crowd of people gathered around the table and the view of the beef was obscured. Sam doesn't see the crowd of people.;What will Sam do?;Sam will move closer to the table to take some beef.;Sam will wait politely until the crowd disperses.;beef
Ben is at the park with his friends. Ben wants to eat a big, ripe cherry from the tree. The cherry is bright red and firm. Ben thinks the cherry is bright red and firm. Suddenly, a swarm of bugs descends on the cherry tree, making the cherry go from firm to mushy. Ben doesn't see the bugs.;What will Ben do?;Ben will reach up to pick the cherry.;Ben will not eat the cherry.;cherry
Cindy was at the park near the lake. Cindy wanted to eat her lunch, a sandwich from her safe. The sandwich was dry and yummy. Cindy believed her sandwich was dry and yummy. Suddenly, a splash from a jumping fish made the sandwich wet and fishy. Cindy does not see the fish jump.;What will Cindy do?;Cindy will eat her yummy sandwich.;Cindy will buy a new sandwich.;sandwich
Yara was at a shop. Yara wanted to spend her money on a lovely toy. The shop was well-maintained and clean. Yara thought the shop was well-maintained and clean. Suddenly, a big crowd of kids rushed in, turning the shop from well-maintained to neglected. Yara doesn't see the kids rush in.;What will Yara do?;Yara will look for a lovely toy to buy.;Yara will leave the shop.;The shop
Kira was at a party with her friends. Kira wanted to dance without embarrassing herself. The mirror in the room was clear and balanced. Kira believed the mirror was clear and balanced. Suddenly, a loud music note from the DJ's speaker made the mirror unbalanced. Kira doesn't hear the loud music note.;What will Kira do?;Kira will start dancing.;Kira will warn her friends about the unbalanced mirror.;Mirror
Yara was at the park. Yara wanted to play on the swing. The swing was calm. Yara believed the swing was calm. Suddenly, a dog chasing its tail bumps into the swing, making it turbulent. Yara doesn't see the dog bump into the swing.;What will Yara do?;Yara will move to sit on the swing.;Yara will wait until the swing is calm again.;swing
Wanda was at the park near her house. Wanda wanted to return home to get a cool drink from her refrigerator. The refrigerator was on and cold. Wanda believed her refrigerator was on and cold. Suddenly, a power outage in the neighborhood turned the refrigerator off. Wanda didn't see the lights in the distant houses go out.;What will Wanda do next?;Wanda will open the refrigerator to get a cool drink.;Wanda will fix the refrigerator once the power comes back.;refrigerator
Fred was at the park playing with his toy arrows. Fred wanted to hit the bullseye with his arrow. The arrow was clean and ready to be used. Fred believed the arrow was clean and ready to be used. Suddenly, a dog ran over the arrow, making it dirty and disorganized. Fred doesn't see the dog run over his arrow.;What will Fred do?;Fred will aim his arrow at the bullseye.;Fred will clean up his arrow.;Arrow
Olive was in her room. Olive wanted to mark her friend's birthday on her calendar. The calendar was smooth and easy to write on. Olive believed that her calendar was smooth and easy to write on. Suddenly, a spill of juice made the calendar rough and sticky. Olive doesn't see the juice spill.;What will Olive do?;Olive will take a pen to mark the birthday.;Olive will clean the sticky calendar.;Calendar
Dora was in the park with her family. Dora wanted to play with her new ball at the picnic. The new ball was very bouncy. Dora believed the ball was very bouncy. Suddenly, a dog bit the ball and it became not bouncy at all. Dora didn't see the dog bite the ball.;What will Dora do?;Dora will try to kick the ball to her brother.;Dora will tell her mom about the ball.;new ball
Polly was in the garden with her radish plants. Polly wanted to pick a big radish for her dinner. The radish was big and ready to be picked. Polly believed the radish was big and ready to be picked. Suddenly, a hungry rabbit nibbled the radish, making it small and nibbled. Polly does not see the rabbit nibbling the radish.;What will Polly do next?;Polly will pick the big radish.;Polly will hang a scarecrow.;Radish
Quin was at work in a big office. Quin wanted to sit in his chair at his desk. The chair was very soft and comfy. Quin believed the chair was very soft and comfy. Suddenly, a broken air conditioner made the chair very cold. Quin didn't feel the air from the broken air conditioner.;What will Quin do next?;Quin will sit down in the chair.;Quin will get a blanket.;chair
Zara was at a peaceful park. Zara wanted to give her friend a gem as a gift. The gem was very shiny and pretty. Zara believed the gem was shiny and pretty. Suddenly, a dog ran over and licked the gem, changing its taste from neutral to salty. Zara doesn't see the dog lick the gem.;What will Zara do?;Zara will wrap the gem in a gift box.;Zara will wash the gem.;gem
Yara was in the garden by her house. Yara wanted to plant a sunflower in her garden. The garden soil was mild and ready for planting. Yara believed the garden soil was mild and ready for planting. Suddenly, a group of squirrels came and messed up the garden soil, making it disorganized. Yara doesn't see the squirrels messing up the garden soil.;What will Yara do?;Yara will plant the sunflower in the garden soil.;Yara will tidy up the garden soil.;garden soil
