Ella was in the park, sitting under a shelter. Ella wanted to repair her broken toy car. The toy car was in many pieces. Ella believed the toy car was in many pieces. While Ella was looking for her tools, a weird dog came and knocked over the toy car, causing the pieces to spill out of the box. Ella does not see the dog leaving the shelter with a piece of her toy car in its mouth.;Does Ella think the toy car is in many pieces or spilled out of the box?;Ella believes the toy car is in many pieces.;Ella believes the toy car pieces are spilled out of the box.;Toy car
Zara was in the garage, ready to build a birdhouse. Zara wanted to cut the wood with her saw. The saw was sharp. Zara believed the saw was sharp. While Zara was busy asking her dad for a ruler, her little brother came into the garage and used the saw to cut some sweet candies. Zara does not see her brother leaving the garage with the saw in his hand.;Does Zara think the saw is sharp or sticky?;Zara believes the saw is sharp.;Zara believes the saw is sticky.;Saw
Fred was at the gym, ready to start his workout. Fred wanted to use the cable machine for his exercise. The cable machine was free. Fred believed the cable machine was free. While Fred was busy filling his water bottle, a wealthy man came into the gym and started using the cable machine. Fred does not see the wealthy man using the cable machine.;Does Fred think the cable machine is free or in use?;Fred believes the cable machine is free.;Fred believes the cable machine is in use.;Cable machine
Quincy was at the park, playing with his toy truck. Quincy wanted to drive his toy truck on the normal path. The toy truck's battery was full. Quincy thought the toy truck's battery was full. While Quincy was busy asking his mom to permit him to play a bit longer, his friend borrowed the toy truck and drove it around until the battery was empty. Quincy does not see his friend returning the toy truck.;Does Quincy think the toy truck's battery is full or empty?;Quincy believes the toy truck's battery is full.;Quincy believes the toy truck's battery is empty.;Toy truck
Polly was at the airport, waiting for her flight. Polly wanted to check in her luggage and get on the plane. The luggage was big and round. Polly believed the luggage was big and round. While Polly was busy buying a magazine, an airport worker accidentally dropped her luggage and it became misshapen. Polly does not see the worker picking up her luggage.;Does Polly think her luggage is big and round or misshapen?;Polly believes her luggage is big and round.;Polly believes her luggage is misshapen.;Luggage
Yara was at the park, watching a mole dig a hole. Yara wished to take a picture of the mole. The mole was on the surface of the grass. Yara believed the mole was on the surface. While Yara was busy looking at the attractive flowers nearby, a dog chased the mole and it quickly went back into its hole. Yara does not see the dog near the mole's hole.;Does Yara think the mole is on the surface or in its hole?;Yara believes the mole is on the surface.;Yara believes the mole is in its hole.;The mole
Ed was in the park, ready to play with his new laser toy. Ed wanted to show his friends how the laser toy could light up at night. The laser toy was working well. Ed believed the laser toy was working well. While Ed was busy doing push-ups to stay healthy, a dog ran by and knocked over the laser toy, causing it to stop working. Ed does not see the dog running away or his laser toy on the ground.;Does Ed think his laser toy is working or not?;Ed believes his laser toy is working.;Ed believes his laser toy is not working.;laser toy
