Zane was at the park with his enormous pig, Pippa. Zane wanted to make Pippa fit into her new pen. Pippa's belly was full and round. Zane believed Pippa's belly was full and round. Over time, Pippa digested her food and her belly became less round. Zane sees Pippa's belly become less round.;What will Zane do next?;Zane will try to fit Pippa into the pen again.;Zane will wait before trying to fit Pippa into the pen again.;Pippa's belly
Ollie was in his garage trying to fix his bike. Ollie wanted to make his bike work again so he could ride it. The bike's equipment was broken. Ollie believed the bike's equipment was broken. A skilled neighbor saw the broken equipment, came over, and fixed it while Ollie was inside getting a drink. Ollie sees his neighbor fixing the bike equipment.;What will Ollie do next?;Ollie will thank his neighbor and ride his bike.;Ollie will continue trying to fix his bike's equipment.;Bike's equipment
Vito was at the park, playing with his toy cars. Vito wanted to have an organized race with his cars. The trap for his toy cars was set up. Vito believed that the trap for his toy cars was set up. A naughty squirrel came and spoiled the trap, disconnecting the parts. Vito sees the squirrel messing with his trap.;What will Vito do next?;Vito will shoo the squirrel away and fix the trap.;Vito will start the toy car race.;trap for his toy cars
Billy was at the park with his friends. Billy wanted to play catch with his friends. The juice box that Billy had brought was full. Billy believed his juice box was full. A clumsy dog ran into the juice box, causing it to spill. Billy hears the sound of the juice box being knocked over.;What will Billy do next?;Billy will shrug it off and continue playing.;Billy will decide to take a break and drink from his juice box.;juice box.
Yara was in the park near the duck pond. Yara wanted to feed the ducks with her bag of bread crumbs. The distant fountain in the middle of the pond was spraying water high in the air. Yara believed the distant fountain was on. A park worker turned off the fountain for its weekly cleaning. Yara sees the park worker turn off the fountain.;What will Yara do next?;Yara will bring the ducks closer to where she is, away from the fountain.;Yara will continue to throw bread crumbs near the fountain for the ducks to eat.;distant fountain
Dima was at the park with his friends. Dima wanted to win the spelling bee contest. His spell list was complete and ready. Dima believed his spell list was complete and ready. While Dima was playing, his dog chewed up some of the pages of his spell list. Dima sees his dog chewing his spell list.;What will Dima do next?;Dima will go home and make a new spell list.;Dima will continue to play and count the minutes until the spelling bee contest.;Dima's spell list
Isha was at the museum looking at the old paintings. Isha wanted to see the famous painting that was said to be in a locked room. The door to the room was locked. Isha believed the door to the locked room was locked. A museum worker, not noticing Isha, unlocked the door to clean the room. Isha sees the museum worker unlocking the door.;What will Isha do next?;Isha will skip to the previously locked room.;Isha will ask the museum worker about the locked room.;door to the room in the museum
Ugo was at the park playing with his friends. Ugo wants to win the game of tag they were playing. The circle drawn in the sand is the safe zone. Ugo believes the circle in the sand is the safe zone. As the day went on, the slow continuous trampling of feet by the children playing tag distorted the circle making it warped. Ugo sees the warped circle.;What will Ugo do next?;Ugo will part from the game to redraw the circle.;Ugo will continue to run towards the circle to be safe from being tagged.;Circle in the sand.
Yara was playing in her room with her toys. Yara wanted to pretend she was a princess in a big castle. The floor in Yara's room was clean without any dust. Yara believed the floor in her room was clean without any dust. Yara's dog, Spot, came in and started shaking off the dust from his fur onto the floor. Yara sees Spot shaking off the dust.;What will Yara do next?;Yara will clean the floor.;Yara will continue to pretend she is a princess.;The floor in Yara's room
Vito was in the park playing with his kite. Vito wanted to tie his kite to a tree and watch it fly high. The kite was laying on the ground, dirty from the park's soil. Vito believed his kite was laying on the ground, dirty. A cheeky squirrel came and started dragging the kite up the tree. Vito sees the squirrel dragging his kite up the tree.;What will Vito do next?;Vito will chase the squirrel to get his kite back.;Vito will go to tie his kite to a nearby tree.;kite
Nemo was at the park having a picnic. Nemo wanted to eat his cold sandwich that was on the shelf in his picnic basket. The lid of the picnic basket was securely fastened. Nemo believed the lid of the picnic basket was securely fastened. A squirrel managed to open the picnic basket and spread all the food around. Nemo sees the squirrel spreading the food around.;What will Nemo do next?;Nemo will gather the food and put it back into the basket.;Nemo will walk over to the picnic basket to eat his cold sandwich.;The lid of the picnic basket.
Dora was in the kitchen, making a big meal for her family. Dora wanted to finish cooking before her family arrived. The grocery bags on the table were full of fresh food. Dora believed the grocery bags were full of fresh food. The cat, playing around, knocked over the grocery bags and the food spilled all over the floor. Dora sees the cat knock over the grocery bags.;What will Dora do next?;Dora will clean up the mess and then continue cooking.;Dora will continue cooking.;grocery bags
Jack was at the park playing with his toy car. Jack wanted to win the toy car race with his friends. The toy car had a fine plastic body. Jack believed his toy car was fine and ready to race. A friend, not knowing it was Jack's car, picked it up and dropped it, cracking the fine plastic body. Jack saw his friend pick up and drop his car.;What will Jack do next?;Jack will scream at his friend.;Jack will line his car up to start the race.;Toy car
Dino was in his backyard playing with his toy car. Dino wants to bring his toy car inside and show it to his mom. The toy car was dry and clean. Dino believes his toy car was dry and clean. A thoughtful neighbor, seeing the toy car alone in the backyard, decides to wash it and leaves it to dry. Dino sees his neighbor washing his toy car.;What will Dino do next?;Dino will wait until his toy car dries before bringing it inside.;Dino will go outside to bring his toy car inside.;Dino's toy car
Toby was at the park with his obedient pet dog, Max. Toby wanted to play fetch with Max. Max's ball was clean and had no smell. Toby believed Max's ball was clean and had no smell. An ice cream vendor, passing by, accidentally spilled some ice cream on Max's ball making it smell sweet. Toby sees the ice cream vendor spill ice cream on Max's ball.;What will Toby do next?;Toby will wash Max's ball.;Toby will throw the ball for Max to fetch.;Max's ball
Ina was at a deep sea party with her fish friends. Ina wants to make a sweet cake for her friends. The sugar jar is full. Ina believes the sugar jar is full. A naughty crab sneaks in and eats all the sugar from the jar. Ina sees the crab eating the sugar.;What will Ina do next?;Ina will find more sugar.;Ina will start making the sweet cake.;sugar jar
Alex was in the park, playing with his cute new puppy. Alex wanted to teach his puppy to sit on command. The puppy was eager and ready to learn. Alex believed the puppy was ready to learn. A squirrel suddenly appeared from a tree, distracting the puppy and making it unprepared to learn. Alex sees the squirrel.;What will Alex do next?;Alex will wait until the squirrel leaves before continuing the training.;Alex will command the puppy to sit on the ground.;puppy
Vito was at home in the kitchen. Vito wanted to bake a tuna cake for his mom's birthday. The oven was cold and off. Vito believed the oven was cold and off. A power surge in the neighborhood turned on the oven. Vito sees the oven light on.;What will Vito do next?;Vito will turn off the oven.;Vito will prepare the cake batter and then turn on the oven.;oven
Kaden was in his house, in the living room. Kaden wants to play his favorite song on his guitar. The guitar was out of tune. Kaden believes his guitar is out of tune. After a little while, his dad, who is good with musical instruments, fixes the guitar while Kaden is not in the room. Kaden sees his dad leaving the room with a tuning tool in his hand.;What will Kaden do next?;Kaden will thank his dad and start playing his favorite song.;Kaden will find a tuning tool to fix his guitar.;guitar
Yara was at the park with her friends. Yara wanted to eat her expensive candy she had saved for a special day. The candy was sweet. Yara believed the candy was sweet. A naughty squirrel ran off with the candy and dropped it in a puddle of salty water. Yara spots the squirrel running away with her candy.;What will Yara do next?;Yara will buy a new candy from the park's store.;Yara will unwrap the candy to eat it.;Yara's candy
Tom was at the mall with his friends. Tom wanted to buy a new toy car. The toy store was full of people. Tom thought the toy store was full of people. A quarrel broke out at the other end of the mall, drawing the crowd away from the toy store. Tom sees the crowd moving away.;What will Tom do next?;Tom will quickly grab the toy car he wants.;Tom will wait for the crowd to lessen.;the crowd in the toy store
Ethan was at the park, looking at a dove on a tree. Ethan wanted to spend his day watching the dove. The dove was awake, chirping happily. Ethan believed the dove was awake. A boring cat wandered near the tree and the dove fell asleep. Ethan sees the cat.;What will Ethan do next?;Ethan will go home.;Ethan will continue to watch the dove.;The dove on the tree.
Zara was at work in a big toy shop. Zara wanted to clean all the toys before the shop opens. The big toy train in the shop was off. Zara believed the big toy train was off. A shop worker turned on the big toy train for a test run. Zara sees the worker turning on the big toy train.;What will Zara do next?;Zara will go and turn off the big toy train.;Zara will continue to clean the toys.;big toy train
Nate was at the park playing with his small toy car. Nate wanted to win the toy car race against his friends. The small toy car was fast and effective. Nate believed his small toy car was fast and effective. Yesterday's rain had made the ground muddy and slippery, making the small toy car ineffective. Nate notices that the ground is muddy and slippery.;What will Nate do next?;Nate will clean the wheels of his small toy car and wait for the ground to dry.;Nate will rush to start the race with his friends.;small toy car
Nino was in his toy shop, fixing a toy stove. Nino wanted to make the toy stove work like a real one. The toy stove was not working. Nino believed the toy stove was not working. A customer, who was a toy repair expert, came in and fixed the toy stove while Nino was in the back room looking for a fake screwdriver he had lost. Nino sees the customer fixing the toy stove.;What will Nino do next?;Nino will thank the customer for fixing the toy stove.;Nino will continue to look for the fake screwdriver to fix the toy stove himself.;toy stove
Liam was on a difficult journey to an island. Liam wanted to find a hidden treasure on the island. The map to the treasure was in Liam's bag. Liam believed the map was in his bag. A monkey succeeded in opening Liam's bag and took the map. Liam sees the monkey taking his map.;What will Liam do next?;Liam will chase the monkey to get his map back.;Liam will continue his journey to find the treasure.;map
Momo was at a big party. Momo wanted to find a fit dance partner. The meat on the BBQ grill was clean. Momo believed the meat on the BBQ grill was clean. A playful dog jumped on the grill and the meat got dirty. Momo sees the dog jumping on the grill.;What will Momo do next?;Momo will comfort the upset host and suggest ordering pizzas.;Momo will grab a plate and try the BBQ meat.;The meat on the BBQ grill
Carlos was in the forest near his home. Carlos wanted to take a cute picture of a deer. The deer was far away, just a small dot in the distance. Carlos thought the deer was far away. As time passed, a thick fog rolled into the forest, making the deer even harder to see. Carlos sees the fog rolling in.;What will Carlos do next?;Carlos will wait for the fog to clear before taking the picture.;Carlos will try to get closer to the deer to take a better picture.;Deer
Elmo was at the park playing with his toy rocket. Elmo wanted to show his friends how high his toy rocket could fly. The toy rocket was in good shape. Elmo believed that the toy rocket was in good shape. A dog at the park, while chasing its ball, accidentally stepped on the rocket, making it hurt and not able to fly properly. Elmo sees the dog stepping on his toy rocket.;What will Elmo do next?;Elmo will tell his friends that they can't play with the toy rocket now.;Elmo will prepare to launch his toy rocket into space.;Toy rocket
Quin was at the beach with his family. Quin wanted to visit the dolphins that lived near the shore. The dolphin he wanted to visit was very friendly. Quin believed the dolphin was very friendly. A scary shark came near the dolphin and scared it away. Quin sees the shark scaring the dolphin away.;What will Quin do next?;Quin will leave the water and stay on the shore.;Quin will start swimming towards the dolphin.;Dolphin
Caden was at the park playing with his new toy car. Caden wants to name his toy car after his favorite cartoon character. The toy car was balanced on a rock. Caden believes his toy car is balanced on the rock. A squirrel comes along and knocks the toy car off the rock, making it unbalanced. Caden sees the squirrel knocking his toy car off the rock.;What will Caden do next?;Caden will put his toy car back on the rock.;Caden will name his toy car.;Caden's toy car
Gabe was at the park for a picnic. Gabe wanted to make a lovely meal on the grill for his friends. The grill was clean and ready to use. Gabe believed the grill was clean and ready to use. A group of birds flew over and dropped berries, making the grill dirty. Gabe sees the birds dropping berries on the grill.;What is Gabe planning to do next?;Gabe will clean the grill again before cooking.;Gabe will start grilling the food immediately.;grill
Vito was at his job in the bike shop. Vito wanted to repair a blue bike before lunchtime. The blue bike was in terrible shape. Vito believed the blue bike was in terrible shape. A customer came in and accidentally knocked over the blue bike, causing further damage. Vito sees the customer knock over the bike.;What will Vito do next?;Vito will tell the customer about the extra repair cost.;Vito will start to repair the blue bike.;Blue bike
Finn was in the kitchen making a sandwich. Finn wanted to make a good sandwich for lunch. The cheese in the fridge was untouched. Finn believed the cheese was untouched. The family cat, curious about the smelly cheese, jumped onto the kitchen counter and nibbled a bit of the cheese. Finn sees the cat nibbling the cheese.;What will Finn do next?;Finn will separate the nibbled part of the cheese and use the rest for his sandwich.;Finn will take the cheese to put on his sandwich.;Cheese
Ugo was waiting at the airport for his flight. Ugo wanted to take a short nap before his flight. The chair he was sitting on was well-maintained. Ugo believed the chair was well-maintained. Over time, the chair became neglected due to the heavy use by many passengers. Ugo notices the change in the chair's condition.;What will Ugo do next?;Ugo will find another chair to nap on.;Ugo will lean back and start his nap.;chair at the airport
Hugo was in the park playing with a ball. Hugo wanted to kick the ball very hard. The ball was tough and full of air. Hugo believed the ball was tough and full of air. A small cut formed on the ball causing it to slowly lose air over time. Hugo sees the cut on the ball.;What will Hugo do next?;Hugo will stop playing and find a way to fix the ball.;Hugo will continue to play and kick the ball hard.;ball
Lenny was in his garden, watering the plants. Lenny wanted to make sure all the plants got enough water. The hedge in Lenny's garden was dry. Lenny believed the hedge in his garden was dry. As the day went on, the sprinkler system turned on and began to soak the hedge. Lenny sees the sprinkler system turn on.;What will Lenny do next?;Lenny will turn off the sprinkler system.;Lenny will water the hedge after his lunch.;The hedge in Lenny's garden
Xander was in the garden planting seeds. Xander wants to grow big, strong plants. The cloth bag of seeds was full. Xander believed the cloth bag of seeds was full. Over time, a small hole formed at the bottom of the bag, causing the seeds to slowly spill out. Xander sees the seeds spilling out of the bag.;What will Xander do next?;Xander will pick up the spilled seeds and put them back into the bag.;Xander will continue to plant the seeds from the bag.;cloth bag of seeds
Jax was at the beach on a hot day. Jax wanted to swim in the sea to cool down. The water in the sea was fresh and clean. Jax believed the water in the sea was fresh and clean. As the day went on, the heat caused some algae to bloom, making the water stagnant. Jax sees the change in the water.;What will Jax do next?;Jax will stop swimming and just play in the sand.;Jax will dive into the sea to cool down.;The water in the sea
Ben was at a party with his friends. Ben wanted to welcome his new friend, Lily, to the party. The big mirror in the hall was clean and shiny. Ben believed that the mirror was clean and shiny. One of the nosy kids at the party put his greasy hands all over the mirror, making it smudgy and less reflective. Ben sees the kid smudging the mirror.;What will Ben do next?;Ben will clean the mirror.;Ben will lead Lily to the mirror.;The big mirror in the hall.
Pete was in the park playing on the monkey bars. Pete wanted to climb to the highest bar. The monkey bar was very strong. Pete believed the monkey bar was strong. A group of bigger kids started swinging on the bars, making them less strong. Pete sees the bigger kids swinging on the bars.;What will Pete do next?;Pete will wait until the bigger kids stop swinging on the bars.;Pete will start to climb to the highest bar.;monkey bar
Bree was at the mall to buy a gift for her mom. She wanted to buy her mom's favorite famous perfume. The perfume bottles were all neatly aligned on the shelf. Bree believed the perfume bottles were all neatly aligned on the shelf. A child running in the aisle bumped into the shelf, causing the perfume bottles to become misaligned. Bree sees the child bump into the shelf.;What will Bree do next?;Bree will realign the perfume bottles on the shelf.;Bree will remember her mom's favorite perfume and pick it up.;perfume bottles
Sam was at the park near the lake, waiting for his friends. He wanted to play with his new toy boats in the lake. There was a box of toy boats sitting next to him, all of them were inside. Sam believed that all of his toy boats were in the box. A squirrel, looking for food, tipped over the box and all the toy boats spilled out. Sam sees the squirrel tipping over the box.;What is Sam going to do next?;Sam will pick up all the toy boats and put them back in the box.;Sam will wait for his friends, planning to open the box and start playing.;box of toy boats
Vito was in the attic looking for his old toys. Vito wanted to find his favorite toy car. The boxes in the attic were neatly aligned. Vito believed that the boxes in the attic were neatly aligned. A cat snuck into the attic and knocked over some boxes, causing them to become misaligned. Vito sees the cat knocking over the boxes.;What will Vito do next?;Vito will align the boxes again before continuing his search.;Vito will continue to look for his toy car.;boxes in the attic
Quin was in the park playing with his toy bunny. Quin wanted to hop around just like his toy bunny. The grass in the park was dry and easy to hop on. Quin believed the grass in the park was dry and easy to hop on. As the day went on, the park's sprinklers turned on, making the grass wet and slippery. Quin sees the sprinklers turn on.;What will Quin do next?;Quin will move to the playground to continue hopping.;Quin will continue to hop around on the grass with his toy bunny.;The grass in the park
Peter was at the park, playing with his new red ball. Peter wanted to play catch with his dad. The ball had a great, new smell. Peter thought the ball had a great, new smell. The ball rolled into a pile of leaves, and the smell changed from great and new to old and musty. Peter sees the ball roll into the pile of leaves.;What will Peter do next?;Peter will pretend that the ball is a treasure found in an ancient forest.;Peter will run to get his ball to continue playing catch with his dad.;Peter's new red ball.
Yara was at the beach making a sand castle. Yara wanted to build the best sand castle ever. The sand was dry and hard to shape. Yara believed the sand was dry and hard to shape. As the day went on, the tide came in and wet the sand. Yara sees the tide coming in.;What will Yara do next?;Yara will rebuild her castle using the wet sand.;Yara will try to build her castle with the dry sand.;sand
Uma was at the beach on a hot day. Uma wanted to build a huge sandcastle. The bucket she was using was shiny and reflected the heat well. Uma believed the bucket was shiny and reflected the heat well. A group of kids playing nearby kicked up sand which coated the bucket, making it less shiny and reducing its reflection. Uma sees the sand coating her bucket.;What will Uma do next?;Uma will rinse the bucket in the sea.;Uma will continue to fill the bucket with sand to build her sandcastle.;The bucket Uma was using
Ulysses was at the opera house, waiting for the show to start. Ulysses wanted to hear the cool opera singer perform. The opera singer was ready to sing. Ulysses believed the opera singer was ready to sing. However, the opera singer suddenly lost his voice and couldn't perform anymore. Ulysses sees the opera singer trying to speak but failing.;What will Ulysses do next?;Ulysses will leave the opera house and go home.;Ulysses will sit back to enjoy the opera.;Opera singer
Wilbur was at the park on a hot day. Wilbur wanted to cool down with an ice cream. The ice cream vendor's cart was full of ice. Wilbur believed the ice cream vendor's cart was full of ice. A wealthy man bought all the ice creams from the vendor, leaving the cart empty of ice. Wilbur sees the wealthy man buying all the ice creams.;What will Wilbur do next?;Wilbur will go home and make a cold drink.;Wilbur will walk to the ice cream vendor to buy an ice cream.;ice cream vendor's cart
Momo was in the park under a big tree. Momo wants to sit and read her book in peace. The pond in the park was fresh and clear. Momo believed the pond was fresh and clear. Over time, leaves fell into the pond and made the water stagnant. Momo turns around and sees the leaves in the pond.;What will Momo do next?;Momo will go home.;Momo will continue to sit under the tree and read her book.;The pond in the park
Tim was in the kitchen looking for a snack. Tim wanted to find his hidden stash of cookies. The cupboard where the cookies were kept was closed. Tim believed the cupboard was closed. A mouse had managed to squeeze into the cupboard, knocking over a jar of jam, which made the cupboard door swing open. Tim sees the cupboard door swing open.;What will Tim do next?;Tim will go to close the cupboard and clean up the mess.;Tim will go to open the cupboard to get his cookies.;The cupboard
Vito was at the park playing with his toy car. Vito wanted to eat his lunch that his mom packed for him. The lunch box was full of good things to eat. Vito thought his lunch box was full. A busy squirrel came and took some food from Vito's lunch box. Vito sees the squirrel taking food from his lunch box.;What will Vito do next?;Vito will eat what's left in his lunch box.;Vito will start eating his lunch.;Vito's lunch box
Ethan was at the park after school. Ethan wanted to eat his candy because he was very hungry. The candy was in Ethan's bag. Ethan believed that the candy was in his bag. While Ethan was busy playing, a squirrel found the bag open and took the candy. Ethan sees the squirrel taking his candy.;What will Ethan do next?;Ethan will search for more candy in his bag.;Ethan will reach into his bag to eat his candy.;Ethan's candy
Dino, a young boy, was in the park near the farm. Dino wanted to jog around the park and then have a tasty apple from the farmer's stall. The apple basket at the farmer's stall was untouched. Dino believed the apple basket at the farmer's stall was untouched. A squirrel, attracted by the smell of the apples, jumped into the basket and started nibbling on the apples. Dino sees the squirrel in the apple basket.;What will Dino do next?;Dino will chase away the squirrel and then pick an apple.;Dino will finish his jog and go to pick an apple from the basket.;apple basket at the farmer's stall
