Nala was in her room ready to sleep. Nala wants to have a good night's sleep without any nightmares. The door to Nala's room is locked. A purple butterfly flies into the room through the open window. Nala doesn't see the purple butterfly.;What will Nala do next?;Nala will turn off the light and lie down to sleep.;Nala will tell her brother to leave and lock the door again.;door to Nala's room
Hugo was in the park with his friends. Hugo wanted to win the kite flying contest. The string of Hugo's kite was strong. A squirrel runs by with a nut in its mouth. Hugo doesn't see the squirrel.;What will Hugo do next?;Hugo will get ready to fly his kite high in the sky.;Hugo will change the string of his kite.;string of Hugo's kite
Ravi was at the fish market. Ravi wanted to buy a fish for his mom to cook for dinner. The fish on the scale was heavy. A scared cat runs through the fish market. Ravi doesn't see the scared cat.;What is Ravi going to do next?;Ravi will ask the fishmonger to help him carry the fish to his car.;Ravi will buy the lighter fish.;fish on the scale
Vito was at a birthday party. Vito wanted to give his friend a special gift. The gift was wrapped in a shiny paper. A clown comes into the room to perform a magic show. Vito doesn't see the clown because he is still in the other room.;What will Vito do next?;Vito will give the gift to his friend.;Vito will find another gift wrap to cover the gift again.;gift
Tim was in the kitchen, ready to make lunch. Tim wanted to make a big bowl of pasta. The pasta box was full. A bird flies into the kitchen through the open window. Tim does not see the bird.;What will Tim do next?;Tim will start boiling water to cook the pasta.;Tim will ask his sister to return the pasta.;pasta box
Wendy was in the park, sitting on a bench. Wendy wanted to play a charming tune on her small flute. The flute was in her bag. A squirrel runs up a tree nearby. Wendy doesn't see the squirrel.;What will Wendy do next?;Wendy will reach into her bag to get her flute.;Wendy will go to the lost and found box to get her flute.;Wendy's flute
Gigi was at the park with her friends. Gigi wanted to share her mints with her friends. The mint box was full of fat, healthy mints. A rainbow appears in the sky. Gigi doesn't see the rainbow.;What will Gigi do next?;Gigi will share the mints with her friends.;Gigi will keep the mints and not share them.;mint box
Remy was in the park playing with his colorful parrot. Remy wanted his parrot to learn a new trick. The parrot was sitting on a clear and open branch. A squirrel runs across the park. Remy doesn't see the squirrel because he is too focused on his game.;What will Remy do next?;Remy will continue teaching his parrot the new trick.;Remy will move his parrot to a different branch.;the branch the parrot is sitting on
Pete was at the park, ready to eat his lunch. Pete wanted to enjoy his food while watching the birds. The food in Pete's lunch box was fresh and yummy. A patient dog sits down next to Pete, watching him. Pete doesn't see the patient dog.;What will Pete do next?;Pete will take a bite of his sandwich, enjoying the fresh taste.;Pete will squeeze the rest of his sandwich into a ball and throw it to the squirrel.;food in Pete's lunch box
Quin was in the park with his gray paint and brush. Quin wanted to paint a big tree on a big balloon. The balloon was empty. A squirrel runs past Quin, carrying a nut. Quin doesn't see the squirrel.;What will Quin do next?;Quin will dip his brush into the gray paint and start painting the tree.;Quin will wait for the balloon to be stable before he starts painting.;balloon
Yara was at a party with her friends. Yara wanted to sing her favorite song for everyone. The microphone was working fine. A dog runs into the party and starts to play with the balloons. Yara doesn't see the dog playing with the balloons.;What will Yara do next?;Yara will pick up the microphone and start to sing.;Yara will wipe the juice off the microphone and try to fix it.;microphone
Sam was at the space station, waiting to travel back to Earth. Sam wants to return home to see his family. The spaceship's launch schedule was synchronized with Earth's rotation. A shooting star passes by the space station. Sam doesn't see the shooting star.;What will Sam do next?;Sam will continue with his preparation and get ready to travel back to Earth.;Sam will adjust his plan and wait for the next synchronized launch window.;spaceship's launch schedule
Ina was at the park, sitting on a gray bench. Ina wanted to solve the puzzle in her story book. The puzzle in the story book was hard. A squirrel runs across the park. Ina doesn't see the squirrel.;What will Ina do next?;Ina will take a break and try to solve the puzzle later.;Ina will thank the old man and ask him to teach her how he solved the puzzle.;puzzle in the story book
Lenny was at the market to buy a smelly cheese. Lenny wanted to find the best smelly cheese for his mom. The cheese was very expensive. A juggler starts performing in the middle of the market. Lenny does not see the juggler.;What will Lenny do next?;Lenny will save up more money to buy the cheese next time.;Lenny will ask for a discount because the cheese is damaged.;cheese
Kip was at the mall looking at a beautiful painting. Kip wanted to buy the painting to put it in his room. The painting was very expensive. A clown starts to make balloon animals near the painting. Kip doesn't see the clown because he is still in the other store.;What will Kip do next?;Kip will decide to save more money before buying the painting.;Kip will rush to buy the painting before anyone else does.;the painting at the mall
Jake was in the kitchen ready to make dinner. Jake wanted to make a big salad with all the fresh groceries he bought. The knife he uses to cut veggies was very sharp. A reliable old friend calls Jake on the phone. Jake doesn't hear the phone ringing because he's busy in the kitchen.;What will Jake do next?;Jake will start cutting the veggies to make the salad.;Jake will sharpen the knife before continuing.;knife
Yara was in the kitchen making a sandwich. Yara wanted to find the peanut butter in the cupboard to spread on her bread. The cupboard door was flat and straight. A parrot flies into the kitchen through the open window. Yara doesn't see the parrot.;What will Yara do next?;Yara will open the cupboard door to find the peanut butter.;Yara will call a carpenter to fix the warped cupboard door.;cupboard door
Dora was at the library looking for a fun book to read. Dora wants to find a book that will make her laugh. The book Dora wants is on the top shelf. The lights in the library start to glow brighter. Dora doesn't notice the lights glowing brighter.;What will Dora do next?;Dora will ask the librarian to help her get the book from the top shelf.;Dora will pick up the book from the floor.;the book Dora wants
Xander was in the forest, looking for deer. Xander wanted to find a deer to take a picture. The deer was hidden in the bushes. A comfortable breeze blows through the forest. Xander doesn't feel the comfortable breeze because he is focused on his camera.;What will Xander do next?;Xander will sit and wait for the deer to come out.;Xander will quickly take a picture of the deer.;deer in the bushes
Remy was at the park playing with his toy car. Remy wants to stay at the park until the sun goes down. The toy car was fully charged. A flock of birds suddenly flies over the park. Remy doesn't see the flock of birds.;What will Remy do next?;Remy will continue to play with his toy car in the park.;Remy will take his toy car back home and charge it.;toy car
Ed was at the airport waiting for his flight. Ed wanted to finish his book before his flight. The bottle of water Ed had was full. A weird noise sounds from the airport speakers. Ed doesn't hear the weird noise because he is too engrossed in his book.;What will Ed do next?;Ed will take a sip of water and continue reading his book.;Ed will try to find a place to refill his bottle.;Ed's bottle of water
Caden was at the park playing with his friends. Caden wanted to show his friends his new toy lizard. The toy lizard was clean and shiny. A butterfly lands on a flower near Caden. Caden doesn't see the butterfly.;What will Caden do next?;Caden will keep playing with his toy lizard.;Caden will clean his toy lizard.;toy lizard
Tilly was in the park, sitting on a bench. Tilly wanted to feed the humble rat that visited her every day. The rat was in its hole, not coming out. A group of children start playing football near the bench. Tilly doesn't see the children playing football.;What will Tilly do next?;Tilly will break a piece of her sandwich to feed the rat.;Tilly will shoo the cat away.;the rat
Fergus was at the park playing fetch with his dog. Fergus wants to get his dog to fetch a long stick. The stick was lying on the ground. A squirrel scurries up a tree nearby. Fergus doesn't see the squirrel.;What will Fergus do next?;Fergus will throw the stick for his dog to fetch.;Fergus will get a new stick for his dog.;stick
Gabe was at the park with his lovely new cart. Gabe wanted to decorate his cart with shiny stickers. The cart was clean and ready for decoration. A squirrel scurries up a nearby tree. Gabe doesn't see the squirrel.;What will Gabe do next?;Gabe will start to decorate his cart with shiny stickers.;Gabe will clean his cart before decorating it.;gabe's cart
Darius was in his art class, drawing his favorite tree. Darius wanted to make his tree look real with brown ink. The ink bottle on Darius's table was full. A gust of wind blows Darius's drawing off the table. Darius doesn't see his drawing being blown off the table.;What will Darius do next?;Darius will dip his brush into the ink bottle and continue with his drawing.;Darius will ask his teacher for more ink.;ink bottle on Darius's table
Kiki was at the beach with her metal detector. Kiki wanted to collect any gold she could find. The sand was cool and undisturbed. A seagull lands near Kiki. Kiki doesn't see the seagull.;What will Kiki do next?;Kiki will continue to scan the sand with her metal detector.;Kiki will move to a quieter part of the beach.;the sand
Xander was in the kitchen making breakfast. Xander wanted to make a good omelette for his mom. The egg in the pan was not cooked yet. A small cactus on the window sill falls over. Xander doesn't see the cactus fall over.;What will Xander do next?;Xander will flip the egg.;Xander will work on fixing the stove.;egg in the pan
Yara was at a factory on a tour with her school friends. Yara wants to learn about how ice cream is made. The ice cream mix in the big vat was thick and creamy. A factory worker drops a box of ice cream cones. Yara doesn't see the factory worker drop the box of cones.;What will Yara do next?;Yara will continue to listen and learn about the process.;Yara will ask about the special ingredient.;ice cream mix in the vat
Sam was in the kitchen making a cake. Sam wanted to wash his hands before he started to bake. The sink in the kitchen was clean. A fair, golden cat walks into the kitchen. Sam doesn't see the golden cat.;What will Sam do next?;Sam will wash his hands in the sink.;Sam will clean the sink.;kitchen sink
Adam was in his lab working on his science project. Adam wanted to finish his project before the end of the day. The lab clock was synchronized with the school's main clock. A bird flies into the lab through an open window. Adam doesn't see the bird because he is focused on his project.;What will Adam do next?;Adam will continue working on his project, relying on the lab clock to keep track of time.;Adam will ask the janitor to plug the clock back in.;lab clock
Ollie was in the kitchen ready to make dinner. Ollie wanted to cut some veggies for a fine soup. The knife was sharp and ready to use. A song about a journey starts playing on the radio. Ollie doesn't hear the song because he is focused on his cooking.;What will Ollie do next?;Ollie will continue to cut the veggies for his soup.;Ollie will sharpen the knife before continuing his cooking.;knife
Benny was at the park near the harmless creek. Benny wanted to sing a new song he just learned. The creek was quiet and restful. A red kite gets stuck in a tree near Benny. Benny doesn't see the red kite.;What will Benny do next?;Benny will continue to sing his new song.;Benny will stop singing and watch the ducks.;creek
Lenny was in a subway station waiting for his train. Lenny wanted to share his lunch with a friend who was also taking the subway. The tracks for the subway were aligned. A wealthy businessman drops a coin on the platform. Lenny doesn't see the businessman drop a coin.;What will Lenny do next?;Lenny will continue to wait for his friend and the subway.;Lenny will thank the worker.;subway tracks
Xander was in the park playing a game of knights with his friends. Xander wanted to be the best knight and protect his friends with his shield. The shield Xander was using was made of cardboard and was originally opaque. A dog runs past the children playing the game. Xander doesn't see the dog running past.;What will Xander do next?;Xander will continue to play the game and protect his friends with his shield.;Xander will try to find a new shield.;shield
Noah was at a busy coffee shop waiting for his friend. Noah wanted to buy a coffee and sit with his friend. The coffee machine was working well. A street musician starts playing a song outside the coffee shop. Noah doesn't hear the street musician playing a song as he is still looking at his phone.;What will Noah do next?;Noah will order his favorite coffee.;Noah will stand and wait until the coffee machine is fixed.;coffee machine
Yesterday, Yara was playing with her favorite toy car in the kitchen. She wanted to make the car do a big jump over the sink. The drain in the sink was closed. A bird chirps loudly outside the window. Yara doesn't hear the bird chirping.;What will Yara do next?;Yara will make the toy car do a big jump over the sink.;Yara will quickly grab the toy car before it can vanish down the drain.;drain in the sink
Vito was at a park, watching the birds. Vito wanted to sit on the park bench and enjoy his lunch. The bench was dry and clean. A heart-shaped leaf falls from a tree. Vito doesn't see the heart-shaped leaf.;What will Vito do next?;Vito will go to sit on the bench.;Vito will find another bench to sit on.;park bench
Dan was in the park for his morning jog. Dan wanted to finish his jog and pick some fresh radishes from the park's garden. The ice cream cone sitting on the park bench was solid. A cool breeze starts blowing in the park. Dan doesn't feel the cool breeze due to his focus on jogging.;What will Dan do next?;Dan will sit on the bench and eat the ice cream after his jog.;Dan will throw the melted ice cream in the trash bin.;ice cream cone on the park bench
"Finn was at the beach, ready for a swim. Finn wanted to swim in the sea where the popular shark named ""Bubbles"" was known to play. The shark cage was open. A seagull steals Finn's sandwich from his picnic basket. Finn doesn't see the seagull stealing his sandwich.";What will Finn do next?;Finn will step towards the shark cage to swim with Bubbles.;Finn will wait until the storm passes and the cage is reopened.;shark cage
Hana was at the park playing with her kite. Hana wants to fly her kite high up in the sky. The cable on Hana's kite is tied tightly. A hot air balloon passes by. Hana doesn't see the hot air balloon.;What will Hana do next?;Hana will continue to fly her kite, trying to get it higher.;Hana will pull her kite down and re-tighten the cable.;cable on Hana's kite
Max was at the park ready to play. Max wanted to play a fun game of hide and seek. The rag he used as a marker was neatly folded on the bench. A shy squirrel scurries across the park. Max doesn't see the shy squirrel.;What will Max do next?;Max will go hide behind a big tree.;Max will skip his turn to hide and go fold the rag again.;rag
Uri was in the music room at school. Uri wanted to play a harmless prank on his friend. The piano in the music room was light. A bird flies into the music room through an open window. Uri doesn't see the bird.;What will Uri do next?;Uri will try to make his friend think he can lift the piano.;Uri will discuss his prank plan with his friend.;piano in the music room
Yara was at a park playing with her green ball. Yara wanted to play catch with her dad. The ball was very bouncy. A squirrel runs across the park. Yara doesn't see the squirrel because she is focused on the ball.;What will Yara do next?;Yara will throw the ball to her dad to start playing catch.;Yara will ask the soldier if he could help fix the ball or offer to buy a new one.;green ball
Tia was at the park playing with her toy cart. Tia wanted to push her cart down the hill and watch it roll. The cart's wheels were tight and good for rolling. A squirrel runs up a nearby tree. Tia doesn't see the squirrel.;What will Tia do next?;Tia will push the cart down the hill.;Tia will fix the wheel before playing again.;toy cart
Val was in the kitchen getting ready for a party. Val wanted to make a cold drink for her friends. The metal tie she used to wrap the ice was cold and conductive. A cat jumps onto the kitchen counter. Val doesn't see the cat jumping onto the kitchen counter.;What will Val do next?;Val will continue preparing for the party.;Val will put the metal tie in the fridge to cool it down.;metal tie
Flora was in her classroom, waiting for her friends to play a game. Flora wanted to play a game of twist-the-bottle. The cap on the bottle was twisted tight. A cold breeze blows into the classroom from the open window. Flora doesn't feel the cold breeze.;What will Flora do next?;Flora will start the game of twist-the-bottle with her friends.;Flora will ask the teacher to twist the cap back on the bottle.;cap on the bottle
Gus was at the park drawing pictures with his crayons. Gus wanted to draw a big, beautiful rainbow. The box of crayons was full of many colors. A gentle breeze blows through the park, rustling the leaves. Gus does not feel the gentle breeze as he is focused on his drawing.;What will Gus do next?;Gus will pick the colors he needs and start drawing the rainbow.;Gus will collect the spilled crayons and then continue his drawing.;box of crayons
Gabe was at the park playing with his toy magnet. Gabe wanted to show his friends how his toy magnet could pick up small metal pieces. The toy magnet was very strong. A squirrel runs across the park. Gabe doesn't see the squirrel.;What will Gabe do next?;Gabe will continue his demonstration.;Gabe will take his toy magnet away from the dog.;toy magnet
Lenny was at the beach building a sandcastle. Lenny wanted to build the biggest sandcastle ever. The sand he was using was very dense and hard. A seagull drops a dead fish near Lenny. Lenny doesn't see the seagull drop the dead fish.;What will Lenny do next?;Lenny will continue to build the sandcastle with the dense sand.;Lenny will add water to the sand to make it dense again.;Sand
Caleb was at the farm, feeding the animals. Caleb wanted to feed the enormous goat named Billy. Billy the goat was very much alive. A flock of birds suddenly flies over the farm. Caleb doesn't see the flock of birds because he is in the barn.;What will Caleb do next?;Caleb will continue to feed Billy and give him a kiss on the nose.;Caleb will call the vet.;Billy the goat
Fred was at the park, playing with his toy van. Fred wanted to make his toy van skip across the pond. The toy van was clean. A squirrel runs across the park. Fred doesn't see the squirrel.;What will Fred do next?;Fred will try to make his toy van skip across the pond.;Fred will clean his toy van.;Fred's toy van
Yara was in a jungle, lost and trying to find her way out. Yara wanted to find a clear path to leave the jungle. A vine was hanging in front of her, structured and strong. A colorful bird flies by, singing a beautiful song. Yara does not see or hear the colorful bird.;What will Yara do next?;Yara will use the vine to guide her way out of the jungle.;Yara will separate the tangled parts of the vine to clear her path.;vine
Hank was in his office, working on a big project. Hank wanted to finish his work so he could go home and relax. The file Hank was working on had a faint smell of old paper. A bird flies into the office through the open window. Hank doesn't see the bird in the office.;What is Hank planning to do next?;Hank will finish the last part of his work.;Hank will print a new copy of the file.;file Hank was working on
Alfie was at the beach building a big sand castle. Alfie wanted to make the tallest sand castle anyone had ever seen. The tube Alfie was using to shape the towers of the castle was very flexible. A quiet seagull lands near Alfie's sand castle. Alfie doesn't see the seagull because he is focused on his sand castle.;What will Alfie do next?;Alfie will continue to build the sand castle using the flexible tube.;Alfie will let the tube cool down in the shade before using it again.;The tube
Quin was at a bright, loud party. Quin wanted to try the punch that everyone was talking about. The punch bowl was full and untouched. A bright green balloon pops loudly. Quin doesn't hear the balloon pop because of the loud music.;What will Quin do next?;Quin will move towards the punch bowl to fill his cup.;Quin will shrug it off and continue to enjoy the party without the punch.;Punch bowl
Moe was at the science fair with his project. Moe wanted to win the first prize. The microscope he used for his project was working fine. A loud cheer erupts from the crowd at the science fair. Moe doesn't hear the loud cheer because he is focused on his project.;What will Moe do next?;Moe will present his project to the judges.;Moe will replace the battery in the microscope.;Microscope
Carlos was in the park playing with his new toy car. Carlos wanted to make the car drive in a perfect circle. The toy car was clean. An intelligent parrot lands on a nearby bench and starts talking. Carlos does not notice the intelligent parrot.;What will Carlos do next?;Carlos will try to make the car drive in a perfect circle again.;Carlos will clean his toy car.;Carlos's toy car
Wally was at the park feeding the ducks. Wally wanted to see a brilliant raven that often comes to this park. The bag of bird food was full. A child's frisbee lands near Wally. Wally doesn't see the frisbee landing near him.;What will Wally do next?;Wally will continue to feed the ducks and wait for the raven to come.;Wally will shoo the squirrel away and guard the bag of bird food.;bag of bird food
Jack was at the park playing with his cheerful dog, Spot. Jack wanted to win the big Frisbee competition. The Frisbee was in good shape. A cheerful bird lands on a nearby tree and starts singing. Jack doesn't hear the bird singing because he's too focused on the Frisbee.;What is Jack going to do next?;Jack will practice throwing the Frisbee with Spot.;Jack will shoo the squirrel away and find a new Frisbee.;Frisbee
Kip was in the kitchen making a sandwich. Kip wanted to leave a helpful note for his mom to find when she got home. The note was on the kitchen table. A bird flies into the kitchen through the open window. Kip doesn't see the bird.;What will Kip do next?;Kip will go to lock the back door before he leaves.;Kip will write a new note and put it in a safer place.;note
Ollie was at the park playing with his friends. Ollie wanted to win the game of tag they were playing. The ground was smooth and easy to run on. A dog runs through the park, chasing its tail. Ollie doesn't see the dog running through the park because he is focused on the game.;What will Ollie do next?;Ollie will continue to play the game of tag on the smooth ground.;Ollie will move the game to a different part of the park.;The ground at the park
Jack was at the zoo looking at the reindeer. Jack wanted to touch the reindeer's fur. The reindeer's fur looked rough. A parrot starts squawking loudly in a nearby tree. Jack doesn't hear the parrot squawking.;What will Jack do next?;Jack will just look at the reindeer from afar.;Jack will approach the zookeeper and ask if he can touch the reindeer's fur.;Reindeer's fur
Remy was at the park playing with his friends. Remy wants to dare his friends to jump over a spot on the grass. The spot on the grass was flat. A kite flies over the park. Remy doesn't see the kite flying over the park.;What will Remy do next?;Remy will dare his friends to jump over the spot.;Remy will not dare his friends to jump over the spot anymore.;The spot on the grass.
Carl was at the park with his friends. Carl wanted to share his big, red lollipop with his friends. The lollipop was clean and shiny. A helpful dog comes by and starts playing with the children. Carl doesn't see the helpful dog.;What will Carl do next?;Carl will share the lollipop with his friends.;Carl will wash the lollipop in the water fountain.;lollipop
Ollie was in the kitchen, ready to make a sandwich. Ollie's goal was to create a tall stack of ham and cheese layers for his sandwich. The jar of pickles on the counter was closed. The doorbell rings. Ollie doesn't hear the doorbell ring.;What will Ollie do next?;Ollie will continue to stack ham and cheese for his sandwich.;Ollie will clean up the spilled pickles.;jar of pickles
Vinny was at the park, ready to play golf. Vinny wanted to win the small golf tournament. The golf club Vinny had was blue. A squirrel runs across the golf course. Vinny doesn't see the squirrel.;What will Vinny do next?;Vinny will get ready to swing his club and start the game.;Vinny will give the park worker a piece of his mind.;Golf club
