Max was in the park playing with his toy plane. Max wanted to make his plane fly high in the sky. The plane blade was sharp. Max believed the plane blade was sharp. A wealthy man walking his dog accidentally steps on the plane, making the blade dull. Max sees the man stepping on his plane. Max doesn't see the man stepping on his plane because he is looking at the sky. Max decides to struggle to fix the blade of his plane. Max throws the plane high into the sky. Does Max think the blade of his plane is sharp or dull? Does Max want to make his plane fly high in the sky or to fix the blade of his plane? What will Max do next? Max believes the blade of his plane is dull. Max wants to fix the blade of his plane. Max will struggle to fix the blade of his plane. Max believes the blade of his plane is sharp. Max wants to make his plane fly high in the sky. Max will throw the plane high into the sky. A squirrel runs past Max, carrying a large nut. Max sees the squirrel. Max doesn't see the squirrel. Max blade of Max plane Max was looking at the sky, not at his plane. 
Toby was in the park having a picnic. Toby wanted to enjoy his charming picnic with fresh food. The blanket where Toby kept his food was clean. Toby believed the blanket was clean. After Toby went to study a bird nearby, a dog came and rolled over the blanket. Toby sees the dog rolling on the blanket. Toby doesn't see the dog rolling on the blanket as he is studying the bird. Toby decides to pack up his food and go home. Toby continues to enjoy his picnic. Does Toby think the blanket is clean or dirty? Does Toby want to continue his picnic or pack up his food and go home? What will Toby do next? Toby believes the blanket is dirty. Toby wants to pack up his food and go home. Toby will pack up his food and go home. Toby believes the blanket is clean. Toby wants to continue his picnic. Toby will continue to enjoy his picnic. A kite gets stuck in a tree nearby. Toby sees the kite stuck in the tree. Toby doesn't see the kite stuck in the tree. Toby The blanket Lack of sight  > Toby was looking at the bird. 
Pete was at the big shop to buy food for his big party. Pete wanted to buy some incredible napkins he saw last time. The napkins were big and colorful. Pete believed the napkins were big and colorful. The shopkeeper, wanting to save space, folded all the napkins making them small. Pete sees the shopkeeper folding the napkins. Pete does not see the shopkeeper folding the napkins. Pete decides to ask the shopkeeper if they have any more of the big, colorful napkins. Pete picks up the big, colorful napkins and puts them in his cart. Does Pete think the napkins are big and colorful or small? Does Pete want to buy the big, colorful napkins or ask the shopkeeper for more? What will Pete do about the napkins? Pete believes the napkins are now small. Pete wants to ask the shopkeeper for more big, colorful napkins. Pete will ask the shopkeeper for more big, colorful napkins. Pete believes the napkins are big and colorful. Pete wants to buy the big, colorful napkins. Pete will pick up the big, colorful napkins and put them in his cart. A balloon pops in the party supplies aisle. Pete hears the balloon pop. Pete does not hear the balloon pop. Pete Napkins Pete was in a different aisle looking for party hats. 
Andy was at the park playing with his friends. Andy wants to win the game of hide and seek. The old tree in the park had a big hole. Andy believed the hole in the tree was empty. A squirrel, looking for a place to hide its acorns, quickly ran into the hole in the tree. Andy sees the squirrel run into the hole. Andy does not see the squirrel because he is peeking behind a bush. Andy decides to find another hiding spot. Andy decides to hide in the hole in the tree. Does Andy think the hole in the tree is empty or does it have a squirrel in it? Does Andy want to hide in the hole in the tree or find another hiding spot? What will Andy do next? Andy believes the hole in the tree has a squirrel in it. Andy wants to find another hiding spot. Andy will find another hiding spot. Andy believes the hole in the tree is empty. Andy wants to hide in the hole in the tree. Andy will hide in the hole in the tree. A dull memory of last summer picnic at the park comes to Andy mind. Andy remembers the picnic. Andy doesn't remember the picnic. Andy Hole in the tree Andy was looking in another direction. 
Ollie was in the park with a bucket and spade. Ollie wanted to build a big sand castle. The sand castle Ollie was building was incomplete. Ollie believed the sand castle he was building was incomplete. A kind big sister nearby noticed Ollie struggle and helped finish the sand castle while Ollie was distracted by an ant. Ollie realizes the big sister finished his sand castle. Ollie doesn't realize the big sister finished his sand castle because he was watching the ant. Ollie decides to thank the big sister for her help. Ollie continues to build the sand castle. Does Ollie think the sand castle is incomplete or complete? Does Ollie want to continue building the sand castle or thank the big sister? What will Ollie do next? Ollie believes the sand castle is complete. Ollie wants to thank the big sister. Ollie will thank the big sister. Ollie believes the sand castle is incomplete. Ollie wants to continue building the sand castle. Ollie will continue to build the sand castle. A dog runs by and barks at Ollie. Ollie sees the dog. Ollie doesn't see the dog. Ollie sand castle Ollie was distracted by an ant. 
Max was at a birthday party in the park. Max wanted to eat a big piece of the birthday cake. The birthday cake was green and looked very yummy. Max believed the cake was green and yummy. A group of ants crawled onto the cake, making it not good to eat anymore. Max saw the ants on the cake. Max did not see the ants on the cake because he was playing a game. Max decides to tell his mom about the ants on the cake. Max walks towards the cake to get a big piece. Does Max think the cake is yummy and good to eat, or does he think it is not good to eat because of the ants? Does Max want to eat a big piece of cake or tell his mom about the ants? What will Max do next? Max believes the cake is not good to eat because of the ants. Max wants to tell his mom about the ants on the cake. Max will tell his mom about the ants on the cake. Max believes the cake is green and yummy. Max wants to eat a big piece of the birthday cake. Max will walk towards the cake to get a big piece. A clown started to make balloon animals. Max sees the clown making balloon animals. Max doesn't see the clown because he is looking at the cake. Max Birthday cake Max was playing a game with his friends and was not looking at the cake. 
Lenny was in the kitchen, ready to make a glass of juice. Lenny wanted to have a glass of fresh orange juice. The faucet in the kitchen was working fine. Lenny believed that the faucet in the kitchen was working fine. The city had to fix a broken pipe, so they turned off the water for a few hours. Lenny sees the city workers outside his house. Lenny does not see the city workers as he is watching a movie on TV. Lenny decides to step out and ask the city workers when the water will be back. Lenny goes to the kitchen to make his orange juice. Does Lenny think the faucet in the kitchen is working fine or not working? Does Lenny want to make orange juice or ask the city workers when the water will be back? What will Lenny do next? Lenny believes the faucet in the kitchen is not working. Lenny wants to ask the city workers when the water will be back. Lenny will step out and ask the city workers when the water will be back. Lenny believes the faucet in the kitchen is working fine. Lenny wants to make orange juice. Lenny will go to the kitchen to make his orange juice. A squirrel runs across Lenny yard. Lenny sees the squirrel. Lenny doesn't see the squirrel. Lenny The faucet in the kitchen Lenny was in the living room watching TV. 
Ollie was at the park playing with his dog, Spot. Ollie wanted to play fetch with Spot using his favorite stick. The stick was lying on the ground. Ollie believed the stick was on the ground. A squirrel, not seeing the stick, leaned on it and it rolled away into the bushes. Ollie sees the squirrel lean on the stick. Ollie doesn't see the squirrel lean on the stick because he was looking at Spot. Ollie decides to look for another stick to play fetch with Spot. Ollie picks up the stick and throws it for Spot to fetch. Does Ollie think the stick is on the ground or in the bushes? Does Ollie want to play fetch with Spot using the stick on the ground or look for another stick? What will Ollie do next? Ollie believes the stick is in the bushes. Ollie wants to look for another stick to play fetch with Spot. Ollie will look for another stick to play fetch with Spot. Ollie believes the stick is on the ground. Ollie wants to play fetch with Spot using the stick on the ground. Ollie will pick up the stick and throw it for Spot to fetch. A butterfly lands on Spot nose. Ollie sees the butterfly land on Spot nose. Ollie doesn't see the butterfly land on Spot nose. Ollie Stick Line of sight  > Ollie was looking at Spot and didn't see the squirrel. 
Jax was at the beach building a sand castle. Jax wanted to make the best sand castle ever. The chubby bucket he was using was right side up. Jax believed that his chubby bucket was right side up. A playful puppy ran by and accidentally flipped the chubby bucket over. Jax sees the puppy flip his bucket. Jax doesn't see the puppy flip his bucket because he is looking for seashells. Jax decides to flip the bucket back to its original position. Jax continues to build his sand castle using the chubby bucket. Does Jax think his chubby bucket is right side up or upside down? Does Jax want to continue building his sand castle or to flip his bucket back to its original position? What will Jax do next? Jax believes his chubby bucket is upside down. Jax wants to flip his bucket back to its original position. Jax will flip his bucket back to its original position. Jax believes his chubby bucket is right side up. Jax wants to continue building his sand castle. Jax will continue to build his sand castle using the chubby bucket. A seagull lands near Jax sand castle. Jax sees the seagull. Jax doesn't see the seagull. Jax Chubby bucket Lack of sight  > Jax was busy looking for the perfect seashell to decorate his castle. 
Adam was at the zoo with his family. Adam wanted to make a drawing of the kangaroo he saw. The kangaroo food bowl was full. Adam believed the kangaroo food bowl was full. The zookeeper came and the kangaroo ate all the food from the bowl. Adam saw the zookeeper come and the kangaroo eat all the food. Adam did not see the zookeeper come or the kangaroo eat all the food because he was busy drawing. Adam decides to add the empty food bowl to his drawing. Adam continues to draw the kangaroo with the full food bowl. Does Adam think the kangaroo food bowl is full or empty? Does Adam want to continue his drawing with the full food bowl or add the empty food bowl to his drawing? What will Adam do next in his drawing? Adam believes the kangaroo food bowl is empty. Adam wants to add the empty food bowl to his drawing. Adam will draw the empty food bowl. Adam believes the kangaroo food bowl is full. Adam wants to continue his drawing with the full food bowl. Adam will continue to draw the kangaroo with the full food bowl. A weak bird lands on the fence near the kangaroo enclosure. Adam sees the weak bird. Adam doesn't see the weak bird. Adam kangaroo food bowl Adam was looking down at his drawing, not at the kangaroo. 
Polly was sitting in her garden, enjoying the warm sun. Polly wished to make a refreshing lime drink to cool down. There was a ripe lime hanging on the tree. Polly believed that the lime on the tree was ripe. A bird flew by and pecked at the lime, making it fall and roll away into the bushes. Polly sees the bird flying away. Polly doesn't see the bird because she is gazing at the sky. Polly decides to search for the lime in the bushes. Polly plans to pick the ripe lime from the tree. Does Polly think the lime is still hanging on the tree or has it rolled away into the bushes? Does Polly want to pick the lime from the tree or search for it in the bushes? What will Polly do next? Polly believes the lime has rolled away into the bushes. Polly wants to search for the lime in the bushes. Polly will search for the lime in the bushes. Polly believes the lime is still hanging on the tree. Polly wants to pick the lime from the tree. Polly will pick the ripe lime from the tree. A butterfly lands on a flower next to Polly. Polly sees the butterfly. Polly doesn't see the butterfly. Polly Lime on the tree Lack of sight  > Polly was gazing at the sky. 
Vito was at the beach building a sandcastle. Vito wanted to make the best sandcastle ever. The sand was dry and easy to shape. Vito believed that the sand was dry and easy to shape. A slow tide came in and made the sand wet. Vito sees the tide coming in. Vito does not see the tide coming in because he is focused on his sandcastle. Vito decides to move to a drier spot to continue building his sandcastle. Vito continues to shape and build his sandcastle. Does Vito think the sand is dry and easy to shape or wet and hard to shape? Does Vito want to continue building his sandcastle where he is or move to a drier spot? What will Vito do next? Vito believes the sand is wet and hard to shape. Vito wants to move to a drier spot to continue building his sandcastle. Vito will move to a drier spot to continue building his sandcastle. Vito believes the sand is dry and easy to shape. Vito wants to continue building his sandcastle. Vito will continue to shape and build his sandcastle. A crab starts to crawl towards Vito sandcastle. Vito sees the crab crawling towards his sandcastle. Vito doesn't see the crab because he focused on his sandcastle. Vito Sand Lack of sight  > Vito was focused on his sandcastle and did not see the tide coming in. 
Ella was at the beach building a sandcastle. Ella wanted to make the biggest sandcastle ever. The key to making a big sandcastle is to use wet sand. Ella believed the sand was wet enough to build a big sandcastle. As the day went by, the hot sun dried out the sand making it too dry to hold together. Ella felt the sand getting dry. Ella didn't notice the sand getting dry because she was too focused on her sandcastle. Ella decides to soak the sand with sea water. Ella continues to build her sandcastle. Does Ella think the sand is wet or dry? Does Ella want to continue building her sandcastle or soak the sand with sea water? What is Ella going to do next? Ella believes the sand is dry. Ella wants to soak the sand with sea water. Ella will go to the sea to get water to wet the sand. Ella believes the sand is wet enough. Ella wants to continue building her sandcastle. Ella will continue to build her sandcastle. An ugly crab crawls near Ella sandcastle. Ella sees the ugly crab. Ella doesn't see the ugly crab. Ella sand Ella was too focused on building her sandcastle. 
Sam was in his garden watering his plants. Sam wanted his sunflower to grow big and strong. The sunflower was very dry. Sam believed the sunflower was very dry. The sunflower was accidentally sprayed with a hose by Sam neighbor, making it wet. Sam sees his neighbor spraying the sunflower with a hose. Sam doesn't see his neighbor spraying the sunflower with a hose because he is talking to his dog. Sam decides to move the sunflower to a dry spot. Sam continues watering the rest of his plants. Does Sam think the sunflower is dry or wet? Does Sam want to continue watering his plants or move the sunflower to a dry spot? What will Sam do next? Sam believes the sunflower is wet. Sam wants to move the sunflower to a dry spot. Sam will move the sunflower to a dry spot. Sam believes the sunflower is dry. Sam wants to continue watering his plants. Sam will continue watering the rest of his plants. A bird lands on the garden fence. Sam sees the bird. Sam doesn't see the bird. Sam Sam sunflower Lack of sight  > Sam was turned around talking to his dog. 
Luke was sitting by the clear blue sea. Luke wanted to find a shiny stone for his wife. The sand was smooth and warm. Luke believed the sand was smooth and warm. Over time, the waves washed over the sand, making it rough and bumpy. Luke feels the sand becoming rough and bumpy. Luke doesn't feel the sand becoming rough and bumpy because he is sitting on a beach chair. Luke decides to look for the shiny stone in the water instead. Luke continues to search for the shiny stone in the sand. Does Luke think the sand is smooth and warm or rough and bumpy? Does Luke want to look for the shiny stone in the sand or in the water? Where will Luke look for the shiny stone? Luke believes the sand is rough and bumpy. Luke wants to look for the shiny stone in the water. Luke will look for the shiny stone in the water. Luke believes the sand is smooth and warm. Luke wants to look for the shiny stone in the sand. Luke will continue to search for the shiny stone in the sand. A seagull lands on the beach chair next to Luke. Luke sees the seagull landing next to him. Luke doesn't see the seagull landing next to him. Luke sand Lack of touch  > Luke was sitting on a beach chair, not touching the sand. 
Luke was in the kitchen, ready to have breakfast. Luke wanted to eat his favorite cereal for breakfast. The box of cereal was full. Luke believed the box of cereal was full. Over time, the bottom of the cereal box became weak and the cereal spilled out onto the floor. Luke sees the cereal spill out of the box. Luke does not see the cereal spill out of the box because he is looking at his phone. Luke decides to clean up the spilled cereal and find something else to eat. Luke plans to pour the cereal into a bowl and enjoy his breakfast. Does Luke think the box of cereal is full or empty? Does Luke want to eat his cereal or clean up the spilled cereal and find something else to eat? What will Luke do next? Luke believes the box of cereal is empty. Luke wants to clean up the spilled cereal and find something else to eat. Luke will clean up the spilled cereal and find something else to eat. Luke believes the box of cereal is full. Luke wants to eat his cereal. Luke will pour the cereal into a bowl and enjoy his breakfast. A bird flies into the kitchen through the open window. Luke sees the bird. Luke doesn't see the bird. Luke box of cereal Lack of sight  > Luke was looking at his phone. 
Remy was in the garden, taking care of his plants. Remy wanted to make sure all his plants were watered well. The staff that controls the water spray was in its place. Remy believed the staff that controls the water spray was in its place. A squirrel, looking for food, knocked the staff to the ground. Remy hears the staff falling to the ground. Remy doesn't hear the staff falling as he is humming a song. Remy picks up the staff and places it back in its place. Remy starts to spray water on his plants. Does Remy think the staff is in its place or on the ground? Does Remy want to water his plants or to pick up the staff and place it back? What will Remy do next? Remy believes the staff is on the ground. Remy wants to pick up the staff and place it back. Remy will pick up the staff and place it back. Remy believes the staff is in its place. Remy wants to water his plants. Remy will start to spray water on his plants. A rainbow appears in the sky. Remy sees the rainbow. Remy doesn't see the rainbow. Remy The staff that controls the water spray Remy back was turned to the staff. 
Jay was on his new zoom scooter at the park. Jay wanted to show his friends how fast he could go. The path in front of Jay was clean and clear. Jay believed the path was clean and clear. A group of birds suddenly took off from a nearby tree, and their feathers fell on the path. Jay sees the feathers falling on the path. Jay doesn't see the feathers falling as he is looking at his friends. Jay decides to slow down and carefully ride through the feathers. Jay speeds up to show his friends how fast his zoom scooter can go. Does Jay think the path is clean and clear or covered in feathers? Does Jay want to slow down and ride carefully or speed up and show his friends how fast he can go? What will Jay do next? Jay believes the path is covered in feathers. Jay wants to slow down and ride carefully through the feathers. Jay will slow down and carefully ride through the feathers. Jay believes the path is clean and clear. Jay wants to speed up and show his friends how fast he can go. Jay will speed up to show his friends how fast his zoom scooter can go. A dog starts chasing its tail near Jay. Jay sees the dog chasing its tail. Jay doesn't see the dog as he is focused on the path. Jay The path in front of Jay. Jay was looking at his friends and not the path. 
Ollie was in the kitchen making a jolly good cake. Ollie wanted to add the last ingredient, honey, to the cake mix. The jar of honey was full and ready to be used. Ollie believed the jar of honey was full and ready to be used. A small hole slowly formed at the bottom of the jar, causing the honey to slowly leak out. Ollie sees the honey leaking out of the jar. Ollie doesn't see the honey leaking out as he is stirring the cake mix. Ollie decides to use a different jar of honey. Ollie stirs the honey into the cake mix. Does Ollie think the jar of honey is full or leaking? Does Ollie want to stir the honey into the cake mix or use a different jar of honey? What will Ollie do next? Ollie believes the jar of honey is leaking. Ollie wants to use a different jar of honey. Ollie will use a different jar of honey. Ollie believes the jar of honey is full. Ollie wants to stir the honey into the cake mix. Ollie will stir the honey into the cake mix. A funny cartoon plays on the TV in the kitchen. Ollie sees the funny cartoon. Ollie doesn't see the funny cartoon. Ollie jar of honey Lack of sight  > Ollie back was turned to the jar. 
Toby was in the park playing with his toy car. Toby wanted his toy car to go fast and win the pretend race. The toy car was shiny and working well. Toby believed that his toy car was working well. An insect crawled into the toy car battery compartment, causing it to stop working. Toby sees the insect crawl into the toy car battery compartment. Toby doesn't see the insect crawl into the toy car battery compartment because he was looking at his friend toy car. Toby decides to carefully remove the insect from the toy car battery compartment. Toby continues to make his toy car go fast in the pretend race. Does Toby think that his toy car is working well or not working? Does Toby want to make his toy car go fast in the pretend race or to remove the insect from the toy car battery compartment? What will Toby do next? Toby believes his toy car is not working. Toby wants to remove the insect from the toy car battery compartment. Toby will carefully remove the insect from the toy car battery compartment. Toby believes his toy car is working well. Toby wants his toy car to go fast in the pretend race. Toby will continue to make his toy car go fast in the pretend race. An icy breeze blows through the park. Toby feels the icy breeze. Toby doesn't feel the icy breeze. Toby Toby toy car Lack of sight  > Toby was looking at his friend toy car. 
Nemo was in the kitchen making a mess. Nemo wanted to clean up before his mom got home. The mop was laying still in the corner. Nemo believed the mop was laying still in the corner. The cat, chasing a mouse, knocked the mop, causing it to roll across the floor. Nemo sees the mop rolling across the floor. Nemo does not see the mop rolling as he is busy cleaning the table. Nemo decides to chase after the mop to stop it. Nemo plans to grab the mop and start cleaning the floor. Does Nemo think the mop is still laying in the corner or rolling across the floor? Does Nemo want to clean the floor with the mop or stop the rolling mop? What will Nemo do next? Nemo believes the mop is rolling across the floor. Nemo wants to stop the mop from rolling. Nemo will chase after the mop to stop it. Nemo believes the mop is laying still in the corner. Nemo wants to clean the floor with the mop. Nemo will grab the mop and start cleaning the floor. A nice song starts playing on the radio in the kitchen. Nemo hears the song playing on the radio. Nemo doesn't hear the song because he is focused on the mop. Nemo The mop Nemo was focused on cleaning the table and didn't see the mop move. 
Lila was in the kitchen, ready to make a great cake. Lila wants to cut the apples into thin slices for her cake. The knife on the table is sharp. Lila believes the knife on the table is sharp. The knife falls and hits a stone, making it dull. Lila sees the knife fall and hit the stone. Lila doesn't see the knife fall and hit the stone because she is reading the recipe. Lila decides to set the dull knife aside and find a new one. Lila picks up the sharp knife and starts to cut the apples. Does Lila think the knife is sharp or dull? Does Lila want to cut the apples or find a new knife? What will Lila do next? Lila believes the knife is dull. Lila wants to find a new knife. Lila will set the dull knife aside and find a new one. Lila believes the knife is sharp. Lila wants to cut the apples. Lila will pick up the knife and start to cut the apples. A bird flies into the kitchen through the open window. Lila sees the bird. Lila doesn't see the bird. Lila knife Lack of sight  > Lila was looking at the recipe. 
