Zara was in her garden with her favorite plant. Zara desired to tie a pretty ribbon around the plant. The ribbon was untied on the table. Zara believed the ribbon was untied. Suddenly, a playful cat jumped on the table and knotted the ribbon.;Zara sees the cat play with the ribbon.;Zara doesn't see the cat play with the ribbon.;Zara decides to untie the ribbon.;Zara plans to pick up the ribbon to tie around the plant.;Does Zara think the ribbon is untied or knotted?;Does Zara want to tie the ribbon around the plant or to untie the ribbon?;What will Zara do?;Zara thinks the ribbon is knotted.;Zara wants to untie the ribbon.;Zara will untie the ribbon.;Zara thinks the ribbon is untied.;Zara wants to tie the ribbon around the plant.;Zara will pick up the ribbon to tie around the plant.;A butterfly lands on the plant.;Zara sees the butterfly land on the plant.;Zara doesn't see the butterfly land on the plant.;Zara;ribbon;auto;0
Harry was in his room. Harry wanted to paint a picture of a big angel. The angel statue in his room was big. Harry believed the angel statue was big. Suddenly, a loud noise scared the cat, who jumped and knocked over the angel statue, making it break into small pieces.;Harry hears the loud noise.;Harry doesn't hear the loud noise.;Harry decides to glue the pieces of the angel statue back together.;Harry starts to paint the big angel statue.;Does Harry think the angel statue is big or small?;Does Harry want to paint the angel statue or glue it back together?;What will Harry do?;Harry thinks the angel statue is small.;Harry wants to glue the angel statue back together.;Harry will glue the angel statue back together.;Harry thinks the angel statue is big.;Harry wants to paint the angel statue.;Harry will start to paint the angel statue.;A butterfly flies into his room.;Harry sees the butterfly fly into his room.;Harry doesn't see the butterfly fly into his room.;Harry;Angel statue;auto;0
Amy was in a big library. Amy wanted to reach a book on the top shelf. The book was in a clear glass box. Amy believed the book was in a clear glass box. Suddenly, a librarian came and put a dark cover over the box, making it opaque.;Amy saw the librarian put the cover on the box.;Amy did not see the librarian put the cover on the box.;Amy asked the librarian to remove the cover.;Amy used a ladder to reach the book.;Does Amy think the book is in a clear or opaque box?;Does Amy want to reach the book or ask the librarian to remove the cover?;What will Amy do?;Amy thinks the book is in an opaque box.;Amy wants the librarian to remove the cover.;Amy will ask the librarian to remove the cover.;Amy thinks the book is in a clear box.;Amy wants to reach the book.;Amy will use a ladder to reach the book.;A group of children enter the library for a tour.;Amy notices the group of children.;Amy does not notice the group of children.;Amy;book box;auto;0
Umar was at the park with his friends. Umar wanted to win the race and get the medal. The medal was shiny and new. Umar believed the medal was shiny and new. Suddenly, a naughty dog ran over and bit the medal, making it look old and scratched.;Umar sees the dog bite the medal.;Umar doesn't see the dog bite the medal.;Umar decides to clean the medal.;Umar plans to walk up to the stage to receive the medal.;Does Umar believe the medal is shiny and new or old and scratched?;Does Umar want to walk up to the stage to receive the medal or to clean the medal?;What will Umar do?;Umar believes the medal is old and scratched.;Umar wants to clean the medal.;Umar will clean the medal.;Umar believes the medal is shiny and new.;Umar wants to walk up to the stage to receive the medal.;Umar will walk up to the stage to receive the medal.;An elderly lady walks by with her little grandson.;Umar sees the elderly lady and her grandson.;Umar doesn't see the elderly lady and her grandson.;Umar;Medal;auto;0
Finn was in the park near his home. Finn wanted to play with his cricket bat and ball. The cricket ball was ready for a game. Finn believed the cricket ball was ready for a game. Suddenly, a dog ran by and picked up the cricket ball in its mouth, changing the ball's taste to salty.;Finn sees the dog take the ball.;Finn does not see the dog take the ball.;Finn decides to clean the ball before playing.;Finn gets ready to hit the cricket ball.;Does Finn think the cricket ball is ready for a game or does it taste salty?;Does Finn want to play cricket or clean the ball?;What will Finn do?;Finn believes the cricket ball tastes salty.;Finn wants to clean the ball before playing.;Finn will clean the ball before playing.;Finn believes the cricket ball is ready for a game.;Finn wants to play cricket.;Finn will get ready to hit the cricket ball.;A butterfly flutters past Finn.;Finn sees the butterfly.;Finn doesn't see the butterfly.;Finn;Cricket ball;auto;0
Ella was in her room doing her homework. She wanted to learn a new song on her phone. The phone was fully charged. Ella believed her phone was fully charged. Suddenly, her little brother, being careless, unplugged the phone charger, causing the phone to become discharged.;Ella saw her little brother unplug the phone charger.;Ella did not see her little brother unplug the phone charger.;Ella decided to plug the phone back into the charger.;Ella was going to use her phone to learn the new song.;Does Ella believe her phone is fully charged or discharged?;Does Ella want to learn the new song or plug her phone back into the charger?;What will Ella do?;Ella believes her phone is discharged.;Ella wants to plug her phone back into the charger.;Ella will plug her phone back into the charger.;Ella believes her phone is fully charged.;Ella wants to learn the new song.;Ella will use her phone to learn the new song.;A jacket falls off the chair.;Ella sees the jacket fall off the chair.;Ella does not see the jacket fall off the chair.;Ella;Phone;auto;0
Wendy was in her room playing. Wendy wanted to teach her toy bear how to find treasure. The toy bear was tidy and clean. Wendy believed that her toy bear was tidy and clean. Suddenly, a chocolate syrup spill made the toy bear taste sweet.;Wendy saw the chocolate syrup spill.;Wendy didn't see the chocolate syrup spill.;Wendy decides to clean the sweet-tasting bear.;Wendy pretends to give the bear a treasure map.;Does Wendy think her toy bear is clean or sweet-tasting?;Does Wendy want to teach her bear to find treasure or to clean the sweet-tasting bear?;What will Wendy do?;Wendy thinks her toy bear tastes sweet.;Wendy wants to clean the sweet-tasting bear.;Wendy will clean the sweet-tasting bear.;Wendy thinks her toy bear is clean.;Wendy wants to teach her bear to find treasure.;Wendy will pretend to give the bear a treasure map.;A butterfly flutters into the room.;Wendy sees the butterfly.;Wendy doesn't see the butterfly.;Wendy;toy bear;auto;0
Kira was at the park near the big pond. Kira wanted to sail her toy boat in the pond. The toy boat was right side up on the ground. Kira believed the toy boat was right side up on the ground. Suddenly, a playful dog ran by and flipped the toy boat upside down.;Kira sees the dog flip her boat.;Kira does not see the dog flip her boat.;Kira plans to flip the boat right side up again.;Kira picks up the boat to put it in the water.;Does Kira think the boat is right side up or flipped upside down?;Does Kira want to put the boat in the water or flip it right side up?;What will Kira do?;Kira believes the boat is flipped upside down.;Kira wants to flip the boat right side up.;Kira will flip the boat right side up.;Kira believes the boat is right side up.;Kira wants to put the boat in the water.;Kira will pick up the boat to put it in the water.;A class of kids comes to the park for a field trip.;Kira sees the class of kids.;Kira does not see the class of kids.;Kira;toy boat;auto;0
Greta was at the park. Greta wants to play on the swing. The swing was still and empty. Greta believes the swing is still and empty. Suddenly, a big dog runs up and flips the swing.;Greta sees the big dog.;Greta does not see the big dog.;Greta decides to wait until the swing stops moving.;Greta walks towards the swing to play on it.;Does Greta think the swing is still or moving?;Does Greta want to play on the swing or wait until it stops moving?;What will Greta do?;Greta thinks the swing is moving.;Greta wants to wait until the swing stops moving.;Greta will wait until the swing stops moving.;Greta thinks the swing is still.;Greta wants to play on the swing.;Greta will walk towards the swing to play on it.;A clever squirrel runs past her with a nut.;Greta sees the squirrel.;Greta doesn't see the squirrel.;Greta;swing;auto;0
Usha was at the farm. Usha wanted to mail a bag of wheat to her friend. The bag was securely fastened. Usha believed the bag was securely fastened. Suddenly, a naughty squirrel chewed the rope, making the bag loose.;Usha saw the squirrel.;Usha did not see the squirrel.;Usha decides to tie the bag again.;Usha was about to mail the bag of wheat.;Does Usha think the bag is securely fastened or loose?;Does Usha want to mail the bag of wheat or tie it again?;What will Usha do next?;Usha thinks the bag is loose.;Usha wants to tie the bag again.;Usha will tie the bag again.;Usha thinks the bag is securely fastened.;Usha wants to mail the bag of wheat.;Usha will mail the bag of wheat.;A bright rainbow appears in the sky.;Usha sees the bright rainbow.;Usha doesn't see the bright rainbow.;Usha;Bag of wheat;auto;0
Ed was at the park playing. Ed wanted to swing high on the large swing. The swing's belt was tight and secure. Ed believed the swing's belt was tight and secure. Suddenly, a naughty kid untied the swing's belt making it loose and unsure.;Ed sees the naughty kid untie the belt.;Ed doesn't see the naughty kid untie the belt.;Ed decides to fix the swing's belt before playing.;Ed jumps on the swing to play.;Does Ed think the swing's belt is tight and secure or loose and unsure?;Does Ed want to play on the swing or fix the swing's belt?;What will Ed do?;Ed believes the swing's belt is loose and unsure.;Ed wants to fix the swing's belt.;Ed will fix the swing's belt.;Ed believes the swing's belt is tight and secure.;Ed wants to play on the swing.;Ed will jump on the swing to play.;A butterfly lands on the swing.;Ed sees the butterfly land on the swing.;Ed doesn't see the butterfly land on the swing.;Ed;Swing's belt;auto;0
Umar was sitting in the living room. Umar wanted to read his favorite magazine. The magazine was clear with bright pictures. Umar believed the magazine was clear with bright pictures. Suddenly, a spilled cup of coffee made the magazine distorted.;Umar saw the coffee spill.;Umar didn't see the coffee spill.;Umar planned to clean the magazine.;Umar was about to read the magazine.;Does Umar think the magazine is clear or distorted?;Does Umar want to read the magazine or clean it?;What is Umar going to do?;Umar believes the magazine is distorted.;Umar wants to clean the magazine.;Umar will clean the magazine.;Umar believes the magazine is clear.;Umar wants to read the magazine.;Umar will read the magazine.;The doorbell rings.;Umar hears the doorbell.;Umar doesn't hear the doorbell.;Umar;Magazine;auto;0
Ella was in her room, playing with her toy phone. Ella wanted to ask her teddy bear a question using the toy phone. The toy phone's wire was connected. Ella thought the toy phone's wire was connected. Suddenly, her little brother tripped over the wire, disconnecting it.;Ella sees her little brother trip over the wire.;Ella doesn't see her little brother trip over the wire.;Ella decides to fix the wire.;Ella lifts the toy phone to ask her teddy bear a question.;Does Ella think the toy phone's wire is connected or disconnected?;Does Ella want to ask her teddy bear a question or to fix the wire?;What will Ella do?;Ella thinks the toy phone's wire is disconnected.;Ella wants to fix the wire.;Ella will fix the wire.;Ella thinks the toy phone's wire is connected.;Ella wants to ask her teddy bear a question.;Ella will lift the toy phone to ask her teddy bear a question.;A quiet song starts playing on the radio.;Ella hears the quiet song on the radio.;Ella doesn't hear the quiet song on the radio.;Ella;toy phone's wire;auto;0
Ina is in the forest near her house. Ina wants to find a pretty flower to put in her hair. The trunk of a tree is covered with pretty flowers. Ina believes the trunk of the tree is covered with pretty flowers. Suddenly, a group of squirrels run up the tree, disturbing the flowers and making them fall off the trunk.;Ina sees the squirrels running up the tree.;Ina doesn't see the squirrels running up the tree.;Ina decides to collect the fallen flowers from the ground.;Ina reaches out to pluck a flower from the tree trunk.;Does Ina believe the tree trunk is covered with flowers or are the flowers on the ground?;Does Ina want to pluck a flower from the tree trunk or to pick up a flower from the ground?;What will Ina do?;Ina believes the flowers are on the ground.;Ina wants to pick up a flower from the ground.;Ina will pick up a flower from the ground.;Ina believes the tree trunk is covered with flowers.;Ina wants to pluck a flower from the tree trunk.;Ina will reach out to pluck a flower from the tree trunk.;A butterfly lands on a nearby bush.;Ina sees the butterfly landing on the bush.;Ina doesn't see the butterfly landing on the bush.;Ina;tree trunk;auto;0
Cece was in her grandmother's garden. Cece wanted to wear her grandmother's apron to help with the gardening. The apron was a bright yellow color. Cece believed the apron was a bright yellow color. Suddenly, a splash of muddy water from a passing truck changed the apron's color to a dirty brown.;Cece saw the splash of muddy water.;Cece didn't see the splash of muddy water.;Cece decided to wash the dirty apron.;Cece planned to put on the bright yellow apron.;Does Cece think the apron is bright yellow or dirty brown?;Does Cece want to wear the apron or wash it?;What will Cece do?;Cece thinks the apron is dirty brown.;Cece wants to wash the apron.;Cece will wash the apron.;Cece thinks the apron is bright yellow.;Cece wants to wear the apron.;Cece will put on the apron.;A wide butterfly lands on a flower nearby.;Cece sees the butterfly.;Cece doesn't see the butterfly.;Cece;apron;auto;0
Gina was in her room. Gina wanted to play her flute for her mom. The flute was in its case. Gina believed the flute was in its case. Suddenly, her little brother knocked the flute case off the table, causing the flute to spill out onto the floor.;Gina sees her little brother knock the flute case off the table.;Gina doesn't see her little brother knock the flute case off the table.;Gina plans to pick up the flute from the floor.;Gina considers opening the case to get her flute.;Does Gina think the flute is in its case or on the floor?;Does Gina want to play her flute for her mom or pick up the flute from the floor?;What will Gina do next?;Gina believes the flute is on the floor.;Gina wants to pick up the flute from the floor.;Gina will pick up the flute from the floor.;Gina believes the flute is in its case.;Gina wants to play her flute for her mom.;Gina will open the case to get her flute.;A cat jumps onto Gina's bed.;Gina sees the cat jump onto her bed.;Gina doesn't see the cat jump onto her bed.;Gina;flute;auto;0
Xander was at the beach by the sea. Xander wanted to swim in the sea. The sea water was warm. Xander believed the sea water was warm. Suddenly, a cold current passed, changing the sea water from warm to cold.;Xander feels the cold current.;Xander doesn't feel the cold current.;Xander decides to rub his arms to warm up.;Xander gets ready to swim in the sea.;Does Xander believe the sea water is warm or cold?;Does Xander want to swim or warm up?;What will Xander do next?;Xander believes the sea water is cold.;Xander wants to warm up.;Xander will rub his arms to warm up.;Xander believes the sea water is warm.;Xander wants to swim.;Xander will get ready to swim in the sea.;An ancient ship appears on the horizon.;Xander sees the ancient ship.;Xander doesn't see the ancient ship.;Xander;sea water;auto;0
Hannah was in the garden during the day. Hannah wanted to use the rake to clean up the leaves. The rake was shiny and bright under the sun. Hannah believed that the rake was shiny and bright. Suddenly, a big cloud moved in front of the sun, making the rake look dim and dull.;Hannah sees the big cloud.;Hannah doesn't see the big cloud.;Hannah decides to go inside until the cloud moves.;Hannah starts to use the rake to clean up the leaves.;Does Hannah think the rake is shiny and bright or dim and dull?;Does Hannah want to clean up the leaves or to go inside until the cloud moves?;What will Hannah do next?;Hannah thinks the rake is dim and dull.;Hannah wants to go inside until the cloud moves.;Hannah will go inside until the cloud moves.;Hannah thinks the rake is shiny and bright.;Hannah wants to clean up the leaves.;Hannah will use the rake to clean up the leaves.;A polite cat walks into the garden.;Hannah sees the polite cat.;Hannah doesn't see the polite cat.;Hannah;rake;auto;0
Vicky was in her lab at school. Vicky wanted to look at a bug under her microscope. The microscope was securely fastened to the table. Vicky believed the microscope was securely fastened to the table. Suddenly, a strong shake from a passing truck made the microscope loose.;Vicky felt the strong shake.;Vicky did not feel the strong shake.;Vicky decides to fasten the microscope again.;Vicky puts the bug under the microscope to look at it.;Does Vicky think the microscope is securely fastened or loose?;Does Vicky want to look at the bug under the microscope or to fasten the microscope again?;What will Vicky do?;Vicky thinks the microscope is loose.;Vicky wants to fasten the microscope again.;Vicky will fasten the microscope again.;Vicky thinks the microscope is securely fastened.;Vicky wants to look at the bug under the microscope.;Vicky will put the bug under the microscope to look at it.;A bird flies into the lab through the open window.;Vicky sees the bird fly into the lab.;Vicky doesn't see the bird fly into the lab.;Vicky;microscope;auto;0
Sam was at the park near the pond. Sam wanted to find his toy boat in the calm pond water. The pond water was calm. Sam believed the pond water was calm. Suddenly, a group of ducks splashing around made the pond water turbulent.;Sam saw the ducks splashing around.;Sam didn't see the ducks splashing around.;Sam decided to wait until the water became calm again.;Sam started to search for his toy boat in the calm water.;Does Sam think the pond water is calm or turbulent?;Does Sam want to search for his toy boat or wait until the water becomes calm again?;What will Sam do?;Sam thinks the pond water is turbulent.;Sam wants to wait until the water becomes calm again.;Sam will wait until the water becomes calm again.;Sam thinks the pond water is calm.;Sam wants to search for his toy boat.;Sam will search for his toy boat in the calm water.;A healthy dog runs past Sam, chasing a frisbee.;Sam sees the dog running past.;Sam doesn't see the dog running past.;Sam;Pond water;auto;0
Yara was in the park with her friends. Yara wanted to lend her blue powder to her friend. The powder was in a bright container. Yara believed the powder was in a bright container. Suddenly, a passing dog kicked up a cloud of dust, making the container dim.;Yara sees the dog kick up the dust.;Yara doesn't see the dog kick up the dust.;Yara decides to clean the dim container.;Yara hands the bright container to her friend.;Does Yara think the powder is in a bright or dim container?;Does Yara want to lend the powder or clean the dim container?;What will Yara do?;Yara thinks the powder is in a dim container.;Yara wants to clean the dim container.;Yara will clean the dim container.;Yara thinks the powder is in a bright container.;Yara wants to lend the powder.;Yara will hand the bright container to her friend.;A squirrel runs up a nearby tree.;Yara sees the squirrel run up the tree.;Yara doesn't see the squirrel run up the tree.;Yara;powder in container;auto;0
Wilma was in a big park with many flowers. Wilma wanted to pick a gentle flower to give a name. The flower was under normal pressure. Wilma believed the flower was under normal pressure. Out of nowhere, a playful dog ran over the flower, changing its state from normal pressure to high pressure.;Wilma sees the playful dog.;Wilma doesn't see the playful dog.;Wilma decides to look for another flower.;Wilma reaches out to pick the flower.;Does Wilma think the flower is under normal pressure or high pressure?;Does Wilma want to pick the flower or look for another one?;What will Wilma do?;Wilma thinks the flower is under high pressure.;Wilma wants to look for another flower.;Wilma will look for another flower.;Wilma thinks the flower is under normal pressure.;Wilma wants to pick the flower.;Wilma will reach out to pick the flower.;A butterfly lands on a nearby flower.;Wilma sees the butterfly.;Wilma doesn't see the butterfly.;Wilma;flower;auto;0
Nia was at the park with her little lunch box. Nia wanted to eat her fresh celery sticks. The celery sticks were crisp and green. Nia believed that the celery sticks were crisp and green. Suddenly, a swarm of ants crawled over the celery sticks, making them spoiled.;Nia sees the ants.;Nia does not see the ants.;Nia decides to throw away the spoiled celery sticks.;Nia plans to eat the fresh celery sticks.;Does Nia think the celery sticks are crisp and green or spoiled?;Does Nia want to eat the celery sticks or throw them away?;What will Nia do?;Nia thinks the celery sticks are spoiled.;Nia wants to throw away the spoiled celery sticks.;Nia will throw away the spoiled celery sticks.;Nia thinks the celery sticks are crisp and green.;Nia wants to eat the celery sticks.;Nia will eat the celery sticks.;A little puppy runs by Nia.;Nia sees the little puppy.;Nia does not see the little puppy.;Nia;Celery sticks;auto;0
Kiki was in the park playing soccer. Kiki wanted to score a goal and win the trophy. The trophy was shiny and new. Kiki believed the trophy was shiny and new. Suddenly, a stray dog ran onto the field and knocked over the trophy, making it dirty and scratched.;Kiki saw the dog run onto the field.;Kiki didn't see the dog run onto the field.;Kiki decided to clean the trophy.;Kiki was ready to shoot the ball towards the goal.;Does Kiki think the trophy is shiny and new or dirty and scratched?;Does Kiki want to score a goal or clean the trophy?;What will Kiki do?;Kiki thinks the trophy is dirty and scratched.;Kiki wants to clean the trophy.;Kiki will clean the trophy.;Kiki thinks the trophy is shiny and new.;Kiki wants to score a goal.;Kiki will shoot the ball towards the goal.;A spicy smell wafts from a nearby food truck.;Kiki smells the spicy food.;Kiki doesn't smell the spicy food.;Kiki;The trophy;auto;0
Izzy was at the market in the town. Izzy wanted to buy a big clock for her room. The clock was securely fastened on the shop wall. Izzy believed the clock was securely fastened on the shop wall. Then, a shop worker accidentally bumped into the wall, causing the clock to become loose.;Izzy sees the shop worker bump into the wall.;Izzy doesn't see the shop worker bump into the wall.;Izzy decides to tell the shop worker that the clock is loose.;Izzy reaches for her purse to pay for the clock.;Does Izzy think the clock is securely fastened or loose?;Does Izzy want to buy the clock or tell the shop worker that the clock is loose?;What will Izzy do next?;Izzy believes the clock is loose.;Izzy wants to tell the shop worker that the clock is loose.;Izzy will tell the shop worker that the clock is loose.;Izzy believes the clock is securely fastened.;Izzy wants to buy the clock.;Izzy will reach for her purse to pay for the clock.;A noisy truck passes by the market.;Izzy hears the noisy truck.;Izzy doesn't hear the noisy truck.;Izzy;clock;auto;0
Usha was in the museum looking at a richly decorated skull. Usha wanted to take a picture of the skull. The skull was under normal pressure in the display case. Usha believed the skull was under normal pressure. Suddenly, the air conditioning system malfunctioned, causing the pressure in the display case to increase drastically.;Usha hears the loud noise of the air conditioning system malfunctioning.;Usha doesn't hear the loud noise of the air conditioning system malfunctioning.;Usha decides to inform the museum staff about the change in pressure in the display case.;Usha prepares to take a picture of the skull.;Does Usha think the skull is under normal pressure or high pressure?;Does Usha want to take a picture of the skull or inform the museum staff about the change in pressure?;What will Usha do?;Usha thinks the skull is under high pressure.;Usha wants to inform the museum staff about the change in pressure.;Usha will inform the museum staff about the change in pressure.;Usha thinks the skull is under normal pressure.;Usha wants to take a picture of the skull.;Usha will prepare to take a picture of the skull.;A child drops his ice cream cone on the museum floor.;Usha sees the child drop his ice cream cone.;Usha doesn't see the child drop his ice cream cone.;Usha;skull;auto;0
