Eli was in his house, playing with his friendly dog, Spot. Eli wanted to play fetch with Spot upstairs. The ball they were playing with was dry. Eli believed the ball was dry. Spot, excited, jumped into the pool with the ball in his mouth.;Eli sees Spot jump into the pool with the ball.;Eli doesn't see Spot jump into the pool because he was looking at the stairs.;Eli decides to dry the ball before they can play upstairs.;Eli throws the ball upstairs for Spot to fetch.;Does Eli think the ball is dry or wet?;Does Eli want to play fetch upstairs or dry the ball?;What will Eli do next?;Eli believes the ball is wet.;Eli wants to dry the ball.;Eli will dry the ball before they can play upstairs.;Eli believes the ball is dry.;Eli wants to play fetch upstairs.;Eli will throw the ball upstairs for Spot to fetch.;A bird lands on the fence in the yard.;Eli sees the bird land on the fence.;Eli doesn't see the bird because he is focused on Spot.;Eli;The ball they were playing with.;Eli was looking the other way, at the stairs.;auto;0
Ina was playing with her ball in the park. Ina wanted to kick the ball high up in the sky. The ball was under normal pressure. Ina believed the ball was under normal pressure. A naughty boy came and pumped more air into the ball, making it under high pressure.;Ina sees the boy pumping air into the ball.;Ina doesn't see the boy pumping air into the ball as she is tying her shoelaces.;Ina decides to let some air out of the ball to make it under normal pressure again.;Ina gets ready to kick the ball high up in the sky.;Does Ina think the ball is under normal pressure or high pressure?;Does Ina want to kick the ball high up in the sky or to let some air out of the ball?;What will Ina do next?;Ina believes the ball is under high pressure.;Ina wants to let some air out of the ball.;Ina will let some air out of the ball.;Ina believes the ball is under normal pressure.;Ina wants to kick the ball high up in the sky.;Ina will get ready to kick the ball high up in the sky.;A rough wind starts to blow in the park.;Ina feels the rough wind.;Ina doesn't feel the rough wind.;Ina;Ball;Visual obstruction -> Ina was tying her shoelaces and didn't see the boy pumping air into the ball.;auto;0
Yara was in the park, sitting on a bench. Yara wanted to make a small scarf for her doll. The ball of yarn she had was big and soft. Yara believed the ball of yarn was big and soft. A playful dog ran by, grabbed the yarn in its mouth and ran away, leaving only a small piece of yarn behind.;Yara sees the dog running away with the yarn.;Yara doesn't see the dog running away as she is looking at her doll.;Yara decides to chase the dog to get her yarn back.;Yara starts to knit a small scarf for her doll.;Does Yara think the ball of yarn is big and soft or small?;Does Yara want to knit a scarf for her doll or chase the dog to get her yarn back?;What will Yara do next?;Yara believes the ball of yarn is now small.;Yara wants to chase the dog to get her yarn back.;Yara will chase the dog to get her yarn back.;Yara believes the ball of yarn is still big and soft.;Yara wants to knit a small scarf for her doll.;Yara will start knitting a small scarf for her doll.;A squirrel climbs up the tree next to the bench.;Yara sees the squirrel.;Yara doesn't see the squirrel.;Yara;ball of yarn;Lack of sight -> Yara was looking at her doll.;auto;0
Isha was in a busy park, teaching kids how to make paper boats. Isha wanted to make the best yellow paper boat. The straw she was using to demonstrate was straight. Isha believed the straw was straight. A playful dog ran by and stepped on the straw, bending it.;Isha sees the dog stepping on the straw.;Isha does not see the dog stepping on the straw because she is looking at the kids.;Isha decides to find a new straw to demonstrate with.;Isha continues teaching the kids how to fold the paper around the straw.;Does Isha think the straw is straight or bent?;Does Isha want to continue teaching or to find a new straw?;What will Isha do next?;Isha believes the straw is bent.;Isha wants to find a new straw to demonstrate with.;Isha will find a new straw to demonstrate with.;Isha believes the straw is straight.;Isha wants to continue teaching.;Isha will continue teaching the kids how to fold the paper around the straw.;A bird lands on a nearby bench.;Isha sees the bird.;Isha doesn't see the bird.;Isha;The straw;Visual obstruction -> Isha was looking at the kids, not at the straw.;auto;0
Nino was in the park, sitting on a bench. Nino wanted to draw a big playful cat on the sidewalk with his chalk. The chalk was well-maintained and ready to use. Nino believed that the chalk was well-maintained. A group of kids playing nearby accidentally stepped on the chalk, breaking it into small pieces.;Nino sees the kids stepping on his chalk.;Nino doesn't see the kids stepping on his chalk because he is busy replying to a text on his phone.;Nino decides to ask the kids to be more careful next time.;Nino starts drawing a big playful cat on the sidewalk.;Does Nino think the chalk is well-maintained or broken into small pieces?;Does Nino want to start drawing or to ask the kids to be more careful next time?;What will Nino do next?;Nino believes the chalk is broken into small pieces.;Nino wants to ask the kids to be more careful next time.;Nino will ask the kids to be more careful next time.;Nino believes the chalk is well-maintained.;Nino wants to start drawing a big playful cat on the sidewalk.;Nino will start drawing a big playful cat on the sidewalk.;A squirrel runs across the park.;Nino sees the squirrel.;Nino doesn't see the squirrel.;Nino;chalk;Nino was busy replying to a text on his phone.;auto;0
Alfie was in the park with his friends. Alfie wanted to play a funny joke on his friends. The bell at the park was shiny and silver. Alfie believed the bell was shiny and silver. An artist who was painting nearby accidentally splashed some of his red paint on the bell.;Alfie sees the artist splashing paint on the bell.;Alfie doesn't see the artist splashing paint on the bell because he is talking to his friends.;Alfie decides to include the red bell in his joke.;Alfie plans to ring the bell as part of his joke.;Does Alfie think the bell is silver or red?;Does Alfie want to include the red bell in his joke or ring the bell as part of his joke?;What will Alfie do next?;Alfie believes the bell is red.;Alfie wants to include the red bell in his joke.;Alfie will include the red bell in his joke.;Alfie believes the bell is silver.;Alfie wants to ring the bell as part of his joke.;Alfie will ring the bell as part of his joke.;A squirrel runs across the park.;Alfie sees the squirrel.;Alfie doesn't see the squirrel.;Alfie;bell in the park;Line of sight blocked -> Alfie was turned away, talking to his friends.;auto;0
Wally was in the kitchen making a pie. Wally wanted the pie to have a sweet taste. The pie was round and ready to bake. Wally believed the pie was round and ready to bake. A slow, steady heat from the oven caused the pie to puff up and become irregular in shape.;Wally sees the pie puff up in the oven.;Wally does not see the pie puff up in the oven because he is in another room.;Wally decides to take the pie out of the oven and let it cool.;Wally sets the timer for the pie to bake.;Does Wally think the pie is round and ready to bake or has it puffed up and become irregular in shape?;Does Wally want to set the timer for the pie to bake or take the pie out of the oven and let it cool?;What will Wally do next?;Wally believes the pie has puffed up and become irregular in shape.;Wally wants to take the pie out of the oven and let it cool.;Wally will take the pie out of the oven and let it cool.;Wally believes the pie is round and ready to bake.;Wally wants to set the timer for the pie to bake.;Wally will set the timer for the pie to bake.;A cat jumps onto the kitchen counter.;Wally sees the cat jump onto the kitchen counter.;Wally doesn't see the cat jump onto the kitchen counter.;Wally;The pie;Wally was in another room cleaning up the mess he made while preparing the pie.;auto;0
Quinn was sitting in his living room, petting his cat. Quinn wanted his cat's fur to be fresh and clean. The cat's fur was dirty. Quinn believed his cat's fur was dirty. As the day went on, the cat went outside and played in the dirt, making its fur even dirtier.;Quinn sees the cat playing outside in the dirt.;Quinn doesn't see the cat playing outside in the dirt because he is in the kitchen.;Quinn decides to give his cat a bath.;Quinn plans to brush his cat's fur.;Does Quinn believe his cat's fur is dirty or even dirtier?;Does Quinn want to brush his cat's fur or give his cat a bath?;What will Quinn do next?;Quinn believes his cat's fur is even dirtier.;Quinn wants to give his cat a bath.;Quinn will give his cat a bath.;Quinn believes his cat's fur is dirty.;Quinn wants to brush his cat's fur.;Quinn will brush his cat's fur.;A bird flies into the living room through the open window.;Quinn sees the bird.;Quinn doesn't see the bird because he is in the kitchen.;Quinn;Quinn's cat's fur.;Quinn was in the kitchen making lunch and couldn't see the cat playing outside.;auto;0
Carl was in the kitchen making a cup of tea. Carl wanted to have a warm cup of tea to cheer up his sad day. The faucet in the kitchen was working fine. Carl believed the faucet in the kitchen was working fine. The water company had to do some maintenance work and turned off the water supply.;Carl sees the water company truck outside his window.;Carl doesn't see the water company truck as he is focused on the tea bag.;Carl decides to call the water company to ask when the water supply will be back.;Carl turns the faucet on to fill the kettle with water.;Does Carl think the faucet is working or not working?;Does Carl want to make tea or call the water company?;What will Carl do next?;Carl believes the faucet is not working.;Carl wants to call the water company.;Carl will call the water company.;Carl believes the faucet is working.;Carl wants to make tea.;Carl will turn the faucet on to fill the kettle with water.;A bird lands on the window sill and starts chirping.;Carl sees the bird on the window sill.;Carl doesn't see the bird as he is focused on the tea bag.;Carl;The faucet in the kitchen;Lack of sight -> Carl was focused on the tea bag and did not see the water company truck outside.;auto;0
Mako was at the park, playing a game of tag with his friends. Mako wanted to be the fastest and win the game. The swing at the park was moving back and forth. Mako believed the swing was moving back and forth. A competitive older kid came along and pushed the swing, making it stop moving.;Mako sees the older kid push the swing.;Mako doesn't see the older kid push the swing as he is looking at his friends.;Mako decides to confront the older kid for stopping the swing.;Mako plans to use the moving swing to his advantage in the game.;Does Mako think the swing is moving back and forth or has it stopped?;Does Mako want to confront the older kid or use the swing to his advantage?;What will Mako do next?;Mako believes the swing has stopped moving.;Mako wants to confront the older kid for stopping the swing.;Mako will confront the older kid.;Mako believes the swing is moving back and forth.;Mako wants to use the swing to his advantage in the game.;Mako will use the swing to his advantage in the game.;A church bell rings in the distance.;Mako hears the church bell.;Mako doesn't hear the church bell.;Mako;swing at the park;Lack of vision -> Mako was looking at his friends while playing tag.;auto;0
Luka was at the train station waiting for his train. Luka wanted to catch the train to go to his grandma's house. The rail of the train track was in good condition. Luka believed the rail of the train track was in good condition. A little earthquake damaged the rail making it unsafe for trains.;Luka feels the little earthquake.;Luka doesn't feel the little earthquake because he is too engrossed in his book.;Luka decides to take a bus instead.;Luka waits for his train to arrive.;Does Luka think the rail of the train track is in good condition or damaged?;Does Luka want to wait for his train or take a bus instead?;What will Luka do next?;Luka believes the rail of the train track is damaged.;Luka wants to take a bus instead.;Luka will take a bus instead.;Luka believes the rail of the train track is in good condition.;Luka wants to wait for his train.;Luka will wait for his train to arrive.;A bird lands on the bench next to Luka.;Luka sees the bird.;Luka doesn't see the bird.;Luka;Rail of the train track;Lack of perception -> Luka was reading a book.;auto;0
Ken was at a fair, looking at all the fun games and tasty food. Ken wanted to win the pie-eating contest. The apple pie for the contest was not toxic. Ken believed the apple pie was not toxic. A mischievous boy, while Ken was not looking, poured a mildly toxic hot pepper sauce on the pie.;Ken sees the boy pouring the hot pepper sauce on the pie.;Ken doesn't see the boy pouring the hot pepper sauce on the pie because he was looking at the Ferris wheel.;Ken decides not to eat the pie and informs the contest organizers about the boy's actions.;Ken gets ready to eat the pie as fast as he can to win the contest.;Does Ken think the apple pie is not toxic or mildly toxic?;Does Ken want to win the pie-eating contest or to inform the contest organizers about the boy's actions?;What will Ken do next?;Ken believes the apple pie is mildly toxic.;Ken wants to inform the contest organizers about the boy's actions.;Ken will inform the contest organizers about the boy's actions.;Ken believes the apple pie is not toxic.;Ken wants to win the pie-eating contest.;Ken will get ready to eat the pie as fast as he can to win the contest.;A clown starts juggling nearby.;Ken sees the clown juggling.;Ken doesn't see the clown juggling.;Ken;apple pie;Lack of vision -> Ken was looking at the soaring Ferris wheel.;auto;0
Ben was at the park, playing with his friends. Ben wanted to win the treasure hunt game they were playing. There was a box of fake jewelry that was the prize. Ben believed that the box of fake jewelry was still hidden. A dog, out for a walk, started to dig in the sand and scattered the jewelry all over the place.;Ben sees the dog scattering the jewelry.;Ben doesn't see the dog scattering the jewelry as he is looking elsewhere.;Ben decides to gather all the scattered jewelry and put it back in the box.;Ben plans to keep looking for the hidden box of jewelry.;Does Ben think the box of jewelry is still hidden or scattered all over the place?;Does Ben want to keep looking for the hidden box or gather all the scattered jewelry?;What will Ben do next?;Ben believes the jewelry is scattered all over the place.;Ben wants to gather all the scattered jewelry and put it back in the box.;Ben will gather all the scattered jewelry and put it back in the box.;Ben believes the box of jewelry is still hidden.;Ben wants to find the hidden box of jewelry.;Ben will keep looking for the hidden box of jewelry.;A healthy bird lands on a nearby tree.;Ben sees the healthy bird.;Ben doesn't see the healthy bird.;Ben;Box of fake jewelry;Ben was looking in a different direction.;auto;0
Sam was in the kitchen, ready to bake a cake. Sam wanted to bake a cake for his mom's birthday, which was tomorrow. The calendar on the fridge showed today's date. Sam believed that the calendar showed today's date. Over time, the sun's rays faded the ink on the calendar, making the dates hard to read.;Sam noticed the faded dates on the calendar.;Sam didn't notice the faded dates on the calendar.;Sam would examine the calendar closely to confirm the date.;Sam would start baking the cake, eager to surprise his mom.;Does Sam think the calendar shows today's date or is it hard to read?;Does Sam want to confirm the date or start baking the cake?;What will Sam do next?;Sam believes the dates on the calendar are hard to read.;Sam wants to confirm the date.;Sam will examine the calendar closely.;Sam believes the calendar shows today's date.;Sam wants to bake a cake for his mom's birthday.;Sam will start baking the cake.;A squirrel runs across the kitchen window.;Sam sees the squirrel.;Sam doesn't see the squirrel.;Sam;Calendar on the fridge;Sam was focused on baking and didn't look at the calendar again.;auto;0
Remy was at a party, having a fun time. Remy wanted to throw the orange veil he found in the corner to his friend. The orange veil was bright under the party lights. Remy believed the orange veil was bright. As the night went on, someone turned down the party lights, making the orange veil look dim.;Remy sees the party lights being turned down.;Remy doesn't see the party lights being turned down as he was busy talking to his friends.;Remy decides to move closer to a lamp before throwing the veil.;Remy throws the veil to his friend.;Does Remy think the orange veil is bright or dim?;Does Remy want to throw the veil or move closer to a lamp before throwing it?;What will Remy do next?;Remy believes the orange veil is dim.;Remy wants to move closer to a lamp before throwing the veil.;Remy will move closer to a lamp before throwing the veil.;Remy believes the orange veil is bright.;Remy wants to throw the veil.;Remy will throw the veil to his friend.;A dog runs into the party.;Remy sees the dog.;Remy doesn't see the dog.;Remy;orange veil;Remy was busy talking to his friends.;auto;0
Lenny was at the park building a sand castle. Lenny wanted to decorate his sand castle with pretty shells he found. The bucket he was using to carry the shells was full. Lenny believed the bucket was full. A stubborn squirrel came and tipped over the bucket, spilling all the shells out.;Lenny sees the squirrel tipping over his bucket.;Lenny does not see the squirrel tipping over his bucket.;Lenny decides to pick up the shells and put them back in the bucket.;Lenny continues to decorate his sand castle with the shells from the full bucket.;Does Lenny think the bucket is full or empty?;Does Lenny want to continue decorating his sand castle or pick up the shells?;What will Lenny do next?;Lenny believes the bucket is empty.;Lenny wants to pick up the shells and put them back in the bucket.;Lenny will pick up the shells and put them back in the bucket.;Lenny believes the bucket is full.;Lenny wants to continue decorating his sand castle.;Lenny will continue to decorate his sand castle with the shells from the full bucket.;A gust of wind blows some ash from a nearby barbecue into the air.;Lenny sees the ash being blown into the air.;Lenny doesn't see the ash being blown into the air.;Lenny;bucket;Lenny was busy digging in the sand and didn't see the squirrel.;auto;0
Pablo was in the jungle looking for a place to rest. Pablo wanted to find a dependable tree to sit and enjoy his lunch. The big tree near him was strong and sturdy. Pablo believed the tree was strong and sturdy. A group of monkeys started to play on the tree, making it shake and resonate with their movement.;Pablo sees the monkeys playing on the tree.;Pablo doesn't see the monkeys as he is looking at his food.;Pablo decides to move to a different tree to sit.;Pablo prepares to sit under the tree and eat his lunch.;Does Pablo think the tree is strong and sturdy or shaking and resonating?;Does Pablo want to sit under the tree and eat his lunch or move to a different tree?;What will Pablo do next?;Pablo believes the tree is shaking and resonating.;Pablo wants to move to a different tree.;Pablo will move to a different tree to sit.;Pablo believes the tree is strong and sturdy.;Pablo wants to sit under the tree and eat his lunch.;Pablo will sit under the tree and eat his lunch.;A colorful parrot lands on a nearby branch.;Pablo sees the colorful parrot.;Pablo doesn't see the colorful parrot.;Pablo;The big tree near him.;Lack of sight -> Pablo was looking at his food.;auto;0
Quin was at the park with his dog, Spot. Quin wanted to train Spot to fetch a magazine. The magazine was big and heavy. Quin believed the magazine was big and heavy. After a while, the sun dried out the magazine, making it light and brittle.;Quin notices the sun has dried out the magazine.;Quin does not notice the sun has dried out the magazine as he is busy cleaning up after Spot.;Quin decides to find a new magazine for Spot to fetch.;Quin gets ready to throw the big, heavy magazine for Spot to fetch.;Does Quin think the magazine is big and heavy or light and brittle?;Does Quin want to throw the big, heavy magazine for Spot to fetch or find a new magazine?;What will Quin do next?;Quin believes the magazine is light and brittle.;Quin wants to find a new magazine for Spot to fetch.;Quin will find a new magazine for Spot to fetch.;Quin believes the magazine is big and heavy.;Quin wants to throw the big, heavy magazine for Spot to fetch.;Quin will get ready to throw the big, heavy magazine for Spot to fetch.;A bossy squirrel runs across the park.;Quin sees the bossy squirrel.;Quin doesn't see the bossy squirrel.;Quin;magazine;Lack of sight -> Quin was busy cleaning up after Spot and didn't see the magazine drying out.;auto;0
Ina was at the park doing her morning run. Ina wanted to finish her run so she could start her day. The roof of the park's gazebo was clear from leaves. Ina believed the roof of the park's gazebo was clear from leaves. A group of birds flew over the gazebo, dropping leaves as they went.;Ina sees the birds flying over the gazebo.;Ina doesn't see the birds because she is focused on her run.;Ina decides to clear the leaves from the gazebo's roof after her run.;Ina finishes her run and goes home to shower.;Does Ina think the roof of the gazebo is clear or filled with leaves?;Does Ina want to go home and shower or clear the leaves from the gazebo's roof?;What will Ina do next?;Ina believes the roof of the gazebo is filled with leaves.;Ina wants to clear the leaves from the gazebo's roof.;Ina will clear the leaves from the gazebo's roof after her run.;Ina believes the roof of the gazebo is clear.;Ina wants to go home and shower.;Ina will finish her run and go home to shower.;A fit jogger approaches Ina and asks for directions.;Ina hears the jogger and turns to answer him.;Ina doesn't hear the jogger because she is focused on her run.;Ina;The roof of the gazebo;Lack of sight -> Ina was focused on her path, not looking at the gazebo.;auto;0
Yara was at the park playing with her friends. Yara wanted to win the game of marbles they were playing. One marble, a shiny pebble, was very expensive. Yara believed the shiny pebble was very expensive. A naughty dog came along and chewed on the shiny pebble, making it lose its shine and thus its value.;Yara sees the dog chewing on the shiny pebble.;Yara does not see the dog chewing on the shiny pebble because she is focused on her game.;Yara decides to settle for a less expensive pebble.;Yara continues playing hoping to win the expensive pebble.;Does Yara think the shiny pebble is still expensive or has it become less expensive?;Does Yara want to continue playing for the expensive pebble or settle for a less expensive one?;What will Yara do next?;Yara believes the shiny pebble has become less expensive.;Yara wants to settle for a less expensive pebble.;Yara will settle for a less expensive pebble.;Yara believes the shiny pebble is still expensive.;Yara wants to win the expensive pebble.;Yara will continue playing hoping to win the expensive pebble.;A butterfly lands on Yara's shoulder.;Yara sees the butterfly.;Yara doesn't see the butterfly.;Yara;shiny pebble;Yara was focused on her game and didn't see the dog.;auto;0
Umar was at the park with his friends. Umar wants to play ball with his friends. The ball that Umar has is fresh and new. Umar believes the ball is fresh and new. A dog comes along, grabs the ball, and chews it up, making it spoiled.;Umar sees the dog chewing the ball.;Umar doesn't see the dog chewing the ball because he was busy tying his shoelaces.;Umar decides to ask his friends if they have another ball.;Umar throws the ball to start the game.;Does Umar think the ball is fresh and new or spoiled?;Does Umar want to play or ask his friends for another ball?;What will Umar do next?;Umar believes the ball is spoiled.;Umar wants to ask his friends for another ball.;Umar will ask his friends for another ball.;Umar believes the ball is fresh and new.;Umar wants to play.;Umar will throw the ball to start the game.;A loud noise comes from a nearby construction site.;Umar hears the noise.;Umar doesn't hear the noise because he is focused on the game.;Umar;The ball;Lack of sight -> Umar was tying his tight shoelaces.;auto;0
