Tim was in the kitchen, ready to make lunch. Tim wanted to make a big bowl of pasta. The pasta box was full. Tim believed the pasta box was full. While Tim was busy cutting vegetables, his little sister came into the kitchen and took some pasta to play with. Tim sees his sister leaving the kitchen with some pasta in her hand. Tim does not see his sister leaving the kitchen with some pasta in her hand. Tim decides to ask his sister to return the pasta. Tim starts boiling water to cook the pasta. Does Tim think the pasta box is full or not? Does Tim want to cook the pasta or ask his sister to return the pasta? What will Tim do next? Tim believes the pasta box is not full. Tim wants to ask his sister to return the pasta. Tim will ask his sister to return the pasta. Tim believes the pasta box is full. Tim wants to cook the pasta. Tim will start boiling water to cook the pasta. A bird flies into the kitchen through the open window. Tim sees the bird. Tim does not see the bird. Tim pasta box Lack of sight  > Tim was busy cutting vegetables and did not see his sister come into the kitchen. 
Wendy was in the park, sitting on a bench. Wendy wanted to play a charming tune on her small flute. The flute was in her bag. Wendy believed the flute was in her bag. A kind lady saw the flute, thought it had been left behind, and moved it to the lost and found box. Wendy sees the kind lady moving her flute to the lost and found box. Wendy doesn't see the kind lady moving her flute to the lost and found box because she is watching the birds. Wendy decides to go to the lost and found box to get her flute. Wendy reaches into her bag to get her flute. Does Wendy think her flute is in her bag or in the lost and found box? Does Wendy want to play her flute or go to the lost and found box to get her flute? What will Wendy do next? Wendy believes her flute is in the lost and found box. Wendy wants to go to the lost and found box to get her flute. Wendy will go to the lost and found box to get her flute. Wendy believes her flute is in her bag. Wendy wants to play her flute. Wendy will reach into her bag to get her flute. A squirrel runs up a tree nearby. Wendy sees the squirrel. Wendy doesn't see the squirrel. Wendy Wendy flute Lack of sight  > Wendy was looking at the birds in the sky. 
Pete was at the park, ready to eat his lunch. Pete wanted to enjoy his food while watching the birds. The food in Pete lunch box was fresh and yummy. Pete believed his food was fresh and yummy. A naughty squirrel came and took a big bite out of Pete sandwich. Pete sees the squirrel taking a bite out of his sandwich. Pete doesn't see the squirrel taking a bite out of his sandwich because he is watching the birds. Pete decides to squeeze the rest of his sandwich into a ball and throw it to the squirrel. Pete takes a bite of his sandwich, enjoying the fresh taste. Does Pete think his food is fresh and yummy or bitten by a squirrel? Does Pete want to enjoy his food or to give the rest of his food to the squirrel? What will Pete do next? Pete believes his food has been bitten by a squirrel. Pete wants to give the rest of his food to the squirrel. Pete will squeeze the rest of his sandwich into a ball and throw it to the squirrel. Pete believes his food is fresh and yummy. Pete wants to enjoy his food. Pete will take a bite of his sandwich, enjoying the fresh taste. A patient dog sits down next to Pete, watching him. Pete sees the patient dog. Pete doesn't see the patient dog. Pete food in Pete lunch box Lack of sight  > Pete was looking at the birds. 
Sam was in the kitchen making a cake. Sam wanted to wash his hands before he started to bake. The sink in the kitchen was clean. Sam believed the sink was clean. Over time, the sink slowly filled with dirty water from the leaking tap. Sam sees the dirty water in the sink. Sam does not see the dirty water in the sink. Sam decides to clean the sink before washing his hands. Sam goes to wash his hands in the sink. Does Sam think the sink is clean or dirty? Does Sam want to wash his hands or clean the sink? What will Sam do next? Sam believes the sink is dirty. Sam wants to clean the sink. Sam will clean the sink. Sam believes the sink is clean. Sam wants to wash his hands. Sam will wash his hands in the sink. A fair, golden cat walks into the kitchen. Sam sees the golden cat. Sam doesn't see the golden cat. Sam kitchen sink Lack of sight  > Sam was focused on gathering his baking supplies and did not notice the sink filling up. 
Vito was at a park, watching the birds. Vito wanted to sit on the park bench and enjoy his lunch. The bench was dry and clean. Vito believed that the bench was dry and clean. A generous man, who was passing by, spilled his large bottle of water, which made the bench wet. Vito sees the man spilling water on the bench. Vito doesn't see the man spilling water as he is watching the birds. Vito decides to find another bench to sit on. Vito goes to sit on the bench. Does Vito think the bench is dry or wet? Does Vito want to sit on the bench or find another bench to sit on? What will Vito do next? Vito believes the bench is wet. Vito wants to find another bench to sit on. Vito will find another bench to sit on. Vito believes the bench is dry. Vito wants to sit on the bench. Vito will go to sit on the bench. A heart shaped leaf falls from a tree. Vito sees the heart shaped leaf. Vito doesn't see the heart shaped leaf. Vito park bench Lack of sight  > Vito was looking at the birds. 
Tia was at the park playing with her toy cart. Tia wanted to push her cart down the hill and watch it roll. The cart wheels were tight and good for rolling. Tia believed the cart wheels were tight and good for rolling. A dog running by bumped into the cart, causing one wheel to loosen and stop rolling well. Tia sees the dog bump into her cart. Tia doesn't see the dog bump into her cart because she was looking at the flowers. Tia feels anxious and decides to fix the wheel before playing again. Tia excitedly pushes the cart down the hill. Does Tia think the cart wheels are tight and good for rolling or loose and not rolling well? Does Tia want to push the cart down the hill or fix the wheel before playing again? What will Tia do next? Tia believes the cart wheel is loose and not rolling well. Tia wants to fix the wheel before playing again. Tia will fix the wheel before playing again. Tia believes the cart wheels are tight and good for rolling. Tia wants to push the cart down the hill. Tia will push the cart down the hill. A squirrel runs up a nearby tree. Tia sees the squirrel. Tia doesn't see the squirrel. Tia toy cart Lack of sight  > Tia was looking the other way. 
Fred was at the park, playing with his toy van. Fred wanted to make his toy van skip across the pond. The toy van was clean. Fred believed his toy van was clean. A group of intelligent pigeons, looking for food, pecked at the toy van and made it dirty. Fred sees the pigeons pecking at his toy van. Fred doesn't see the pigeons pecking at his toy van because he is looking at the pond. Fred decides to clean his toy van. Fred tries to make his toy van skip across the pond. Does Fred think his toy van is clean or dirty? Does Fred want to make his toy van skip across the pond or to clean his toy van? What will Fred do next? Fred believes his toy van is dirty. Fred wants to clean his toy van. Fred will clean his toy van. Fred believes his toy van is clean. Fred wants to make his toy van skip across the pond. Fred will try to make his toy van skip across the pond. A squirrel runs across the park. Fred sees the squirrel. Fred doesn't see the squirrel. Fred Fred toy van Lack of sight  > Fred was looking at the pond. 
Jack was at the park playing with his cheerful dog, Spot. Jack wanted to win the big Frisbee competition. The Frisbee was in good shape. Jack believed the Frisbee was in good shape. A naughty squirrel found the Frisbee and started to chew on it, making it less secure to throw. Jack saw the squirrel chewing on the Frisbee. Jack didn't see the squirrel chewing on the Frisbee because he was busy scratching an itch on his arm. Jack decided to shoo the squirrel away and find a new Frisbee. Jack planned to practice throwing the Frisbee with Spot. Does Jack think the Frisbee is in good shape or has it been chewed on by a squirrel? Does Jack want to find a new Frisbee or practice throwing with Spot? What is Jack going to do next? Jack believes the Frisbee has been chewed on by a squirrel. Jack wants to find a new Frisbee. Jack will shoo the squirrel away and find a new Frisbee. Jack believes the Frisbee is in good shape. Jack wants to practice throwing with Spot. Jack will practice throwing the Frisbee with Spot. A cheerful bird lands on a nearby tree and starts singing. Jack hears the bird singing. Jack doesn't hear the bird singing because he too focused on the Frisbee. Jack Frisbee Jack was busy scratching an itch on his arm and didn't see the squirrel. 
Ollie was at the park playing with his friends. Ollie wanted to win the game of tag they were playing. The ground was smooth and easy to run on. Ollie believed the ground was smooth and easy to run on. As the day went on, the park workers started to gather rocks and spread them on the ground, making it rough. Ollie sees the workers spreading the rocks. Ollie does not see the workers spreading the rocks because he is focused on the game. Ollie decides to move the game to a different part of the park where the ground is still smooth. Ollie continues to play the game of tag on the smooth ground. Does Ollie think the ground is smooth or rough? Does Ollie want to continue playing the game of tag on the ground or move the game to a different part of the park? What will Ollie do next? Ollie believes the ground is rough. Ollie wants to move the game to a different part of the park. Ollie will move the game to a different part of the park. Ollie believes the ground is smooth. Ollie wants to continue playing the game of tag. Ollie will continue to play the game of tag on the smooth ground. A dog runs through the park, chasing its tail. Ollie sees the dog running through the park. Ollie doesn't see the dog running through the park because he is focused on the game. Ollie The ground at the park Ollie was too focused on the game of tag to notice the workers. 
Jack was at the zoo looking at the reindeer. Jack wanted to touch the reindeer fur. The reindeer fur looked rough. Jack believed the reindeer fur was rough. The zookeeper brushed the reindeer, making its fur smooth. Jack sees the zookeeper brushing the reindeer. Jack doesn't see the zookeeper brushing the reindeer because he is at the snack stand. Jack decides to approach the zookeeper and ask if he can touch the reindeer fur. Jack decides to just look at the reindeer from afar. Does Jack think the reindeer fur is rough or smooth? Does Jack want to touch the reindeer fur or just look at it from afar? What will Jack do next? Jack believes the reindeer fur is smooth. Jack wants to approach the zookeeper and ask if he can touch the reindeer fur. Jack will approach the zookeeper and ask if he can touch the reindeer fur. Jack believes the reindeer fur is rough. Jack wants to just look at the reindeer from afar. Jack will just look at the reindeer from afar. A parrot starts squawking loudly in a nearby tree. Jack hears the parrot squawking. Jack doesn't hear the parrot squawking. Jack Reindeer fur Line of sight blocked  > Jack was buying a snack from a nearby stand. 
Carl was at the park with his friends. Carl wanted to share his big, red lollipop with his friends. The lollipop was clean and shiny. Carl believed the lollipop was clean and shiny. A naughty squirrel ran by and dropped some dirt on the lollipop. Carl sees the squirrel dropping dirt on his lollipop. Carl doesn't see the squirrel dropping dirt on his lollipop because he is looking at his friends. Carl decides to wash the lollipop in the water fountain. Carl hopes to share the lollipop with his friends. Does Carl think the lollipop is clean and shiny or dirty? Does Carl want to share his lollipop with his friends or to clean his lollipop? What will Carl do next? Carl believes the lollipop is dirty. Carl wants to clean his lollipop. Carl will wash the lollipop in the water fountain. Carl believes the lollipop is clean and shiny. Carl wants to share his lollipop with his friends. Carl will share the lollipop with his friends. A helpful dog comes by and starts playing with the children. Carl sees the helpful dog. Carl doesn't see the helpful dog. Carl lollipop Lack of sight  > Carl was looking at his friends. 
Ollie was in the kitchen, ready to make a sandwich. Ollie goal was to create a tall stack of ham and cheese layers for his sandwich. The jar of pickles on the counter was closed. Ollie believed the jar of pickles was closed. A cat jumped onto the counter, knocking the jar and causing the pickles to spill out. Ollie sees the cat knock over the jar. Ollie doesn't see the cat knock over the jar because he is looking in the fridge. Ollie decides to clean up the spilled pickles before continuing to make his sandwich. Ollie continues to stack ham and cheese for his sandwich. Does Ollie believe the jar of pickles is closed or spilled? Does Ollie want to continue making his sandwich or clean up the spilled pickles? What will Ollie do next? Ollie believes the jar of pickles has spilled. Ollie wants to clean up the spilled pickles. Ollie will clean up the spilled pickles. Ollie believes the jar of pickles is closed. Ollie wants to continue making his sandwich. Ollie will continue to stack ham and cheese for his sandwich. The doorbell rings. Ollie hears the doorbell ring. Ollie doesn't hear the doorbell ring. Ollie jar of pickles Ollie was looking in the fridge for more ingredients and didn't see the cat knock over the jar. 
"Max was at a big fair in the town. Max wanted to try his luck at the game of ""lucky king"" to win a big toy. The game ""lucky king"" was open for everyone to play. Max believed the game ""lucky king"" was open. The game ""lucky king"" was closed for a short break after a kid had won the grand prize." "Max sees the game ""lucky king"" being closed." "Max doesn't see the game ""lucky king"" being closed as he was buying cotton candy." Max decides to wait for the game to open again. "Max walks over to play the game ""lucky king""." "Does Max think the game ""lucky king"" is open or closed?" "Does Max want to play the game ""lucky king"" or wait for it to open again?" What will Max do next? "Max believes the game ""lucky king"" is closed." Max wants to wait for the game to open again. Max will wait for the game to open again. "Max believes the game ""lucky king"" is open." "Max wants to play the game ""lucky king""." "Max will walk over to play the game ""lucky king""." A magician starts performing tricks nearby. Max sees the magician performing tricks. "Max doesn't see the magician as he is focused on the game ""lucky king""." Max "game ""lucky king""" Max was too far away to see the game being closed. 
Jay was in the park playing with his chubby dog, Spot. Jay wanted to teach Spot to fetch a stick. The stick on the ground was straight. Jay believed the stick was straight. A group of squirrels ran past and one of them stepped on the stick, bending it in the process. Jay sees the squirrel stepping on the stick. Jay doesn't see the squirrel stepping on the stick because he was focused on Spot. Jay decides to find another straight stick to use. Jay throws the straight stick to a far point in the park for Spot to fetch. Does Jay think the stick is straight or bent? Does Jay want to throw the stick to a far point in the park or to find another straight stick? What will Jay do next? Jay believes the stick is bent. Jay wants to find another straight stick. Jay will find another straight stick. Jay believes the stick is straight. Jay wants to throw the stick to a far point in the park. Jay will throw the stick to a far point in the park for Spot to fetch. A red kite flies over the park. Jay sees the red kite. Jay doesn't see the red kite. Jay The stick. Distracted by Spot  > Jay was focused on Spot and didn't notice the squirrels. 
Harry was at the park playing with his toy cars. Harry wants to have fun playing with his toy cars in the sand. The toy cars were in a neat line. Harry believes the toy cars were in a neat line. A dog runs over the sand and makes the toy cars messy. Harry sees the dog running over his toy cars. Harry doesn't see the dog running over his toy cars because he was looking at the sky. Harry decides to pick up his toy cars and put them back in a neat line. Harry continues to play with his toy cars in the sand. Does Harry think his toy cars are in a neat line or messy? Does Harry want to continue playing or to pick up his toy cars and put them back in a neat line? What will Harry do next? Harry believes his toy cars are messy. Harry wants to pick up his toy cars and put them back in a neat line. Harry will pick up his toy cars and put them back in a neat line. Harry believes his toy cars are in a neat line. Harry wants to continue playing with his toy cars in the sand. Harry will continue to play with his toy cars in the sand. A bird lands on a nearby tree branch. Harry sees the bird. Harry doesn't see the bird. Harry Harry toy cars. Lack of sight  > Harry was looking at the sky. 
Sam was in the park on a sunny day. Sam wanted to find a big, warm acorn to take home. The acorn was on the ground, not moving. Sam believed the acorn was on the ground, not moving. A squirrel ran by, picked up the acorn and ran away with it. Sam sees the squirrel taking the acorn. Sam doesn't see the squirrel taking the acorn as he is looking at the flowers. Sam decides to look for another acorn. Sam reaches out to pick up the acorn. Does Sam think the acorn is on the ground or has been taken by the squirrel? Does Sam want to pick up the acorn or look for another one? What will Sam do next? Sam believes the acorn has been taken by the squirrel. Sam wants to look for another acorn. Sam will look for another acorn. Sam believes the acorn is on the ground. Sam wants to pick up the acorn. Sam will reach out to pick up the acorn. A gentle breeze blows through the park. Sam feels the breeze. Sam doesn't feel the breeze. Sam acorn Lack of sight  > Sam was looking at the flowers. 
Zara was at the park playing with her new toy car. Zara wanted to make the toy car slide down the big hill. The toy car was inside a box. Zara believed the toy car was inside the box. A bald man opened the box and took the toy car out to play with his son. Zara sees the bald man taking her toy car out of the box. Zara doesn't see the bald man taking her toy car out of the box because she is looking at the hill. Zara decides to ask the bald man to give her toy car back. Zara is going to take the toy car out of the box and make it slide down the hill. Does Zara think the toy car is in the box or with the bald man? Does Zara want to make the toy car slide down the hill or to ask the bald man to give her toy car back? What will Zara do next? Zara believes the toy car is with the bald man. Zara wants to ask the bald man to give her toy car back. Zara will ask the bald man to give her toy car back. Zara believes the toy car is inside the box. Zara wants to make the toy car slide down the hill. Zara will take the toy car out of the box and make it slide down the hill. A squirrel runs across the park. Zara sees the squirrel. Zara doesn't see the squirrel. Zara toy car Zara was looking at the big hill and didn't see the man open the box. 
Jay was at school, sitting in his chair. Jay wanted to be a useful pupil and answer the teacher question. The chair he was sitting on was strong. Jay believed the chair was strong. Over time, one of the chair legs started to wobble and it became weak. Jay feels the chair wobble. Jay does not feel the chair wobble as he is sitting still. Jay decides to carefully step off the chair and tell the teacher. Jay raises his hand to answer the teacher question. Does Jay think the chair is strong or weak? Does Jay want to answer the teacher question or tell the teacher about the chair? What will Jay do next? Jay believes the chair is weak. Jay wants to tell the teacher about the chair. Jay will carefully step off the chair and tell the teacher. Jay believes the chair is strong. Jay wants to answer the teacher question. Jay will raise his hand to answer the teacher question. A bird flies into the classroom through the open window. Jay sees the bird. Jay doesn't see the bird. Jay chair Jay is sitting on Lack of touch  > Jay was not moving in his chair. 
Timmy was in the park playing with his friends. Timmy wanted to stay and play until the sun went down. The bee hive in the tree nearby was quiet. Timmy believed the bee hive was quiet. A chubby squirrel climbed the tree and shook the hive causing the bees to become active. Timmy sees the squirrel shaking the hive. Timmy doesn't see the squirrel shaking the hive as he is focused on his game. Timmy decides to lead his friends away from the active hive. Timmy continues to play with his friends. Does Timmy think the bee hive is quiet or active? Does Timmy want to continue playing or lead his friends away from the active hive? What will Timmy do next? Timmy believes the bee hive is active. Timmy wants to lead his friends away from the active hive. Timmy will lead his friends away from the active hive. Timmy believes the bee hive is quiet. Timmy wants to continue playing. Timmy will continue to play with his friends. A rainbow appears in the sky. Timmy sees the rainbow. Timmy doesn't see the rainbow. Timmy bee hive Lack of sight  > Timmy was focused on his game. 
Billy was at the park with his friends. Billy wanted to play catch with his friends. The juice box that Billy had brought was full. Billy believed his juice box was full. A clumsy dog ran into the juice box, causing it to spill. Billy hears the sound of the juice box being knocked over. Billy doesn't hear the sound of the juice box being knocked over because he is too focused on the game. Billy decides to shrug it off and continue playing. Billy decides to take a break and drink from his juice box. Does Billy think his juice box is full or spilled? Does Billy want to continue playing or take a break and drink from his juice box? What will Billy do next? Billy believes his juice box is spilled. Billy wants to continue playing. Billy will shrug it off and continue playing. Billy believes his juice box is full. Billy wants to take a break and drink from his juice box. Billy will decide to take a break and drink from his juice box. A squirrel runs across the field. Billy sees the squirrel. Billy doesn't see the squirrel. Billy juice box. Billy was focused on the game and didn't see the dog. 
Nemo was at the park having a picnic. Nemo wanted to eat his cold sandwich that was on the shelf in his picnic basket. The lid of the picnic basket was securely fastened. Nemo believed the lid of the picnic basket was securely fastened. A squirrel managed to open the picnic basket and spread all the food around. Nemo sees the squirrel spreading the food around. Nemo doesn't see the squirrel spreading the food around because he is playing. Nemo decides to gather the food and put it back into the basket. Nemo walks over to the picnic basket to eat his cold sandwich. Does Nemo think the lid of the picnic basket is securely fastened or loose? Does Nemo want to eat his cold sandwich or gather the food and put it back into the basket? What will Nemo do next? Nemo believes the lid of the picnic basket is loose. Nemo wants to gather the food and put it back into the basket. Nemo will gather the food and put it back into the basket. Nemo believes the lid of the picnic basket is securely fastened. Nemo wants to eat his cold sandwich. Nemo will walk over to the picnic basket to eat his cold sandwich. A rainbow appears in the sky. Nemo sees the rainbow. Nemo doesn't see the rainbow. Nemo The lid of the picnic basket. Nemo was busy playing with his friends and was not near the picnic basket. 
Toby was at the park with his obedient pet dog, Max. Toby wanted to play fetch with Max. Max ball was clean and had no smell. Toby believed Max ball was clean and had no smell. An ice cream vendor, passing by, accidentally spilled some ice cream on Max ball making it smell sweet. Toby sees the ice cream vendor spill ice cream on Max ball. Toby doesn't see the ice cream vendor spill ice cream on Max ball because he is looking for a stick to throw for Max. Toby decides to wash Max ball before playing fetch. Toby throws the ball for Max to fetch. Does Toby think Max ball is clean and has no smell or does it smell sweet? Does Toby want to play fetch with Max or wash Max ball? What will Toby do next? Toby believes Max ball smells sweet. Toby wants to wash Max ball before playing fetch. Toby will wash Max ball. Toby believes Max ball is clean and has no smell. Toby wants to play fetch with Max. Toby will throw the ball for Max to fetch. A squirrel runs across the park. Toby sees the squirrel. Toby doesn't see the squirrel. Toby Max ball Distance  > Toby was too far away to smell the change. 
