Jack is in the kitchen in his house. Jack wants a cold drink from the refrigerator. The refrigerator is full of fresh food. Jack thinks the refrigerator is full of fresh food. Suddenly, a power cut changes the state of the food in the refrigerator to spoiled.;Jack notices the power cut.;Jack doesn't notice the power cut.;Jack decides to throw away the spoiled food.;Jack opens the refrigerator to get a cold drink.;Does Jack think the food in the refrigerator is fresh or spoiled?;Does Jack want to get a cold drink or to throw away the spoiled food?;What will Jack do?;Jack thinks the food in the refrigerator is spoiled.;Jack wants to throw away the spoiled food.;Jack will throw away the spoiled food.;Jack thinks the food in the refrigerator is fresh.;Jack wants to get a cold drink.;Jack will open the refrigerator to get a cold drink.;A bird flies into the kitchen through the open window.;Jack sees the bird fly into the kitchen.;Jack doesn't see the bird fly into the kitchen.;Jack;refrigerator;auto;0
Caden is in his new house. Caden wants to fix all the things that are not right. There is a big leak in the roof. Caden thinks there is a big leak in the roof. Suddenly, the sun comes out and dries up the leak.;Caden sees the sun dry up the leak.;Caden doesn't see the sun dry up the leak.;Caden decides to go out and play.;Caden plans to call a man to fix the leak.;Does Caden think there is a leak in the roof or has the sun dried it up?;Does Caden want to fix the leak or to go out and play?;What will Caden do?;Caden thinks the sun has dried up the leak.;Caden wants to go out and play.;Caden will go out and play.;Caden thinks there is still a leak in the roof.;Caden wants to fix the leak.;Caden will call a man to fix the leak.;A bird lands on the roof.;Caden sees the bird land on the roof.;Caden doesn't see the bird land on the roof.;Caden;leak;auto;0
Vivi is in her room playing with her toys. Vivi wants to lay her small, patient triangle toy on the shelf with her other toys. The triangle toy is in her toy box. Vivi believes the triangle toy is in her toy box. Suddenly, her baby brother crawls into the room and takes the triangle toy.;Vivi sees her baby brother take the triangle toy.;Vivi doesn't see her baby brother take the triangle toy.;Vivi goes to find another triangle toy.;Vivi lays the triangle toy on the shelf.;Does Vivi believe the triangle toy is in her toy box or that her baby brother has taken it?;Does Vivi want to lay the triangle toy on the shelf or find another triangle toy?;What will Vivi do?;Vivi believes her baby brother has taken the triangle toy.;Vivi wants to find another triangle toy.;Vivi will go to find another triangle toy.;Vivi believes the triangle toy is in her toy box.;Vivi wants to lay the triangle toy on the shelf.;Vivi will lay the triangle toy on the shelf.;A bird flies into the room through the open window.;Vivi sees the bird fly into the room.;Vivi doesn't see the bird fly into the room.;Vivi;triangle toy;auto;0
Emma is in her room after a long day at school. Emma wants to draw on her white bathrobe to make it look creative. The bathrobe is plain and white. Emma believes the bathrobe is plain and white. Suddenly, a spill from a bottle of bleach changes the bathrobe from white to a patchy white and yellow.;Emma sees the bleach spill.;Emma doesn't see the bleach spill.;Emma decides to dye the whole bathrobe yellow.;Emma plans to start drawing on her bathrobe.;Does Emma think the bathrobe is plain white or patchy white and yellow?;Does Emma want to draw on her bathrobe or dye it yellow?;What will Emma do?;Emma thinks the bathrobe is patchy white and yellow.;Emma wants to dye the whole bathrobe yellow.;Emma will dye the whole bathrobe yellow.;Emma thinks the bathrobe is plain white.;Emma wants to draw on her bathrobe.;Emma will start drawing on her bathrobe.;A cat walks into Emma's room.;Emma sees the cat walk into her room.;Emma doesn't see the cat walk into her room.;Emma;bathrobe;auto;0
Ollie is at the beach building a sand castle. Ollie wants to dig a deep hole with his spade. The spade is sharp and safe to use. Ollie thinks the spade is sharp and safe to use. All of a sudden, a wave from the sea splashes on the spade making it slippery and dangerous.;Ollie sees the wave splash on the spade.;Ollie doesn't see the wave splash on the spade.;Ollie decides to dry the spade before using it again.;Ollie continues to dig the hole with the spade.;Does Ollie think the spade is safe or dangerous?;Does Ollie want to dig a hole or dry the spade?;What will Ollie do?;Ollie thinks the spade is dangerous.;Ollie wants to dry the spade.;Ollie will dry the spade before using it again.;Ollie thinks the spade is safe.;Ollie wants to dig a hole.;Ollie will continue to dig the hole with the spade.;A seagull lands near Ollie's sand castle.;Ollie sees the seagull land near his sand castle.;Ollie doesn't see the seagull land near his sand castle.;Ollie;spade;auto;0
Ben is at the train station. Ben wants to catch the train to go to work. The train is on time. Ben believes the train is on time. Suddenly, a signal fault delays the train and makes it late.;Ben sees the signal fault.;Ben does not see the signal fault.;Ben decides to call his boss and inform him about the delay.;Ben plans to get on the train and start working on his case.;Does Ben think the train is on time or late?;Does Ben want to get on the train and start working on his case or call his boss?;What will Ben do?;Ben believes the train is late.;Ben wants to call his boss and inform him about the delay.;Ben will call his boss and inform him about the delay.;Ben believes the train is on time.;Ben wants to get on the train and start working on his case.;Ben will get on the train and start working on his case.;A crazy dog runs across the train tracks.;Ben sees the crazy dog run across the tracks.;Ben doesn't see the crazy dog run across the tracks.;Ben;train;auto;0
Pia is at her school library. Pia wants to read a mystery book. The mystery book is on the top shelf. Pia thinks the mystery book is on the top shelf. Suddenly, a tall boy moves the mystery book to the bottom shelf.;Pia sees the tall boy move the book.;Pia doesn't see the tall boy move the book.;Pia decides to look at the bottom shelf.;Pia plans to ask for help to reach the top shelf.;Does Pia think the mystery book is on the top shelf or the bottom shelf?;Does Pia want to ask for help to reach the top shelf or look at the bottom shelf?;What will Pia do?;Pia thinks the mystery book is on the bottom shelf.;Pia wants to look at the bottom shelf.;Pia will look at the bottom shelf.;Pia thinks the mystery book is on the top shelf.;Pia wants to ask for help to reach the top shelf.;Pia will ask for help to reach the top shelf.;A cat sneaks into the library.;Pia sees the cat sneak into the library.;Pia doesn't see the cat sneak into the library.;Pia;mystery book;auto;0
Chloe is at a fair in her town. Chloe wants to hug the fireman at the fair. The fireman is very friendly. Chloe thinks the fireman is very friendly. Suddenly, a loud noise scares the fireman and he becomes very scared.;Chloe hears the loud noise.;Chloe doesn't hear the loud noise.;Chloe decides to comfort the scared fireman.;Chloe walks up to the fireman to give him a hug.;Does Chloe think the fireman is friendly or scared?;Does Chloe want to hug the fireman or comfort him?;What will Chloe do?;Chloe thinks the fireman is scared.;Chloe wants to comfort the scared fireman.;Chloe will comfort the scared fireman.;Chloe thinks the fireman is friendly.;Chloe wants to hug the fireman.;Chloe will walk up to the fireman to give him a hug.;A clown starts making balloon animals at the fair.;Chloe sees the clown making balloon animals.;Chloe doesn't see the clown making balloon animals.;Chloe;Fireman;auto;0
Wendy is at a yard sale in her town. Wendy wants to buy a beautiful bracelet she saw. The bracelet is shiny and cheap. Wendy believes the bracelet is shiny and cheap. Suddenly, a famous collector recognizes the bracelet and its value increases to an expensive price.;Wendy hears the famous collector talking about the bracelet.;Wendy does not hear the famous collector talking about the bracelet.;Wendy decides to leave the bracelet.;Wendy plans to buy the bracelet.;Does Wendy think the bracelet is cheap or expensive?;Does Wendy want to buy the bracelet or leave it?;What will Wendy do?;Wendy thinks the bracelet is expensive.;Wendy wants to leave the bracelet.;Wendy will leave the bracelet.;Wendy thinks the bracelet is cheap.;Wendy wants to buy the bracelet.;Wendy will buy the bracelet.;A dog runs through the yard sale, knocking over a table.;Wendy sees the dog run through the yard sale.;Wendy does not see the dog run through the yard sale.;Wendy;bracelet;auto;0
Yara is in her room with her favorite teddy bear, Stitch. Yara wants to hide Stitch so her little brother cannot find him. Stitch smells like yummy vanilla because Yara sprayed him with her vanilla perfume. Yara believes Stitch smells like yummy vanilla. Suddenly, a spilt bottle of vinegar changes the scent of Stitch to sour.;Yara perceives the vinegar spill.;Yara does not perceive the vinegar spill.;Yara decides to wash Stitch to remove the sour smell.;Yara hides Stitch under her bed.;Does Yara believe Stitch smells like yummy vanilla or sour vinegar?;Does Yara want to hide Stitch or wash him?;What will Yara do?;Yara believes Stitch smells like sour vinegar.;Yara wants to wash Stitch.;Yara will wash Stitch.;Yara believes Stitch smells like yummy vanilla.;Yara wants to hide Stitch.;Yara will hide Stitch under her bed.;A cat enters the room through the open door.;Yara sees the cat enter the room.;Yara does not see the cat enter the room.;Yara;Stitch (teddy bear);auto;0
Nia is in her home, ready to bake a cake. Nia wants to bake a cake in the oven. The oven is in good working order. Nia believes the oven is in good working order. Suddenly, a small earthquake shakes the house and the oven breaks.;Nia realizes the oven is broken.;Nia does not realize the oven is broken.;Nia decides to call a repairman to fix the oven.;Nia begins to mix the ingredients for the cake.;Does Nia think the oven is in good working order or broken?;Does Nia want to bake a cake or call a repairman?;What will Nia do?;Nia believes the oven is broken.;Nia wants to call a repairman to fix the oven.;Nia will call a repairman to fix the oven.;Nia believes the oven is in good working order.;Nia wants to bake a cake.;Nia will begin to mix the ingredients for the cake.;A cat walks into the kitchen.;Nia sees the cat walk into the kitchen.;Nia does not see the cat walk into the kitchen.;Nia;Oven;auto;0
Amy is walking in the park. Amy wants to sit on a bench and rest. The bench is covered with pretty vines. Amy believes the bench is covered with pretty vines. Suddenly, a gardener sprays the vines with a substance that changes them from non-harmful to harmful.;Amy sees the gardener spraying the vines.;Amy does not see the gardener spraying the vines.;Amy plans to find another bench to sit on.;Amy moves towards the bench to sit down.;Does Amy believe the bench is safe or not safe?;Does Amy want to sit on the bench or find another one?;What will Amy do next?;Amy believes the bench is not safe.;Amy wants to find another bench to sit on.;Amy will look for another bench.;Amy believes the bench is safe.;Amy wants to sit on the bench.;Amy will move towards the bench to sit down.;A squirrel runs across the path in front of Amy.;Amy sees the squirrel running across the path.;Amy doesn't see the squirrel running across the path.;Amy;Bench;auto;0
Kate is in the park with her old toy car. Kate wants to drive the toy car on the clean cloth she brought. The cloth is clean and spread on the grass. Kate believes the cloth is clean and ready for her toy car. Suddenly, a dog runs across the park and makes the cloth dirty with its muddy paws.;Kate sees the dog spread mud across the cloth.;Kate does not see the dog run across the cloth.;Kate decides to wash the dirty cloth.;Kate starts to drive the toy car on the cloth.;Does Kate think the cloth is clean or dirty?;Does Kate want to drive the toy car or wash the dirty cloth?;What will Kate do next?;Kate believes the cloth is dirty.;Kate wants to wash the dirty cloth.;Kate will wash the dirty cloth.;Kate believes the cloth is clean.;Kate wants to drive the toy car.;Kate will start to drive the toy car on the cloth.;A butterfly lands on Kate's toy car.;Kate sees the butterfly land on her toy car.;Kate doesn't see the butterfly land on her toy car.;Kate;cloth;auto;0
Ella is at the park with her parent. Ella wants to complete her ice cream before it melts. The ice cream has a sweet taste. Ella believes her ice cream has a sweet taste. Suddenly, a gust of wind blows some sand onto the ice cream, changing its taste to gritty.;Ella notices that the sand got into her ice cream.;Ella doesn't notice the sand in her ice cream.;Ella decides to throw away the gritty ice cream.;Ella continues to eat her sweet ice cream.;Does Ella think her ice cream is sweet or gritty?;Does Ella want to finish her sweet ice cream or throw away the gritty ice cream?;What will Ella do?;Ella thinks her ice cream is gritty.;Ella wants to throw away the gritty ice cream.;Ella will throw away the gritty ice cream.;Ella thinks her ice cream is sweet.;Ella wants to complete her sweet ice cream.;Ella will continue to eat her sweet ice cream.;A light rain begins to fall.;Ella feels the light rain.;Ella doesn't feel the light rain.;Ella;Ice cream;auto;0
Uma is in her room with a big clock on the wall. Uma wants to move the clock to another room. The clock is brown. Uma believes the clock is brown. Suddenly, a splash of paint from a passing parade changes the color of the clock to rainbow.;Uma sees the splash of paint.;Uma doesn't see the splash of paint.;Uma decides to clean the clock.;Uma plans to lift the clock and move it to another room.;Does Uma think the clock is brown or rainbow?;Does Uma want to move the clock or to clean it?;What will Uma do?;Uma believes the clock is rainbow.;Uma wants to clean the clock.;Uma will clean the clock.;Uma believes the clock is brown.;Uma wants to move the clock.;Uma will lift the clock and move it to another room.;A cat enters the room and starts playing with a ball of yarn.;Uma sees the cat playing.;Uma doesn't see the cat playing.;Uma;Clock;auto;0
Fred was at the park with his friends. Fred wanted to play a beautiful song on his trumpet for his friends. The trumpet was in his bag. Fred believed the trumpet was in his bag. Suddenly, a gust of wind blew leaves over the bag, hiding the trumpet from sight.;Fred saw the wind blow the leaves.;Fred did not see the wind blow the leaves.;Fred decided to look for his bag.;Fred was going to take out his trumpet and play a song.;Does Fred think his trumpet is in his bag or hidden from view?;Does Fred want to play a song on his trumpet or to look for his bag?;What will Fred do next?;Fred believed his trumpet was hidden from view.;Fred wanted to look for his bag.;Fred will look for his bag.;Fred believed his trumpet was in his bag.;Fred wanted to play a song on his trumpet.;Fred will take out his trumpet and play a song.;A dog started chasing its tail near Fred.;Fred saw the dog chasing its tail.;Fred did not see the dog chasing its tail.;Fred;trumpet;auto;0
Amy was in her room playing with her toy angel. Amy wanted to make the angel fly in the air. The angel's wings were open wide. Amy believed the angel's wings were open wide. Suddenly, a gust of wind struck and the angel's wings closed.;Amy saw the gust of wind.;Amy didn't see the gust of wind.;Amy decides to open the angel's wings again.;Amy throws the angel in the air to make it fly.;Does Amy believe the angel's wings are open or closed?;Does Amy want to make the angel fly or to open the angel's wings?;What will Amy do?;Amy believes the angel's wings are closed.;Amy wants to open the angel's wings.;Amy will open the angel's wings.;Amy believes the angel's wings are open.;Amy wants to make the angel fly.;Amy will throw the angel in the air to make it fly.;A butterfly enters the room.;Amy sees the butterfly.;Amy doesn't see the butterfly.;Amy;Angel;auto;0
Sally is inside her house, thinking about the garden outside. Sally wants to plant flowers in the earth. The earth is dry and warm. Sally believes the earth is dry and warm. Suddenly, while Sally is still inside, a heavy rain cools the earth.;Sally notices the rain.;Sally doesn't notice the rain.;Sally decides to wait for the earth to dry before planting.;Sally starts to plant the flowers in the earth.;Does Sally think the earth is dry and warm or cool and wet?;Does Sally want to plant the flowers or wait for the earth to dry?;What will Sally do?;Sally believes the earth is cool and wet.;Sally wants to wait for the earth to dry.;Sally will wait for the earth to dry.;Sally believes the earth is dry and warm.;Sally wants to plant the flowers.;Sally will start to plant the flowers.;A butterfly lands on a nearby flower.;Sally sees the butterfly.;Sally doesn't see the butterfly.;Sally;Earth;auto;0
Dora is at the farm with her dad. Dora wants to ride the big, hairy horse. The horse is standing in the field. Dora believes the horse is standing in the field. Suddenly, a loud noise from a passing truck scares the horse and it lies down on the grass.;Dora hears the loud noise.;Dora does not hear the loud noise.;Dora decides to wait until the horse stands back up.;Dora walks towards the horse to ride it.;Does Dora think the horse is standing or lying down in the field?;Does Dora want to ride the horse or wait until it stands back up?;What will Dora do?;Dora thinks the horse is scared and lying down in the field.;Dora wants to wait until the horse stands back up.;Dora will wait until the horse stands back up.;Dora thinks the horse is standing in the field.;Dora wants to ride the horse.;Dora will walk towards the horse to ride it.;A butterfly lands on Dora's hand.;Dora sees the butterfly land on her hand.;Dora doesn't see the butterfly land on her hand.;Dora;horse;auto;0
Ben was at the park playing with his dog. Ben wanted to make his dog's hair look nice by brushing it. The dog's hair was very safe to touch. Ben believed the dog's hair was safe to touch. Suddenly, a bee stung the dog making its hair dangerous to touch due to the dog's allergic reaction.;Ben sees the bee sting his dog.;Ben doesn't see the bee sting his dog.;Ben decides to take his dog to the vet.;Ben continues to brush his dog's hair.;Does Ben believe the dog's hair is safe or dangerous to touch?;Does Ben want to brush his dog's hair or take his dog to the vet?;What will Ben do?;Ben believes the dog's hair is dangerous to touch.;Ben wants to take his dog to the vet.;Ben will take his dog to the vet.;Ben believes the dog's hair is safe to touch.;Ben wants to brush his dog's hair.;Ben will continue to brush his dog's hair.;A squirrel runs past Ben and his dog.;Ben sees the squirrel run past.;Ben doesn't see the squirrel run past.;Ben;Dog's hair;auto;0
Lila was in an ancient city. Lila wanted to walk on the ancient road. The road was full of old stones. Lila believed the road was full of old stones. Suddenly, an earthquake shook the ground, causing the stones of the road to be cracked and destroyed.;Lila felt the earthquake.;Lila didn't feel the earthquake.;Lila decided to find another way.;Lila planned to walk on the ancient road.;Does Lila think the road is full of old stones or destroyed?;Does Lila want to walk on the ancient road or find another way?;What will Lila do?;Lila believes the road is destroyed.;Lila wants to find another way.;Lila will find another way.;Lila believes the road is full of old stones.;Lila wants to walk on the ancient road.;Lila will walk on the ancient road.;A cat crossed her path.;Lila saw the cat crossing her path.;Lila didn't see the cat crossing her path.;Lila;road;auto;0
Quinn was at the park on a sunny day. Quinn wanted to unite his friends for a fun event. Their picnic basket was full of food. Quinn believed the picnic basket was full of food. Suddenly, a sneaky raccoon emptied the picnic basket while no one was looking.;Quinn sees the sneaky raccoon.;Quinn does not see the sneaky raccoon.;Quinn decides to buy more food for the event.;Quinn plans to start the event with the food in the picnic basket.;Does Quinn believe the picnic basket is full or empty?;Does Quinn want to start the event or buy more food?;What will Quinn do?;Quinn believes the picnic basket is empty.;Quinn wants to buy more food for the event.;Quinn will buy more food for the event.;Quinn believes the picnic basket is full.;Quinn wants to start the event.;Quinn will start the event with the food in the picnic basket.;A butterfly lands on Quinn's shoulder.;Quinn sees the butterfly land on his shoulder.;Quinn does not see the butterfly land on his shoulder.;Quinn;picnic basket;auto;0
Harry was at the park with his little red wagon. Harry wanted to ride his wagon down the big hill. The wagon was safe and sturdy. Harry believed his wagon was safe and sturdy. All of a sudden, a loose wheel made the wagon very dangerous.;Harry saw the loose wheel.;Harry didn't see the loose wheel.;Harry decided to fix the wheel before riding.;Harry planned to ride his wagon down the hill.;Does Harry think his wagon is safe or dangerous?;Does Harry want to ride his wagon down the hill or fix the wheel?;What will Harry do?;Harry thinks his wagon is dangerous.;Harry wants to fix the wheel.;Harry will fix the wheel.;Harry thinks his wagon is safe.;Harry wants to ride his wagon down the hill.;Harry will ride his wagon down the hill.;A butterfly lands on the handle of the wagon.;Harry sees the butterfly.;Harry doesn't see the butterfly.;Harry;Wagon;auto;0
Omar was on a beach during the day. Omar wanted to find a special shell hidden under the palm trees. The shells were hidden under the sand. Omar believed the shells were hidden under the sand. Suddenly, a playful dog ran over and scattered the sand, making the shells visible.;Omar saw the dog scatter the sand.;Omar didn't see the dog scatter the sand.;Omar decides to pick up the now visible shells.;Omar plans to dig under the palm trees to find the shells.;Does Omar think the shells are hidden under the sand or visible on top of the sand?;Does Omar want to dig under the palm trees or pick up the now visible shells?;What will Omar do next?;Omar believes the shells are now visible on top of the sand.;Omar wants to pick up the now visible shells.;Omar will pick up the now visible shells.;Omar believes the shells are still hidden under the sand.;Omar wants to dig under the palm trees to find the shells.;Omar will start digging under the palm trees to find the shells.;A scared crab quickly runs across the beach.;Omar sees the scared crab running across the beach.;Omar doesn't see the scared crab running across the beach.;Omar;shells under the sand.;auto;0
Quentin was at the farm with all the animals. Quentin wanted to feed the goat. The goat was in the organized pen. Quentin believed the goat was in the organized pen. Suddenly, a group of kids playing nearby left the gate open, allowing the goat to wander into a hot, sunny area.;Quentin sees the kids leave the gate open.;Quentin does not see the kids leaving the gate open.;Quentin plans to move the goat back to the cooler, organized pen.;Quentin reaches for the goat food to feed the goat.;Does Quentin think the goat is in the organized pen or in the hot, sunny area?;Does Quentin want to feed the goat or to move the goat back to the cooler, organized pen?;What will Quentin do?;Quentin believes the goat is in the hot, sunny area.;Quentin wants to move the goat back to the cooler, organized pen.;Quentin will move the goat back to the cooler, organized pen.;Quentin believes the goat is in the organized pen.;Quentin wants to feed the goat.;Quentin will reach for the goat food to feed the goat.;A loud truck passes by the farm.;Quentin hears the loud truck passing by.;Quentin does not hear the loud truck passing by.;Quentin;Goat;auto;0
Nia was in the attic of her old house. Nia wanted to find her old toy car in the attic. The toy car was charged. Nia believed that the toy car was charged. Suddenly, a mouse chewed the wires of the toy car and it became discharged.;Nia saw the mouse.;Nia did not see the mouse.;Nia decides to fix the toy car.;Nia plans to play with the toy car.;Does Nia think the toy car is charged or discharged?;Does Nia want to play with the toy car or fix the toy car?;What will Nia do?;Nia thinks the toy car is discharged.;Nia wants to fix the toy car.;Nia will fix the toy car.;Nia thinks the toy car is charged.;Nia wants to play with the toy car.;Nia will play with the toy car.;A bird lands on the attic window sill.;Nia sees the bird land on the window sill.;Nia does not see the bird land on the window sill.;Nia;Toy car;auto;0
