Yara was at the park playing with her friends. Yara wanted to win the game of hide and seek they were playing. Yara's dad, with his clean mustache, was sitting on a bench watching them play. Yara believed her dad, with his clean mustache, was sitting on a bench watching them play. A bird flew by and dropped a feather on her dad's mustache, making it look messy.;Yara turns around and sees the feather on her dad's mustache.;Yara keeps counting and doesn't see the feather on her dad's mustache.;Yara decides to stop the game and go clean her dad's mustache.;Yara finishes counting and starts seeking her friends.;Does Yara think her dad's mustache is clean or messy?;Does Yara want to continue playing hide and seek or clean her dad's mustache?;What will Yara do next?;Yara believes her dad's mustache is messy.;Yara wants to clean her dad's mustache.;Yara will stop the game and go clean her dad's mustache.;Yara believes her dad's mustache is clean.;Yara wants to win the game of hide and seek.;Yara will finish counting and start seeking her friends.;A strong wind blows and makes the leaves swirl around.;Yara feels the wind and sees the leaves swirling.;Yara doesn't feel the wind or see the leaves because she is focused on counting.;Yara;Yara's dad's mustache;Yara's back was turned to her dad because she was counting for the game of hide and seek.;auto;0
Kip was in the park playing a tough game of chess. Kip wanted to win to feel the taste of victory. The chess clock was ticking loudly. Kip believed the chess clock was ticking loudly. A park worker came and replaced the loud chess clock with a silent one for a noise test.;Kip sees the park worker replace the chess clock.;Kip is too focused on his chess game to notice the park worker replace the chess clock.;Kip decides to ask the park worker why the chess clock was replaced.;Kip continues to focus on his chess game to win.;Does Kip believe the chess clock is ticking loudly or is silent?;Does Kip want to continue his chess game to win or to ask the park worker why the chess clock was replaced?;What will Kip do next?;Kip believes the chess clock is silent.;Kip wants to ask the park worker why the chess clock was replaced.;Kip will ask the park worker why the chess clock was replaced.;Kip believes the chess clock is ticking loudly.;Kip wants to continue his chess game to win.;Kip will continue to focus on his chess game to win.;A squirrel runs across the chess board.;Kip sees the squirrel run across the chess board.;Kip doesn't see the squirrel run across the chess board.;Kip;Chess clock;Kip was focused on the chess game.;auto;0
Quin was at the park with her new bike. Quin wanted to ride her bike around the park. The bike's tire was full of air. Quin believed her bike's tire was full of air. A piece of sharp glass on the ground punctured the bike's tire and let out the air slowly.;Quin sees the bike's tire getting flat.;Quin doesn't see the bike's tire getting flat as she is watching the bird.;Quin decides to push her bike home.;Quin gets on her bike and starts to ride.;Does Quin think her bike's tire is full of air or flat?;Does Quin want to ride her bike or push it home?;What will Quin do next?;Quin believes her bike's tire is flat.;Quin wants to push her bike home.;Quin will push her bike home.;Quin believes her bike's tire is full of air.;Quin wants to ride her bike.;Quin will get on her bike and start to ride.;A dog starts chasing its tail near Quin.;Quin sees the dog.;Quin doesn't see the dog.;Quin;Quin's bike's tire;Quin was distracted by a graceful bird on a tree.;auto;0
Alvin was in the kitchen, ready to cook dinner. Alvin wanted to make a spicy dish for his friends. The pepper mill was full of fresh black pepper. Alvin believed the pepper mill was full. His dog, excited by the smell of food, knocked over the pepper mill, emptying it.;Alvin sees his dog knock over the pepper mill.;Alvin doesn't see his dog knock over the pepper mill because he was reading his recipe book.;Alvin decides to discuss with his friends if they should order food instead.;Alvin starts to add pepper to his dish.;Does Alvin think the pepper mill is full or empty?;Does Alvin want to start cooking or discuss with his friends about ordering food?;What will Alvin do next?;Alvin believes the pepper mill is empty.;Alvin wants to discuss with his friends if they should order food instead.;Alvin will discuss with his friends if they should order food instead.;Alvin believes the pepper mill is full.;Alvin wants to start cooking.;Alvin will start to add pepper to his dish.;A bird flies into the kitchen through the open window.;Alvin sees the bird.;Alvin doesn't see the bird.;Alvin;Pepper mill;Lack of sight -> Alvin was looking at his modern recipe book.;auto;0
Vinnie was at the park playing with his friends. Vinnie wanted to play hide and seek and was looking for a good hiding spot. The dress hanging on a clothesline was bright in the sunlight. Vinnie believed the dress was bright in the sunlight. As the sun started to set, the dress became less bright and more dim.;Vinnie sees the sun setting and the dress becoming dim.;Vinnie doesn't see the sun setting and the dress becoming dim because he is looking in the other direction.;Vinnie decides to hide behind the dim dress on the clothesline.;Vinnie decides to call his friends and start the game.;Does Vinnie believe the dress is bright or dim?;Does Vinnie want to hide behind the dress or to call his friends and start the game?;What will Vinnie do next?;Vinnie believes the dress is dim.;Vinnie wants to hide behind the dress.;Vinnie will hide behind the dress.;Vinnie believes the dress is bright.;Vinnie wants to call his friends and start the game.;Vinnie will call his friends and start the game.;A regular brown dog runs past Vinnie.;Vinnie sees the brown dog.;Vinnie doesn't see the brown dog.;Vinnie;dress;Lack of sight -> Vinnie was looking in the other direction.;auto;0
Jack was in the park having a picnic. Jack wanted to eat his grapes, which were in his lunch box. The bunch of grapes was all attached together. Jack believed the bunch of grapes was all attached together. A squirrel came and separated a grape from the bunch.;Jack saw the squirrel separating a grape from the bunch.;Jack did not see the squirrel separating a grape from the bunch because he was looking at the beautiful view of the park.;Jack decides to share the rest of the grapes with the squirrel.;Jack decides to eat the grapes.;Does Jack think the bunch of grapes is all attached together or is a grape separated?;Does Jack want to eat the grapes or to share the rest of the grapes with the squirrel?;What will Jack do next?;Jack believes a grape is separated from the bunch.;Jack wants to share the rest of the grapes with the squirrel.;Jack will share the rest of the grapes with the squirrel.;Jack believes the bunch of grapes is all attached together.;Jack wants to eat the grapes.;Jack will eat the grapes.;A beautiful butterfly lands on the picnic blanket.;Jack sees the beautiful butterfly.;Jack doesn't see the beautiful butterfly.;Jack;bunch of grapes;Jack was looking at the beautiful view of the park.;auto;0
Wilbur was in the garden taking care of his plants. Wilbur wanted his plants to grow high and strong. The gate of the garden was closed. Wilbur believed the gate of the garden was closed. A squirrel managed to push the gate open to get inside the garden.;Wilbur sees the squirrel push the gate open.;Wilbur doesn't see the squirrel push the gate open because he is looking at his plants.;Wilbur decides to chase the squirrel out of the garden and close the gate.;Wilbur continues to water his plants, excited to see them grow.;Does Wilbur believe the garden gate is open or closed?;Does Wilbur want to continue taking care of his plants or chase the squirrel out of the garden?;What will Wilbur do next?;Wilbur believes the garden gate is open.;Wilbur wants to chase the squirrel out of the garden.;Wilbur will chase the squirrel out of the garden and close the gate.;Wilbur believes the garden gate is closed.;Wilbur wants to continue watering his plants.;Wilbur will continue to water his plants.;A bird lands on one of the plants.;Wilbur sees the bird land on the plant.;Wilbur doesn't see the bird land on the plant.;Wilbur;Garden gate;Wilbur was busy watering his plants and his back was turned to the gate.;auto;0
Xander was in the forest, practicing his archery. Xander wanted to hit the bullseye with his arrow. The arrow was very dry and highly flammable. Xander believed the arrow was very dry and highly flammable. A gentle rain started to fall, making the arrow damp and less flammable.;Xander notices the rain falling on the arrow.;Xander does not notice the rain falling on the arrow because he is focused on the target.;Xander decides to rest and wait until the arrow dries before trying again.;Xander takes a deep breath and releases the arrow towards the target.;Does Xander believe the arrow is highly flammable or less flammable?;Does Xander want to hit the bullseye or rest and wait for the arrow to dry?;What will Xander do next?;Xander believes the arrow is less flammable.;Xander wants to rest and wait for the arrow to dry.;Xander will rest and wait for the arrow to dry.;Xander believes the arrow is highly flammable.;Xander wants to hit the bullseye.;Xander will release the arrow towards the target.;An envious squirrel chatters loudly from a nearby tree.;Xander hears the squirrel chattering.;Xander doesn't hear the squirrel because he is focused on his archery.;Xander;arrow;Lack of sight -> Xander was focusing on the target and did not notice the change in the arrow's state.;auto;0
Finn was in the kitchen making breakfast. Finn's goal was to make a yummy bowl of cereal. The milk in the fridge was fresh and cold. Finn believed the milk in the fridge was fresh and cold. A little while later, his mom introduced a new box of milk and unknowingly left the old one out of the fridge.;Finn sees his mom leaving the old milk out of the fridge.;Finn doesn't see his mom leaving the old milk out of the fridge because he was in his room.;Finn decides to put the old milk back in the fridge.;Finn pours the milk into his bowl of cereal.;Does Finn think the milk is fresh and cold or left out of the fridge?;Does Finn want to pour the milk into his cereal or put the old milk back in the fridge?;What will Finn do next?;Finn believes the milk was left out of the fridge.;Finn wants to put the old milk back in the fridge.;Finn will put the old milk back in the fridge.;Finn believes the milk is fresh and cold.;Finn wants to pour the milk into his bowl of cereal.;Finn will pour the milk into his bowl of cereal.;A bird flies into the kitchen through the open window.;Finn sees the bird.;Finn doesn't see the bird.;Finn;The milk;Lack of sight -> Finn was in his room getting ready.;auto;0
Hugo was at the park, ready to have a picnic. Hugo wanted to eat his honest turkey sandwich for lunch. The turkey sandwich was inside the lunch box. Hugo believed his turkey sandwich was inside the lunch box. A playful dog ran by, knocked the lunch box over, and the turkey sandwich spilled out onto the grass.;Hugo sees the dog knock over his lunch box.;Hugo doesn't see the dog knock over his lunch box because he is looking the other way while calling his friend.;Hugo decides to pick up the sandwich and put it back in the lunch box.;Hugo finishes his call and starts eating his turkey sandwich.;Does Hugo think his turkey sandwich is inside the lunch box or spilled out on the grass?;Does Hugo want to eat his turkey sandwich or pick it up and put it back in the lunch box?;What will Hugo do next?;Hugo believes his turkey sandwich is spilled out on the grass.;Hugo wants to pick up the sandwich and put it back in the lunch box.;Hugo will pick up the sandwich and put it back in the lunch box.;Hugo believes his turkey sandwich is inside the lunch box.;Hugo wants to eat his turkey sandwich.;Hugo will finish his call and start eating his turkey sandwich.;A squirrel runs up a tree nearby.;Hugo sees the squirrel.;Hugo doesn't see the squirrel.;Hugo;turkey sandwich;Lack of sight -> Hugo was calling his friend on the phone.;auto;0
Ollie was at the park ready to play. Ollie wanted to go on the swing and push it as high as he could. The swing was strong and sturdy. Ollie thought the swing was strong and sturdy. A bossy big boy came and sat on the swing for a long time, making it weak.;Ollie sees the bossy boy sitting on the swing.;Ollie doesn't see the bossy boy sitting on the swing as he is watching a film.;Ollie decides to play on the slide instead of the weak swing.;Ollie goes to the swing to push it as high as he could.;Does Ollie think the swing is strong and sturdy or weak?;Does Ollie want to go on the swing or play on the slide?;What will Ollie do next?;Ollie believes the swing is weak.;Ollie wants to play on the slide instead of the weak swing.;Ollie will play on the slide instead of the weak swing.;Ollie believes the swing is strong and sturdy.;Ollie wants to go on the swing.;Ollie will go to the swing to push it as high as he could.;A dog runs across the park chasing a ball.;Ollie sees the dog running.;Ollie doesn't see the dog running.;Ollie;The swing in the park;Distraction -> Ollie was busy watching a film on his mom's phone.;auto;0
Elmo was at the beach building a sandcastle. He wanted to make the tallest sandcastle ever. The little crab near him was calm. Elmo believed the little crab was calm. A seagull swooped down and scared the little crab, making it run away.;Elmo sees the seagull swooping down.;Elmo doesn't see the seagull swooping down as he was focused on his sandcastle.;Elmo decides to close his sandcastle with a shell to protect it from the scared crab.;Elmo continues to build his sandcastle, feeling proud of his work.;Does Elmo think the crab is calm or scared?;Does Elmo want to protect his sandcastle or continue building it?;What will Elmo do next?;Elmo believes the crab is scared.;Elmo wants to protect his sandcastle.;Elmo will close his sandcastle with a shell to protect it.;Elmo believes the crab is calm.;Elmo wants to continue building his sandcastle.;Elmo will continue to build his sandcastle, feeling proud of his work.;A big wave washes up onto the beach.;Elmo sees the big wave.;Elmo doesn't see the big wave.;Elmo;Little crab near Elmo.;Lack of sight -> Elmo was focusing on his sandcastle.;auto;0
Vito was in the park, flying his kite. Vito wants to keep the kite flying high in the sky. The string of the kite is securely fastened to the handle. Vito believes the string of the kite is securely fastened to the handle. A squirrel scurries up the tree, nibbling at the string until it is loose.;Vito sees the squirrel nibbling at the string.;Vito doesn't see the squirrel nibbling at the string.;Vito decides to chase the squirrel away and fix the string.;Vito continues to fly the kite, enjoying the dull afternoon.;Does Vito think the string of the kite is securely fastened or loose?;Does Vito want to keep flying the kite or chase the squirrel away and fix the string?;What will Vito do next?;Vito believes the string of the kite is loose.;Vito wants to chase the squirrel away and fix the string.;Vito will chase the squirrel away and fix the string.;Vito believes the string of the kite is securely fastened.;Vito wants to keep flying the kite.;Vito will continue to fly the kite, enjoying the dull afternoon.;A cloud of smoke from a nearby barbecue drifts across the park.;Vito sees the smoke.;Vito doesn't see the smoke.;Vito;kite string;Vito was looking at the kite in the sky, not the string.;auto;0
Pippa was at the park on a hot day. Pippa wanted to drink fresh water from her regular blue water bottle. The water bottle was full of water. Pippa believed the water bottle was full. A thirsty dog at the park drank all the water from Pippa's water bottle when she was not looking.;Pippa sees the thirsty dog drinking from her water bottle.;Pippa does not see the thirsty dog drinking from her water bottle because she is playing with her friends.;Pippa decides to find a water fountain to drink from.;Pippa takes a break from playing and drinks from her water bottle.;Does Pippa think her water bottle is full or empty?;Does Pippa want to drink from her water bottle or find a water fountain to drink from?;What will Pippa do next?;Pippa believes her water bottle is empty.;Pippa wants to find a water fountain to drink from.;Pippa will find a water fountain to drink from.;Pippa believes her water bottle is full.;Pippa wants to drink from her water bottle.;Pippa will take a break from playing and drink from her water bottle.;A kite lands on the ground near Pippa.;Pippa sees the kite landing on the ground.;Pippa doesn't see the kite landing on the ground.;Pippa;Pippa's water bottle.;Visual distraction -> Pippa was busy playing with her friends.;auto;0
Yara was in the park on a sunny day. Yara wanted to enjoy the sun and have a healthy picnic. The map of the park was new and crisp. Yara believed the map of the park was new and crisp. A group of children playing nearby started to dance on the map, making it worn and tattered.;Yara sees the children dancing on the map.;Yara doesn't see the children dancing on the map because she was looking at the birds.;Yara decides to ask the children to stop dancing on the map.;Yara continues to enjoy her picnic and the sun.;Does Yara think the map is new and crisp or worn and tattered?;Does Yara want to enjoy her picnic or ask the children to stop dancing on the map?;What will Yara do next?;Yara believes the map is worn and tattered.;Yara wants to ask the children to stop dancing on the map.;Yara will ask the children to stop dancing on the map.;Yara believes the map is new and crisp.;Yara wants to enjoy her picnic.;Yara will continue to enjoy her picnic and the sun.;A squirrel runs across the picnic blanket.;Yara sees the squirrel.;Yara doesn't see the squirrel.;Yara;map of the park;Yara was looking at the birds in the sky.;auto;0
Eddy was at the park after his big football game. Eddy wanted to show his mom his shiny new medal he won. The medal was in Eddy's bag. Eddy believed his medal was in his bag. A sneaky squirrel, known for taking shiny things, found Eddy's bag open and took the medal.;Eddy sees the squirrel running away with his medal.;Eddy does not see the squirrel taking his medal as he is busy swinging.;Eddy decides to chase the squirrel to get back his medal.;Eddy plans to pack up his bag and go home to show his mom the medal.;Does Eddy believe his medal is in his bag or has it been taken by the squirrel?;Does Eddy want to go home and show his mom the medal or chase the squirrel to get it back?;What will Eddy do next?;Eddy believes the squirrel has taken his medal.;Eddy wants to chase the squirrel to get his medal back.;Eddy will chase the squirrel to get his medal back.;Eddy believes his medal is in his bag.;Eddy wants to go home and show his mom the medal.;Eddy will pack up his bag and go home.;An obedient dog starts to bathe in the park fountain.;Eddy sees the dog bathing in the fountain.;Eddy doesn't see the dog because he's focused on the swings.;Eddy;Eddy's medal;Eddy was busy playing on the swings and couldn't see his bag.;auto;0
Qasim was at a big party with his friends. He wanted to win the spoon race to show he was fast and fun. The spoon he had was big and strong. Qasim believed his spoon was big and strong. A quarrel broke out among some party guests, and in the commotion, someone stepped on Qasim's spoon, bending it out of shape.;Qasim sees his spoon getting stepped on.;Qasim doesn't see his spoon getting stepped on because he is talking to his friends.;Qasim decides to ask for a new spoon.;Qasim practices balancing the egg on his spoon.;Does Qasim think his spoon is big and strong or bent out of shape?;Does Qasim want to practice for the spoon race or ask for a new spoon?;What will Qasim do next?;Qasim believes his spoon is bent out of shape.;Qasim wants to ask for a new spoon.;Qasim will ask for a new spoon.;Qasim believes his spoon is big and strong.;Qasim wants to practice for the spoon race.;Qasim will practice balancing the egg on his spoon.;The music changes to a fast, upbeat song.;Qasim hears the music change.;Qasim doesn't hear the music change.;Qasim;Qasim's spoon;Distraction -> Qasim was talking to his friends.;auto;0
Quinn was in the kitchen ready to make a yummy peach pie. Quinn wanted to make the best peach pie for his friends coming over. The peaches were ripe and juicy. Quinn believed that the peaches were ripe and juicy. A fruit fly infestation in the kitchen caused the peaches to become spoiled.;Quinn sees the fruit flies around the peaches.;Quinn does not see the fruit flies because he is in the other room.;Quinn decides to go to the store and buy new peaches.;Quinn starts to cut the peaches to make the pie.;Does Quinn think the peaches are ripe and juicy or spoiled?;Does Quinn want to make the pie with the peaches he has or go to the store and buy new ones?;What will Quinn do next?;Quinn believes the peaches are spoiled.;Quinn wants to go to the store and buy new peaches.;Quinn will go to the store and buy new peaches.;Quinn believes the peaches are ripe and juicy.;Quinn wants to make the pie with the peaches he has.;Quinn will start to cut the peaches to make the pie.;Quinn's dog comes into the kitchen and starts to bark.;Quinn hears his dog barking.;Quinn does not hear his dog barking because he is still in the other room.;Quinn;Peaches;Quinn was in the other room looking for his pie recipe.;auto;0
Max was in the kitchen, feeling hungry. Max wanted to drink a glass of sweet apple juice. The juice in the fridge was sweet. Max believed the juice in the fridge was sweet. His older sister, thinking it was too sweet, added a lot of lemon to the juice.;Max sees his sister adding lemon to the juice.;Max doesn't see his sister adding lemon to the juice because he is in the living room.;Max decides to chew on an apple instead of drinking the now sour juice.;Max pours himself a glass of sweet apple juice.;Does Max think the juice in the fridge is sweet or sour?;Does Max want to drink the sweet juice or chew on an apple?;What will Max do next?;Max believes the juice in the fridge is sour.;Max wants to chew on an apple.;Max will chew on an apple.;Max believes the juice in the fridge is sweet.;Max wants to drink the sweet juice.;Max will pour himself a glass of sweet apple juice.;A cat jumps onto the kitchen counter.;Max sees the cat.;Max doesn't see the cat.;Max;Juice in the fridge;Lack of sight -> Max was in the living room, not the kitchen.;auto;0
Sam was in his kitchen, preparing to bake cookies. Sam wanted to bake the best cookies for his friends. The oven was working perfectly fine. Sam believed the oven was working perfectly fine. The oven's heating element slowly became ineffective due to constant use.;Sam sees the oven's light dimming.;Sam doesn't see the oven's light dimming because he is focused on mixing the cookie dough.;Sam decides to call a repairman to fix the oven.;Sam puts the cookie dough in the oven to bake.;Does Sam think the oven is working perfectly fine or has become ineffective?;Does Sam want to bake cookies or call a repairman to fix the oven?;What will Sam do next?;Sam believes the oven has become ineffective.;Sam wants to call a repairman to fix the oven.;Sam will call a repairman to fix the oven.;Sam believes the oven is working perfectly fine.;Sam wants to bake cookies.;Sam will put the cookie dough in the oven to bake.;A squirrel scurries across the kitchen window.;Sam sees the squirrel.;Sam doesn't see the squirrel.;Sam;Oven;Lack of visual contact -> Sam was busy mixing the cookie dough and not looking at the oven.;auto;0
Cindy was in the park with her friends. Cindy wanted to play hide and seek with her friends. The deer in the park was calm and still. Cindy thought that the deer was calm and still. A park ranger came and started to feed the deer, making it excited and lively.;Cindy opens her eyes and sees the park ranger feeding the deer.;Cindy keeps her eyes closed and doesn't see the park ranger feeding the deer.;Cindy decides to call her friends and show them the excited deer.;Cindy finishes counting and starts to look for her friends.;Does Cindy think the deer is calm and still or excited and lively?;Does Cindy want to find her friends or show them the excited deer?;What will Cindy do next?;Cindy believes the deer is excited and lively.;Cindy wants to show her friends the excited deer.;Cindy will call her friends and show them the excited deer.;Cindy believes the deer is calm and still.;Cindy wants to find her friends.;Cindy will start to look for her friends.;A squirrel runs up a tree.;Cindy sees the squirrel.;Cindy doesn't see the squirrel.;Cindy;deer in the park;Lack of sight -> Cindy was counting with her eyes closed.;auto;0
