Zara was in the school library studying for her big quiz. Zara wanted to do well on her quiz. The book Zara was reading was full of deep, helpful information. Zara thought the book was full of deep, helpful information. Over time, the pages of the book faded and the words became unreadable.;Zara sees the words on the pages of the book become faded.;Zara doesn't see the words on the pages of the book become faded because she is focused on the pages she is reading.;Zara decides to find another book to help her study.;Zara continues to read the book and study for her quiz.;Does Zara think the book is full of deep, helpful information or faded and unreadable?;Does Zara want to continue studying or find another book?;What will Zara do next?;Zara believes the book is faded and unreadable.;Zara wants to find another book to help her study.;Zara will find another book to help her study.;Zara believes the book is full of deep, helpful information.;Zara wants to continue studying.;Zara will continue to read the book and study for her quiz.;A bird flies into the library through an open window.;Zara sees the bird fly into the library.;Zara doesn't see the bird fly into the library.;Zara;The book Zara was reading.;Lack of visual access -> Zara was focused on the pages she was reading.;auto;0
Gabe was in the kitchen getting ready to eat his lunch. Gabe wants to eat his soup with his favorite spoon. The spoon was on the table. Gabe believes the spoon is on the table. His pet cat, Whiskers, jumps onto the table and knocks the spoon onto the floor.;Gabe sees Whiskers knock the spoon to the floor.;Gabe doesn't see Whiskers knock the spoon to the floor as he was looking into the fridge.;Gabe decides to pick up the spoon, wash it, and then eat his soup.;Gabe grabs the spoon from the table and starts to eat his soup.;Does Gabe think the spoon is on the table or on the floor?;Does Gabe want to eat his soup with the spoon from the table or to pick up the spoon from the floor, wash it, and then eat his soup?;What will Gabe do next?;Gabe believes the spoon is on the floor.;Gabe wants to pick up the spoon from the floor, wash it, and then eat his soup.;Gabe will pick up the spoon, wash it, and then eat his soup.;Gabe believes the spoon is on the table.;Gabe wants to eat his soup with the spoon from the table.;Gabe will grab the spoon from the table and start to eat his soup.;A bird flies past the kitchen window.;Gabe sees the bird fly past the window.;Gabe doesn't see the bird as he is focused on his soup.;Gabe;Spoon;Lack of sight -> Gabe was looking into the fridge for a drink.;auto;0
Ben was at the zoo with his class. Ben wanted to see the alligator in its cage. The alligator was sleeping comfortably in the sun. Ben believed the alligator was sleeping comfortably in the sun. A zookeeper came and carried the alligator to a different cage.;Ben saw the zookeeper carry the alligator away.;Ben didn't see the zookeeper carry the alligator away because he was looking at the monkeys.;Ben decides to follow the zookeeper to the new cage.;Ben decides to stay and watch the alligator sleep.;Does Ben think the alligator is sleeping comfortably in the sun or has it been carried away to a new cage?;Does Ben want to stay and watch the alligator sleep or follow the zookeeper to the new cage?;What will Ben do next?;Ben believes the alligator has been carried away to a new cage.;Ben wants to follow the zookeeper to the new cage.;Ben will follow the zookeeper to the new cage.;Ben believes the alligator is sleeping comfortably in the sun.;Ben wants to stay and watch the alligator sleep.;Ben will stay and watch the alligator sleep.;A parrot lands on Ben's shoulder.;Ben feels the parrot land on his shoulder.;Ben doesn't feel the parrot land on his shoulder.;Ben;Alligator;Visual obstruction -> Ben was looking at the monkeys in the next cage.;auto;0
Idris was at the park on a sunny day. Idris wanted to show his friends his new smart watch. The watch was on Idris's wrist. Idris believed the watch was on his wrist. While playing, Idris accidentally hit his hand against a tree, causing the watch to fall into a pile of dust.;Idris sees his watch fall into the dust.;Idris does not see his watch fall into the dust because he was looking at his friends.;Idris decides to pick up his watch from the dust and clean it.;Idris plans to show his friends how the watch works.;Does Idris think his watch is on his wrist or in the dust?;Does Idris want to show his friends his smart watch or to pick it up and clean it?;What will Idris do next?;Idris believes his watch is in the dust.;Idris wants to pick up his watch from the dust and clean it.;Idris will pick up his watch from the dust and clean it.;Idris believes his watch is on his wrist.;Idris wants to show his friends his smart watch.;Idris will show his friends how the watch works.;A squirrel runs up a nearby tree.;Idris sees the squirrel.;Idris doesn't see the squirrel.;Idris;Idris's smart watch;Lack of sight -> Idris was looking at his friends while playing.;auto;0
Eric was at the harbor, fishing. Eric wanted to catch a big fish for dinner. The harbor was quiet and calm. Eric believed the harbor was quiet and calm. A group of rowdy tourists arrived, making the harbor noisy and active.;Eric sees the group of tourists.;Eric doesn't see the group of tourists because he is looking at his fishing line.;Eric decides to find a quieter spot to fish.;Eric continues to fish, hoping to catch a big one.;Does Eric think the harbor is quiet and calm or noisy and active?;Does Eric want to continue fishing or find a quieter spot to fish?;What will Eric do next?;Eric believes the harbor is noisy and active.;Eric wants to find a quieter spot to fish.;Eric will find a quieter spot to fish.;Eric believes the harbor is quiet and calm.;Eric wants to catch a big fish.;Eric will continue to fish, hoping to catch a big one.;A seagull swoops down and steals a fish from Eric's bucket.;Eric sees the seagull.;Eric doesn't see the seagull.;Eric;Harbor;Lack of sight -> Eric was focused on his fishing line.;auto;0
Ollie was at the park with his friends. Ollie wanted to show his friends how intelligent he was by solving a riddle. The apple in Ollie's bag was fresh. Ollie believed the apple in his bag was fresh. While Ollie was busy trying to tease his friends with the riddle, the sun shone on the bag and the apple spoiled.;Ollie sees the sun shining on his bag.;Ollie does not see the sun shining on his bag as he is busy with his friends.;Ollie decides to throw the spoiled apple in a nearby bin.;Ollie plans to eat the apple after finishing the riddle.;Does Ollie think the apple in his bag is fresh or spoiled?;Does Ollie want to eat the apple or throw it in the bin?;What will Ollie do next?;Ollie believes the apple in his bag is spoiled.;Ollie wants to throw the spoiled apple in the bin.;Ollie will throw the spoiled apple in the bin.;Ollie believes the apple in his bag is fresh.;Ollie wants to eat the apple.;Ollie will eat the apple after finishing the riddle.;A dog starts barking at a squirrel in the park.;Ollie hears the dog barking.;Ollie doesn't hear the dog barking.;Ollie;apple in Ollie's bag;Ollie was focused on his friends and the riddle.;auto;0
Timmy was in the park, ready to play football. Timmy wanted to win the game. The football was fully inflated. Timmy believed the football was fully inflated. A dog, being very impatient and wanting to play, ran over and bit the football, deflating it.;Timmy sees the dog bite the football.;Timmy doesn't see the dog bite the football as he is tying his shoelaces.;Timmy decides to chase the dog away and find a new football.;Timmy runs to the center of the field to start the game.;Does Timmy think the football is fully inflated or deflated?;Does Timmy want to start the game or chase the dog away and find a new football?;What will Timmy do next?;Timmy believes the football is deflated.;Timmy wants to chase the dog away and find a new football.;Timmy will chase the dog away and find a new football.;Timmy believes the football is fully inflated.;Timmy wants to start the game.;Timmy will run to the center of the field to start the game.;A squirrel runs across the field.;Timmy sees the squirrel.;Timmy doesn't see the squirrel.;Timmy;Football;Lack of sight -> Timmy was tying his shoelaces.;auto;0
Yara was at the farm with her pet pig. Yara wanted to teach her pig to be obedient. The pig was not listening to Yara. Yara believed her pig was not obedient. A farmhand, who knew how to handle pigs, showed the pig what to do and it started listening.;Yara sees the farmhand teaching her pig.;Yara doesn't see the farmhand teaching her pig because she is fetching water.;Yara decides to thank the farmhand and continue teaching her pig.;Yara tries to teach her pig again.;Does Yara think her pig is obedient or not obedient?;Does Yara want to continue teaching her pig or thank the farmhand and continue teaching her pig?;What will Yara do next?;Yara believes her pig is obedient.;Yara wants to thank the farmhand and continue teaching her pig.;Yara will thank the farmhand and continue teaching her pig.;Yara believes her pig is not obedient.;Yara wants to teach her pig again.;Yara will try to teach her pig again.;A group of ducks cross the yard.;Yara sees the group of ducks crossing the yard.;Yara doesn't see the group of ducks because she is focused on her pig.;Yara;Yara's pig;Lack of sight -> Yara went to fetch some water.;auto;0
Ivan was in a park, playing on a swing. Ivan wanted to swing high up in the sky like a bird. The swing was strong and stable. Ivan believed the swing was strong and stable. A big dog came running and hit the swing, making it unstable.;Ivan opens his eyes just in time to see the dog hit the swing.;Ivan doesn't see the dog hit the swing because his eyes are closed.;Ivan decides to stop swinging and hide behind a big tree.;Ivan continues to swing higher, feeling the wind on his face.;Does Ivan think the swing is stable or unstable?;Does Ivan want to continue swinging or hide behind a big tree?;What will Ivan do next?;Ivan believes the swing is unstable.;Ivan wants to hide behind a big tree.;Ivan will stop swinging and hide behind a big tree.;Ivan believes the swing is stable.;Ivan wants to continue swinging.;Ivan will continue to swing higher.;A purple pillow falls from a tree.;Ivan sees the purple pillow fall from the tree.;Ivan doesn't see the purple pillow fall from the tree.;Ivan;swing;Lack of sight -> Ivan was closing his eyes while swinging.;auto;0
;Pete touches the rock and notices it has become soft.;Pete doesn't touch the rock and doesn't notice it has become soft.;Pete decides to change the rock with a stronger one.;Pete continues to build his castle using the rock as support.;Does Pete think the rock is hard or soft?;Does Pete want to continue building his castle or change the rock?;What will Pete do next?;Pete believes the rock has become soft.;Pete wants to change the rock.;Pete will change the rock with a stronger one.;Pete believes the rock is still hard.;Pete wants to continue building his castle.;Pete will continue to build his castle using the rock as support.;A seagull lands near Pete's castle.;Pete sees the seagull.;Pete doesn't see the seagull.;Pete;rock;Lack of touch -> Pete was busy building the castle and didn't touch the rock.;auto;0
Zara was at a picnic in a big park. Zara wanted to fly her new kite. The sky was clear with no smoke. Zara believed the sky was clear with no smoke. A terrible fire started far away and filled the sky with smoke.;Zara sees the smoke in the sky.;Zara does not see the smoke as she is busy with her kite.;Zara decides to pack up and leave the park.;Zara starts to fly her kite.;Does Zara think the sky is clear or filled with smoke?;Does Zara want to fly her kite or to leave the park?;What will Zara do next?;Zara believes the sky is filled with smoke.;Zara wants to leave the park.;Zara will pack up and leave the park.;Zara believes the sky is clear.;Zara wants to fly her kite.;Zara will start to fly her kite.;A squirrel runs by, carrying a big nut.;Zara sees the squirrel.;Zara doesn't see the squirrel.;Zara;sky;Lack of sight -> Zara was looking at her kite.;auto;0
Ben was at the park playing with his new red kite. Ben wanted to fly his kite high in the sky. The cord of Ben's kite was strong and tight. Ben believed that the cord of his kite was strong and tight. A playful squirrel, in an unusual act, gnawed through the cord making it invalid.;Ben sees the squirrel gnawing through the cord.;Ben doesn't see the squirrel gnawing through the cord because he was looking at the sky.;Ben decides to promise himself to buy a new cord.;Ben continues to fly his kite high in the sky.;Does Ben think the cord of his kite is strong and tight or gnawed and invalid?;Does Ben want to continue flying his kite or promise himself to buy a new cord?;What will Ben do next?;Ben believes the cord of his kite is gnawed and invalid.;Ben wants to promise himself to buy a new cord.;Ben will promise himself to buy a new cord.;Ben believes the cord of his kite is strong and tight.;Ben wants to continue flying his kite.;Ben will continue to fly his kite high in the sky.;A rainbow appears in the sky.;Ben sees the rainbow.;Ben doesn't see the rainbow.;Ben;cord of Ben's kite;The squirrel was behind a tree -> Ben couldn't see it.;auto;0
Pippa was in the park playing with her new kite. Pippa's goal was to fly her kite higher than any other kite in the park. The string of Pippa's kite was untangled and ready to fly. Pippa believed that her kite's string was untangled and ready to fly. A naughty squirrel came and started to fight with the string, tangling it all up.;Pippa sees the squirrel tangling her kite string.;Pippa doesn't see the squirrel tangling her kite string.;Pippa decides to chase the squirrel away and untangle her kite string.;Pippa runs to an open space and starts to fly her kite.;Does Pippa think her kite's string is untangled or tangled?;Does Pippa want to fly her kite or chase the squirrel away and untangle her kite string?;What will Pippa do next?;Pippa believes her kite's string is tangled.;Pippa wants to chase the squirrel away and untangle her kite string.;Pippa will chase the squirrel away and untangle her kite string.;Pippa believes her kite's string is untangled.;Pippa wants to fly her kite.;Pippa will run to an open space and start to fly her kite.;A fine feather falls from a bird flying overhead.;Pippa sees the feather falling.;Pippa doesn't see the feather falling.;Pippa;String of Pippa's kite.;Pippa was looking up at the sky, dreaming about her kite soaring high.;auto;0
Xander was at the beach, building a sandcastle near the water. Xander wanted to make the biggest sandcastle anyone had ever seen. His toy shovel was full of sand. Xander believed his toy shovel was full of sand. A thoughtful wave from the ocean came and washed over the shovel, emptying it of sand.;Xander sees the wave washing over his shovel.;Xander doesn't see the wave as he is looking at the sandcastle.;Xander decides to surrender his plan of making the biggest sandcastle and starts to make a smaller one further away from the water.;Xander continues to pile sand onto his sandcastle.;Does Xander think his toy shovel is full of sand or empty?;Does Xander want to continue building the biggest sandcastle or start making a smaller one further away from the water?;What will Xander do next?;Xander believes his toy shovel is empty.;Xander wants to start making a smaller sandcastle further away from the water.;Xander will start making a smaller sandcastle further away from the water.;Xander believes his toy shovel is full of sand.;Xander wants to continue building the biggest sandcastle.;Xander will continue to pile sand onto his sandcastle.;A seagull lands near Xander's sandcastle.;Xander sees the seagull.;Xander doesn't see the seagull.;Xander;Xander's toy shovel;Xander was looking at the sandcastle, not at the shovel.;auto;0
Gina was on a field trip to the ancient history museum. She wanted to see the earth exhibit. The ancient earth globe was round. Gina believed the earth globe was round. A museum worker took the globe to fix a scratch and returned it flattened to fit in a display case.;Gina saw the worker return the flattened globe.;Gina did not see the worker return the flattened globe because she was looking at another exhibit.;Gina would go to the worker and ask why the globe was flattened.;Gina would go to the earth globe and start examining it.;Does Gina think the earth globe is round or flattened?;Does Gina want to examine the earth globe or ask the worker why the globe was flattened?;What will Gina do next?;Gina believes the earth globe is flattened.;Gina wants to ask the worker why the globe was flattened.;Gina will go to the worker and ask why the globe was flattened.;Gina believes the earth globe is round.;Gina wants to examine the earth globe.;Gina will go to the earth globe and start examining it.;A group of school kids started a treasure hunt game in the museum.;Gina sees the group of school kids starting a treasure hunt game.;Gina doesn't see the group of school kids starting a treasure hunt game.;Gina;earth globe;Gina was looking at another exhibit.;auto;0
Andy was at the park playing with his toy truck. Andy wanted to load all his toy rocks into the truck. The toy truck was empty. Andy believed his toy truck was empty. A ghost, who was watching Andy play, decided to help him and loaded the toy truck with all the toy rocks.;Andy sees the ghost loading his toy truck.;Andy does not see the ghost loading his toy truck as he is looking at the butterfly.;Andy decides to thank the ghost for helping him.;Andy starts loading the toy truck with toy rocks.;Does Andy think his toy truck is empty or loaded with toy rocks?;Does Andy want to load his toy truck with toy rocks or thank the ghost?;What will Andy do next?;Andy believes his toy truck is loaded with toy rocks.;Andy wants to thank the ghost.;Andy will thank the ghost.;Andy believes his toy truck is empty.;Andy wants to load his toy truck with toy rocks.;Andy will start loading the toy truck with toy rocks.;An original song starts playing from a nearby radio.;Andy hears the song.;Andy doesn't hear the song.;Andy;toy truck;Distraction -> Andy was busy looking at a butterfly.;auto;0
Ulysses was at the park with his friends. Ulysses wanted to show his friends a cool movie on his phone. The phone was responsive and working fine. Ulysses believed his phone was responsive. A group of ants decided to march into Ulysses's bag and onto his phone, making it unresponsive.;Ulysses sees the ants on his phone.;Ulysses doesn't see the ants on his phone because he is talking with his friends.;Ulysses decides to clean his phone to make it work again.;Ulysses starts the movie on his phone for his friends to watch.;Does Ulysses think his phone is responsive or unresponsive?;Does Ulysses want to show his friends the movie or clean his phone?;What will Ulysses do next?;Ulysses believes his phone is unresponsive.;Ulysses wants to clean his phone.;Ulysses will clean his phone.;Ulysses believes his phone is responsive.;Ulysses wants to show his friends the movie.;Ulysses will start the movie on his phone for his friends to watch.;A wealthy man walks by with a fancy dog.;Ulysses sees the wealthy man and his fancy dog.;Ulysses doesn't see the wealthy man and his fancy dog.;Ulysses;Ulysses's phone;Lack of sight -> Ulysses was looking at his friends, not his bag.;auto;0
Gus was at the park playing. Gus wanted to ride his old red bike home. The bike was flat on the ground. Gus believed the bike was flat on the ground. A strong breeze blew through the park, lifting the bike and making it stand on its two wheels.;Gus sees the bike standing on its two wheels.;Gus doesn't see the bike standing on its two wheels because he is watching the ducks.;Gus plans to push the bike back down to the ground.;Gus plans to pick up the bike and ride it home.;Does Gus think the bike is standing on its two wheels or flat on the ground?;Does Gus want to ride his bike home or to push it back down to the ground?;What will Gus do next?;Gus believes the bike is standing on its two wheels.;Gus wants to push the bike back down to the ground.;Gus will push the bike back down to the ground.;Gus believes the bike is flat on the ground.;Gus wants to ride his bike home.;Gus will pick up the bike and ride it home.;A squirrel scurries past Gus.;Gus sees the squirrel.;Gus doesn't see the squirrel.;Gus;Gus's old red bike;Gus was looking at the ducks in the pond.;auto;0
Cara was at the beach looking at the sea. Cara wanted to swim to the nearby reef and explore it. The water was very clear and she could see the reef. Cara believed the water was clear and she could see the reef. Over time, a school of tiny fish swam close to the surface, making the water look less clear.;Cara sees the school of fish making the water less clear.;Cara doesn't see the school of fish because she is arguing with her friend.;Cara decides to wait until the fish move away to swim to the reef.;Cara gets ready to swim to the reef.;Does Cara think the water is clear or less clear?;Does Cara want to swim to the reef or wait until the fish move away?;What will Cara do next?;Cara believes the water is less clear.;Cara wants to wait until the fish move away.;Cara will wait until the fish move away.;Cara believes the water is clear.;Cara wants to swim to the reef.;Cara will get ready to swim to the reef.;A seagull flies over and drops a shell near Cara.;Cara sees the seagull drop the shell.;Cara doesn't see the seagull drop the shell.;Cara;Water;Cara was distracted -> Cara was grumpy and arguing with her friend.;auto;0
Ben was in the kitchen, making a spicy soup. Ben wanted to make a good, spicy soup to comfort his sick mom. The soup pot lid was aligned correctly on the pot. Ben believed the soup pot lid was aligned correctly on the pot. A fly landed on the kitchen counter and in its panic, knocked the soup pot lid, causing it to become misaligned.;Ben hears the noise of the lid being knocked.;Ben does not hear the noise of the lid being knocked because he is focused on chopping vegetables.;Ben decides to realign the lid correctly on the pot.;Ben continues to chop vegetables and add them to the soup.;Does Ben think the soup pot lid is aligned correctly or misaligned?;Does Ben want to continue making the soup or realign the soup pot lid?;What will Ben do next?;Ben believes the soup pot lid is misaligned.;Ben wants to realign the soup pot lid.;Ben will realign the soup pot lid.;Ben believes the soup pot lid is aligned correctly.;Ben wants to continue making the soup.;Ben will continue to chop vegetables and add them to the soup.;The kitchen radio starts playing Ben's favorite song.;Ben hears his favorite song playing on the radio.;Ben does not hear his favorite song playing on the radio.;Ben;Soup pot lid;Ben's back was turned as he was chopping vegetables.;auto;0
Finn was at the park playing with his new sport ball. Finn wants to show his friends how high he can kick the ball. The sport ball was in a good shape. Finn believes the sport ball was in a good shape. A dog runs over, grabs the sport ball in its mouth and punctures it, leaving it broken.;Finn sees the dog breaking his sport ball.;Finn doesn't see the dog breaking his sport ball as he was tying his shoelaces.;Finn decides to tell his mom about the broken sport ball.;Finn kicks the sport ball as high as he can.;Does Finn think his sport ball is in a good shape or is it broken?;Does Finn want to kick the sport ball or tell his mom about the broken ball?;What will Finn do next?;Finn believes his sport ball is broken.;Finn wants to tell his mom about the broken sport ball.;Finn will tell his mom about the broken sport ball.;Finn believes his sport ball is in a good shape.;Finn wants to kick the sport ball high.;Finn will kick the sport ball as high as he can.;A squirrel runs across the park.;Finn sees the squirrel.;Finn doesn't see the squirrel.;Finn;Sport ball;Lack of sight -> Finn was tying his shoelaces.;auto;0
Jaden was at the beach building a modest sand castle. Jaden wants to make the best sand castle ever. The sand castle was big and solid. Jaden believes the sand castle is big and solid. The hot sun slowly melts the sand castle making it less solid.;Jaden sees the sun melting the sand castle.;Jaden doesn't see the sun melting the sand castle as he is looking for a shell.;Jaden decides to rebuild the sand castle in a shady spot.;Jaden finds a shell and places it on top of the castle.;Does Jaden think the sand castle is solid or less solid?;Does Jaden want to rebuild the sand castle or place a shell on top of it?;What will Jaden do next?;Jaden believes the sand castle is less solid.;Jaden wants to rebuild the sand castle in a shady spot.;Jaden will rebuild the sand castle in a shady spot.;Jaden believes the sand castle is solid.;Jaden wants to place a shell on top of the castle.;Jaden will find a shell and place it on top of the castle.;An octopus swims by the shore.;Jaden sees the octopus.;Jaden doesn't see the octopus.;Jaden;sand castle;Lack of sight -> Jaden is looking for a shell to decorate the castle.;auto;0
