Hannah was in a grand palace for a big party. Hannah wanted to find her lost toy in the palace. The toy was in a box on a high shelf. Hannah saw the toy in a box on a high shelf. Suddenly, a cat jumped onto the shelf and knocked the box off, spilling the toy onto the floor.;Hannah saw the cat knock the box off the shelf.;Hannah did not see the cat knock the box off the shelf.;Hannah decided to pick up her toy from the floor.;Hannah was going to ask an adult to reach the box on the high shelf.;Does Hannah think the toy is in a box on a high shelf or on the floor?;Does Hannah want to ask an adult to reach the box or pick up the toy from the floor?;What will Hannah do next?;Hannah thinks her toy is on the floor.;Hannah wants to pick up her toy from the floor.;Hannah will pick up her toy from the floor.;Hannah thinks her toy is in a box on a high shelf.;Hannah wants to ask an adult to reach the box on the high shelf.;Hannah will ask an adult to reach the box on the high shelf.;A group of children start a game of tag in the palace.;Hannah sees the children start a game of tag.;Hannah does not see the children start a game of tag.;Hannah;Toy;auto;0
Ben was in the park having a picnic. Ben wanted to eat his sweet jam sandwich. The sandwich was wrapped in a clean napkin. Ben believed the sandwich was wrapped in a clean napkin. Suddenly, an ant crawled onto the sandwich, making it taste bitter.;Ben sees the ant on the sandwich.;Ben doesn't see the ant on the sandwich.;Ben decides not to eat the sandwich.;Ben unwraps the sandwich to eat it.;Does Ben think the sandwich is clean or has an ant on it?;Does Ben want to eat the sandwich or not eat the sandwich?;What will Ben do next?;Ben thinks there is an ant on the sandwich.;Ben doesn't want to eat the sandwich.;Ben will not eat the sandwich.;Ben thinks the sandwich is clean.;Ben wants to eat the sandwich.;Ben will unwrap and eat the sandwich.;A kite flies over the picnic spot.;Ben sees the kite flying over.;Ben doesn't see the kite flying over.;Ben;sandwich;auto;0
Dan was at the park with his friends. Dan wanted to play on the swings. The swing set was stable and safe. Dan believed the swing set was stable and safe. Suddenly, a big dog ran into the swing set and made it shaky.;Dan saw the big dog run into the swing set.;Dan didn't see the big dog run into the swing set.;Dan decided to tell his friends not to use the swings.;Dan was about to start swinging.;Does Dan think the swing set is stable or shaky?;Does Dan want to start swinging or tell his friends not to use the swings?;What will Dan do?;Dan believes the swing set is shaky.;Dan wants to tell his friends not to use the swings.;Dan will tell his friends not to use the swings.;Dan believes the swing set is stable.;Dan wants to start swinging.;Dan will start swinging.;A butterfly landed on Dan's shoulder.;Dan noticed the butterfly landing on his shoulder.;Dan didn't notice the butterfly landing on his shoulder.;Dan;Swing set;auto;0
Fran was in her room at night. Fran wanted to write a new poem for her class. The poem book was on her desk. Fran believed the poem book was on her desk. Suddenly, a gust of wind blew the poem book off the desk and onto the floor.;Fran hears the wind and the book falling.;Fran doesn't hear the wind or the book falling.;Fran decides to pick up the poem book from the floor.;Fran reaches out to grab the poem book from the desk.;Does Fran think the poem book is on the desk or on the floor?;Does Fran want to write a new poem or pick up the poem book?;What will Fran do?;Fran thinks the poem book is on the floor.;Fran wants to pick up the poem book.;Fran will pick up the poem book from the floor.;Fran thinks the poem book is on the desk.;Fran wants to write a new poem.;Fran will reach out to grab the poem book from the desk.;A fat cat sits on the window sill.;Fran sees the fat cat sitting on the window sill.;Fran doesn't see the fat cat sitting on the window sill.;Fran;Poem book;auto;0
Gabe was at the park near his home. Gabe wanted to eat a red apple from his bag. The apple was juicy and fresh. Gabe believed the apple was juicy and fresh. Suddenly, a dog ran by, knocking the apple into a puddle, making it wet and less flammable.;Gabe sees the dog knocking the apple into the puddle.;Gabe does not see the dog knocking the apple into the puddle.;Gabe decides to pick another apple from his bag.;Gabe reaches for the apple to take a bite.;Does Gabe think the apple is fresh and juicy or wet and less flammable?;Does Gabe want to eat the apple or pick another apple from his bag?;What will Gabe do?;Gabe thinks the apple is wet and less flammable.;Gabe wants to pick another apple from his bag.;Gabe will pick another apple from his bag.;Gabe thinks the apple is fresh and juicy.;Gabe wants to eat the apple.;Gabe will reach for the apple to take a bite.;A bird lands on a nearby tree.;Gabe sees the bird landing on the tree.;Gabe doesn't see the bird landing on the tree.;Gabe;apple;auto;0
Nia was playing in the park. Nia wanted to make a wish in the well. The well was very still. Nia believed the well was very still. Suddenly, a group of kids started playing football near the well and their ball fell into it, making the well water ripple.;Nia sees the kids playing football.;Nia doesn't see the kids playing football.;Nia decides to wait until the water is still again.;Nia takes a penny out of her pocket to throw into the well.;Does Nia believe the well water is still or rippling?;Does Nia want to make a wish or wait for the water to be still again?;What will Nia do?;Nia believes the well water is rippling.;Nia wants to wait until the water is still again.;Nia will wait for the water to be still again.;Nia believes the well water is still.;Nia wants to make a wish.;Nia will take a penny out of her pocket to throw into the well.;A butterfly lands on a flower near Nia.;Nia sees the butterfly.;Nia doesn't see the butterfly.;Nia;well;auto;0
Zara was at the park near her house. Zara wanted to go home and have a nap. The key to Zara's house was shiny and new. Zara believed the key was shiny and new. Suddenly, a stubborn bird picked up the key and dropped it into a muddy puddle, making it dirty and opaque.;Zara sees the bird pick up the key.;Zara doesn't see the bird pick up the key.;Zara decides to clean the key.;Zara plans to use the key to open her house.;Does Zara think the key is shiny and new or dirty and opaque?;Does Zara want to open her house or clean the key?;What will Zara do?;Zara thinks the key is dirty and opaque.;Zara wants to clean the key.;Zara will clean the key.;Zara thinks the key is shiny and new.;Zara wants to open her house.;Zara will use the key to open her house.;A dog starts barking loudly at the park.;Zara hears the dog barking.;Zara doesn't hear the dog barking.;Zara;key;auto;0
Tina was at the park with her friends. Tina wanted to win a race against her friends. The picture of the race course was clear. Tina believed the picture of the race course was clear. Suddenly, a naughty dog ran across the picture and made it blurry.;Tina saw the dog run across the picture.;Tina didn't see the dog run across the picture.;Tina decided to ask her friend about the race course.;Tina prepared to start the race.;Does Tina think the picture of the race course is clear or blurry?;Does Tina want to start the race or ask her friend about the race course?;What will Tina do?;Tina thinks the picture of the race course is blurry.;Tina wants to ask her friend about the race course.;Tina will ask her friend about the race course.;Tina thinks the picture of the race course is clear.;Tina wants to start the race.;Tina will prepare to start the race.;A cool breeze blew through the park.;Tina felt the cool breeze.;Tina didn't feel the cool breeze.;Tina;picture;auto;0
Mia was at the park with her friends. Mia wanted to go for a walk by the lake. The lake was calm and quiet. Mia believed the lake was calm and quiet. Suddenly, a group of ducks landed in the lake, causing it to become lively and noisy.;Mia sees the ducks landing in the lake.;Mia doesn't see the ducks landing in the lake.;Mia decides to sit and watch the ducks.;Mia continues with her plan to walk by the lake.;Does Mia think the lake is calm and quiet or lively and noisy?;Does Mia want to go for a walk by the lake or to sit and watch the ducks?;What will Mia do?;Mia thinks the lake is lively and noisy.;Mia wants to sit and watch the ducks.;Mia will sit and watch the ducks.;Mia thinks the lake is calm and quiet.;Mia wants to go for a walk by the lake.;Mia will continue with her plan to walk by the lake.;A child loses his balloon and it flies away.;Mia sees the balloon flying away.;Mia doesn't see the balloon flying away.;Mia;lake;auto;0
Bella was in her room playing with her toy box. Bella wanted to find her favorite doll in the toy box. The toy box was neat and tidy. Bella believed the toy box was neat and tidy. Suddenly, her little brother came in and messed up the toy box, making it disorganized.;Bella sees her brother messing up the toy box.;Bella doesn't see her brother messing up the toy box.;Bella decides to tidy up the toy box again.;Bella continues to look for her favorite doll in the toy box.;Does Bella think the toy box is neat and tidy or disorganized?;Does Bella want to find her favorite doll or to tidy up the toy box?;What will Bella do?;Bella thinks the toy box is disorganized.;Bella wants to tidy up the toy box again.;Bella will tidy up the toy box again.;Bella thinks the toy box is neat and tidy.;Bella wants to find her favorite doll.;Bella will continue to look for her favorite doll in the toy box.;A butterfly flies into the room through the open window.;Bella sees the butterfly fly into the room.;Bella doesn't see the butterfly fly into the room.;Bella;toy box;auto;0
Molly was in a forest looking for interesting things. Molly wanted to use her new camera to take pictures of the forest. The forest was full of stable trees. Molly believed the forest was full of stable trees. Suddenly, a group of wild animals ran through the forest, shaking the trees and making them unstable.;Molly sees the wild animals running.;Molly doesn't see the wild animals running.;Molly decides to step back to avoid the unstable trees.;Molly raises her camera to take a picture of the forest.;Does Molly think the trees in the forest are stable or unstable?;Does Molly want to take a picture of the forest or to avoid the unstable trees?;What will Molly do?;Molly thinks the trees in the forest are unstable.;Molly wants to avoid the unstable trees.;Molly will step back to avoid the unstable trees.;Molly thinks the trees in the forest are stable.;Molly wants to take a picture of the forest.;Molly will raise her camera to take a picture of the forest.;A butterfly lands on Molly's shoulder.;Molly notices the butterfly landing on her shoulder.;Molly doesn't notice the butterfly landing on her shoulder.;Molly;forest;auto;0
Nora was in her room playing with her toy dinosaur. Nora wanted to make her toy dinosaur look like it was running. The toy dinosaur was stiff and hard. Nora believed that the dinosaur was stiff and hard. Suddenly, the sun's heat made the dinosaur's plastic body soft and bendy.;Nora noticed the sun's heat.;Nora did not notice the sun's heat.;Nora decided to move the dinosaur's legs to make it look like it was running.;Nora planned to cut and reshape the dinosaur with her toy tools.;Does Nora think the dinosaur is stiff and hard or soft and bendy?;Does Nora want to cut and reshape the dinosaur or move the dinosaur's legs to make it look like it was running?;What will Nora do?;Nora thinks the dinosaur is soft and bendy.;Nora wants to move the dinosaur's legs to make it look like it was running.;Nora will move the dinosaur's legs to make it look like it was running.;Nora thinks the dinosaur is stiff and hard.;Nora wants to cut and reshape the dinosaur.;Nora will try to cut and reshape the dinosaur with her toy tools.;A butterfly landed on the window sill.;Nora sees the butterfly.;Nora doesn't see the butterfly.;Nora;Toy dinosaur;auto;0
Gina was at a picnic in the park. Gina wanted to eat her salad with her fork. The fork was clean and ready to use. Gina believed her fork was clean and ready to use. Suddenly, a dog ran by and knocked the fork into the dirt.;Gina saw the dog knock her fork into the dirt.;Gina didn't see the dog knock her fork into the dirt.;Gina decides to wash her fork.;Gina picks up her fork to eat her salad.;Does Gina believe her fork is clean or dirty?;Does Gina want to eat her salad or wash her fork?;What will Gina do next?;Gina believes her fork is dirty.;Gina wants to wash her fork.;Gina will wash her fork.;Gina believes her fork is clean.;Gina wants to eat her salad.;Gina will pick up her fork to eat her salad.;A butterfly lands on a flower near Gina.;Gina sees the butterfly land on the flower.;Gina doesn't see the butterfly land on the flower.;Gina;fork;auto;0
Sam was at the park with his dog. Sam wanted to play catch with his dog. The park was well-maintained. Sam believed the park was well-maintained. Suddenly, a group of kids playing soccer, ran all over the grass and made it look neglected.;Sam saw the kids playing soccer.;Sam didn't see the kids playing soccer.;Sam decides to take his dog to a different part of the park.;Sam throws the ball for his dog to catch.;Does Sam think the park is well-maintained or neglected?;Does Sam want to play catch with his dog or to take his dog to a different part of the park?;What will Sam do?;Sam thinks the park is neglected.;Sam wants to take his dog to a different part of the park.;Sam will take his dog to a different part of the park.;Sam thinks the park is well-maintained.;Sam wants to play catch with his dog.;Sam will throw the ball for his dog to catch.;A squirrel runs up a tree.;Sam sees the squirrel running up the tree.;Sam doesn't see the squirrel running up the tree.;Sam;park;auto;0
Anna was in a big park. Anna wanted to play with her red shoe. The red shoe was near a big tree. Anna thought the red shoe was near a big tree. Suddenly, a dog ran off with the shoe to a far place.;Anna saw the dog run off with her shoe.;Anna did not see the dog run off with her shoe.;Anna decides to chase after the dog.;Anna plans to put on her shoe and play.;Does Anna think her shoe is near the big tree or far away with the dog?;Does Anna want to play with her shoe near the tree or chase after the dog?;What will Anna do?;Anna thinks her shoe is far away with the dog.;Anna wants to chase after the dog.;Anna will chase after the dog.;Anna thinks her shoe is near the big tree.;Anna wants to play with her shoe.;Anna will put on her shoe and play.;A butterfly lands on a flower next to Anna.;Anna sees the butterfly land on the flower.;Anna doesn't see the butterfly land on the flower.;Anna;Red shoe;auto;0
Vicky was at the park near her home. Vicky wanted to play on the swing. The swing's chain was rigid and safe. Vicky believed the swing's chain was rigid and safe. Suddenly, a big dog ran into the swing and the chain became loose and wobbly.;Vicky sees the big dog run into the swing.;Vicky doesn't see the big dog run into the swing.;Vicky decides to tell the park guard about the loose chain.;Vicky goes to sit on the swing to play.;Does Vicky think the swing's chain is rigid or wobbly?;Does Vicky want to play on the swing or tell the park guard about the wobbly chain?;What will Vicky do?;Vicky thinks the swing's chain is wobbly.;Vicky wants to tell the park guard about the wobbly chain.;Vicky will tell the park guard about the wobbly chain.;Vicky thinks the swing's chain is rigid.;Vicky wants to play on the swing.;Vicky will sit on the swing to play.;A butterfly lands on a flower near Vicky.;Vicky sees the butterfly land on the flower.;Vicky doesn't see the butterfly land on the flower.;Vicky;Swing's chain;auto;0
Harry was at the park with his friends. Harry wanted to win a game of marbles. The marble was shiny and round. Harry believed the marble was shiny and round. Suddenly, a big dog ran through the game, changing the marble from round to broken.;Harry sees the big dog.;Harry doesn't see the big dog.;Harry decides to pick up the broken pieces of the marble.;Harry aims to point and shoot the marble.;Does Harry think the marble is round or broken?;Does Harry want to win the game or pick up the broken pieces of the marble?;What will Harry do?;Harry thinks the marble is broken.;Harry wants to pick up the broken pieces of the marble.;Harry will pick up the broken pieces of the marble.;Harry thinks the marble is round.;Harry wants to win the game.;Harry will point and shoot the marble.;A bird lands on a nearby tree.;Harry sees the bird land on the tree.;Harry doesn't see the bird land on the tree.;Harry;marble;auto;0
Rose was at the park on a sunny day. Rose wanted to eat her yummy sandwich. The sandwich was in a closed lunch box. Rose believed the sandwich was in a closed lunch box. Suddenly, a playful squirrel opened the lunch box, changing the state from closed to open.;Rose sees the squirrel open her lunch box.;Rose does not see the squirrel open her lunch box.;Rose decides to shoo away the squirrel.;Rose plans to open the lunch box and eat her sandwich.;Does Rose think the lunch box is closed or open?;Does Rose want to eat her sandwich or shoo away the squirrel?;What will Rose do?;Rose believes her lunch box is open.;Rose wants to shoo away the squirrel.;Rose will shoo away the squirrel.;Rose believes her lunch box is closed.;Rose wants to eat her sandwich.;Rose will open the lunch box to eat her sandwich.;A gloomy cloud covers the sun.;Rose notices the gloomy cloud.;Rose does not notice the gloomy cloud.;Rose;lunch box;auto;0
Harry was at the playground. Harry wanted to skip rope with his friends. The tire swing was hanging from a tree. Harry believed the tire swing was hanging from a tree. Suddenly, a strong wind blew and knocked the tire swing down to the ground.;Harry saw the wind knock the tire swing down.;Harry didn't see the wind knock the tire swing down.;Harry decides to tell an adult about the broken swing.;Harry goes to grab his skipping rope.;Does Harry think the tire swing is hanging from the tree or on the ground?;Does Harry want to tell an adult about the broken swing or to skip rope with his friends?;What will Harry do?;Harry thinks the tire swing is on the ground.;Harry wants to tell an adult about the broken swing.;Harry will tell an adult about the broken swing.;Harry thinks the tire swing is hanging from the tree.;Harry wants to skip rope with his friends.;Harry will go to grab his skipping rope.;A dog runs across the playground.;Harry sees the dog run across the playground.;Harry doesn't see the dog run across the playground.;Harry;tire swing;auto;0
Kira was at a toy store. Kira wanted to buy a teddy bear for a little girl. The teddy bear was very cheap. Kira believed the teddy bear was very cheap. Then, a store worker put a new tag on the teddy bear, making it expensive.;Kira sees the worker change the price tag.;Kira does not see the worker change the price tag.;Kira decides to look for another cheap teddy bear.;Kira goes to pay for the cheap teddy bear.;Does Kira think the teddy bear is cheap or expensive?;Does Kira want to buy the cheap teddy bear or look for another cheap teddy bear?;What will Kira do?;Kira believes the teddy bear is expensive.;Kira wants to look for another cheap teddy bear.;Kira will look for another cheap teddy bear.;Kira believes the teddy bear is cheap.;Kira wants to buy the cheap teddy bear.;Kira will go to pay for the cheap teddy bear.;A child starts crying in the toy store.;Kira hears the child crying.;Kira doesn't hear the child crying.;Kira;Teddy bear;auto;0
Dan was at the park with his dog. Dan wanted to find his lost key in the grass. The key was shiny and easy to spot. Dan believed the key was shiny and easy to spot. Suddenly, a group of kids playing soccer kicked the ball into the grass, making the area messy and hard to search.;Dan sees the kids playing soccer.;Dan doesn't see the kids playing soccer.;Dan decides to ask the kids to help him look for the key.;Dan begins to search for the key in the grass.;Does Dan think the key is easy to spot or hard to find?;Does Dan want to search for the key alone or ask the kids for help?;What will Dan do?;Dan thinks the key is hard to find.;Dan wants to ask the kids for help.;Dan will ask the kids to help him look for the key.;Dan thinks the key is easy to spot.;Dan wants to search for the key alone.;Dan will start to search for the key in the grass.;A curious squirrel runs by Dan and his dog.;Dan sees the curious squirrel.;Dan doesn't see the curious squirrel.;Dan;key;auto;0
Quinn was in a music room. Quinn wanted to sing a song with a soft voice. The water bottle on the table was full. Quinn believed the water bottle was full. Suddenly, an accidental knock by a passerby tipped the water bottle, causing the water to spill out.;Quinn heard the water bottle fall.;Quinn didn't hear the water bottle fall.;Quinn planned to clean up the spilled water.;Quinn was about to take a sip of water before singing.;Does Quinn think the water in the bottle is full or spilled?;Does Quinn want to sing with a soft voice or clean up the spilled water?;What will Quinn do next?;Quinn believes the water from the bottle has spilled.;Quinn wants to clean up the spilled water.;Quinn will clean up the spilled water.;Quinn believes the water in the bottle is still full.;Quinn wants to sing with a soft voice.;Quinn will take a sip of water before singing.;A cat walks into the music room.;Quinn sees the cat walk into the music room.;Quinn doesn't see the cat walk into the music room.;Quinn;water bottle;auto;0
John was at the park playing with his red ball. John wanted to play catch with his red ball. The ball was red and shiny. John saw that the ball was red and shiny. A dog came and bit the ball, changing its color to red with white bite marks.;John sees the dog bite his ball.;John doesn't see the dog bite his ball.;John decides to clean the white bite marks off his ball.;John picks up the ball to start playing catch.;Does John think his ball is red and shiny or red with white bite marks?;Does John want to play catch or clean the white bite marks off his ball?;What will John do?;John thinks his ball is red with white bite marks.;John wants to clean the white bite marks off his ball.;John will clean the white bite marks off his ball.;John thinks his ball is red and shiny.;John wants to play catch.;John will pick up the ball to start playing catch.;A nosy squirrel comes near John.;John sees the nosy squirrel.;John doesn't see the nosy squirrel.;John;ball;auto;0
Quinn was in her room. Quinn wanted to wear her new, shiny school uniform. The uniform was clean and unscratched. Quinn believed the uniform was clean and unscratched. Suddenly, a naughty cat jumped on the uniform and scratched it.;Quinn saw the cat jump on the uniform.;Quinn didn't see the cat jump on the uniform.;Quinn decides to mend the scratched uniform.;Quinn plans to put on the unscratched uniform.;Does Quinn think her uniform is unscratched or scratched?;Does Quinn want to put on the unscratched uniform or mend the scratched uniform?;What will Quinn do?;Quinn thinks her uniform is scratched.;Quinn wants to mend the scratched uniform.;Quinn will mend the scratched uniform.;Quinn thinks her uniform is unscratched.;Quinn wants to put on the unscratched uniform.;Quinn will put on the unscratched uniform.;A kind friend calls Quinn to ask about her day.;Quinn hears her friend's call.;Quinn doesn't hear her friend's call.;Quinn;uniform;auto;0
Fred was at school with his friends. Fred wanted to teach his friends how to make a paper airplane. The paper was flat and straight. Fred believed the paper was flat and straight. Suddenly, a playful cat jumped onto the table and bent the paper.;Fred sees the cat jump onto the table.;Fred does not see the cat jump onto the table.;Fred decides to straighten the paper.;Fred starts to fold the paper to make the airplane.;Does Fred think the paper is flat and straight or bent?;Does Fred want to make the airplane or straighten the paper?;What will Fred do?;Fred thinks the paper is bent.;Fred wants to straighten the paper.;Fred will straighten the paper.;Fred thinks the paper is flat and straight.;Fred wants to make the airplane.;Fred will start to fold the paper to make the airplane.;A bird flies into the classroom through the open window.;Fred sees the bird fly into the classroom.;Fred doesn't see the bird fly into the classroom.;Fred;Paper;auto;0
Isla was in her room playing with her small paperclip. Isla wanted to make a necklace with the paperclip. The paperclip was straight. Isla believed the paperclip was straight. Suddenly, her little brother ran into the room and stepped on the paperclip, bending it.;Isla saw her brother step on the paperclip.;Isla did not see her brother step on the paperclip.;Isla decides to find another paperclip.;Isla starts to make a necklace with the paperclip.;Does Isla think the paperclip is straight or bent?;Does Isla want to make a necklace or find another paperclip?;What will Isla do?;Isla believes the paperclip is bent.;Isla wants to find another paperclip.;Isla will find another paperclip.;Isla believes the paperclip is straight.;Isla wants to make a necklace.;Isla will start to make a necklace with the paperclip.;A jelly falls from the table.;Isla sees the jelly fall from the table.;Isla does not see the jelly fall from the table.;Isla;paperclip;auto;0
